2025-05-25 12:27:17,125 - INFO - A new study created in Journal with name: model-population-mpnn-population_mpnn_ic20_s5_pd_seed
2025-05-25 12:34:44,584 - INFO - Trial 0 finished with value: 0.04149721935391426 and parameters: {'lr': 0.0028057582076672534, 'lamb': 0.0, 'batch_size': 16, 'n_hidden_layers_g_net': 2, 'hidden_dims_g_net': 16, 'af_g_net': 'tanh', 'drop_p_g_net': 0.016730402817820244, 'n_hidden_layers_h_net': 2, 'hidden_dims_h_net': 8, 'af_h_net': 'relu', 'drop_p_h_net': 0.0004705059281907648}. Best is trial 0 with value: 0.04149721935391426.
2025-05-25 12:45:15,663 - INFO - Trial 1 finished with value: 0.01791185326874256 and parameters: {'lr': 0.0011635338541918904, 'lamb': 0.0, 'batch_size': 32, 'n_hidden_layers_g_net': 1, 'hidden_dims_g_net': 24, 'af_g_net': 'relu', 'drop_p_g_net': 0.002265486450485179, 'n_hidden_layers_h_net': 1, 'hidden_dims_h_net': 56, 'af_h_net': 'tanh', 'drop_p_h_net': 0.00014853153980421636}. Best is trial 1 with value: 0.01791185326874256.
2025-05-25 12:51:05,972 - INFO - Trial 2 finished with value: 0.016194339841604233 and parameters: {'lr': 0.008204643365323961, 'lamb': 0.0, 'batch_size': 16, 'n_hidden_layers_g_net': 2, 'hidden_dims_g_net': 64, 'af_g_net': 'relu', 'drop_p_g_net': 0.033959199243313656, 'n_hidden_layers_h_net': 1, 'hidden_dims_h_net': 8, 'af_h_net': 'tanh', 'drop_p_h_net': 0.0009061902594114382}. Best is trial 2 with value: 0.016194339841604233.
2025-05-25 12:54:02,372 - INFO - Trial 3 finished with value: 0.2216615229845047 and parameters: {'lr': 0.010568529720322864, 'lamb': 0.0, 'batch_size': 32, 'n_hidden_layers_g_net': 2, 'hidden_dims_g_net': 16, 'af_g_net': 'relu', 'drop_p_g_net': 0.2041453670307777, 'n_hidden_layers_h_net': 2, 'hidden_dims_h_net': 64, 'af_h_net': 'softplus', 'drop_p_h_net': 0.0015973023661305591}. Best is trial 2 with value: 0.016194339841604233.
2025-05-25 13:06:19,534 - INFO - Trial 4 finished with value: 0.021554511040449142 and parameters: {'lr': 0.0029945018361271503, 'lamb': 0.0, 'batch_size': 32, 'n_hidden_layers_g_net': 1, 'hidden_dims_g_net': 24, 'af_g_net': 'tanh', 'drop_p_g_net': 0.00018869508789698286, 'n_hidden_layers_h_net': 2, 'hidden_dims_h_net': 56, 'af_h_net': 'tanh', 'drop_p_h_net': 0.04117599592262882}. Best is trial 2 with value: 0.016194339841604233.
2025-05-25 13:12:42,994 - INFO - Trial 5 finished with value: 0.055028997361660004 and parameters: {'lr': 0.014354376740977342, 'lamb': 0.0, 'batch_size': 16, 'n_hidden_layers_g_net': 1, 'hidden_dims_g_net': 8, 'af_g_net': 'relu', 'drop_p_g_net': 0.0001718305701918592, 'n_hidden_layers_h_net': 1, 'hidden_dims_h_net': 24, 'af_h_net': 'tanh', 'drop_p_h_net': 0.005580959150991872}. Best is trial 2 with value: 0.016194339841604233.
2025-05-25 13:25:08,179 - INFO - Trial 6 finished with value: 0.0375431589782238 and parameters: {'lr': 0.000867278332118047, 'lamb': 0.0, 'batch_size': 32, 'n_hidden_layers_g_net': 2, 'hidden_dims_g_net': 56, 'af_g_net': 'softplus', 'drop_p_g_net': 0.0001241722605100823, 'n_hidden_layers_h_net': 1, 'hidden_dims_h_net': 8, 'af_h_net': 'relu', 'drop_p_h_net': 0.22754178673650124}. Best is trial 2 with value: 0.016194339841604233.
2025-05-25 13:37:25,111 - INFO - Trial 7 finished with value: 0.17444254457950592 and parameters: {'lr': 0.0015759936475969447, 'lamb': 0.0, 'batch_size': 32, 'n_hidden_layers_g_net': 1, 'hidden_dims_g_net': 8, 'af_g_net': 'tanh', 'drop_p_g_net': 0.0975468037883334, 'n_hidden_layers_h_net': 2, 'hidden_dims_h_net': 56, 'af_h_net': 'tanh', 'drop_p_h_net': 0.009885776211256199}. Best is trial 2 with value: 0.016194339841604233.
2025-05-25 13:46:37,468 - INFO - Trial 8 finished with value: 0.027274329215288162 and parameters: {'lr': 0.020599198123025936, 'lamb': 0.0, 'batch_size': 16, 'n_hidden_layers_g_net': 1, 'hidden_dims_g_net': 16, 'af_g_net': 'tanh', 'drop_p_g_net': 0.00010610008267254209, 'n_hidden_layers_h_net': 2, 'hidden_dims_h_net': 32, 'af_h_net': 'tanh', 'drop_p_h_net': 0.3074643105596185}. Best is trial 2 with value: 0.016194339841604233.
2025-05-25 13:56:24,651 - INFO - Trial 9 finished with value: 0.011492006480693817 and parameters: {'lr': 0.002215010903383992, 'lamb': 0.0, 'batch_size': 32, 'n_hidden_layers_g_net': 1, 'hidden_dims_g_net': 64, 'af_g_net': 'relu', 'drop_p_g_net': 0.0012969996024538206, 'n_hidden_layers_h_net': 1, 'hidden_dims_h_net': 8, 'af_h_net': 'relu', 'drop_p_h_net': 0.0010732599242723982}. Best is trial 9 with value: 0.011492006480693817.
2025-05-25 14:01:24,533 - INFO - Trial 10 finished with value: 0.01852995716035366 and parameters: {'lr': 0.0388367690811853, 'lamb': 0.0, 'batch_size': 32, 'n_hidden_layers_g_net': 1, 'hidden_dims_g_net': 48, 'af_g_net': 'softplus', 'drop_p_g_net': 0.0019236928960641743, 'n_hidden_layers_h_net': 1, 'hidden_dims_h_net': 24, 'af_h_net': 'relu', 'drop_p_h_net': 0.00011105513565315193}. Best is trial 9 with value: 0.011492006480693817.
2025-05-25 14:11:22,139 - INFO - Trial 11 finished with value: 0.010767105966806412 and parameters: {'lr': 0.006097583959609013, 'lamb': 0.0, 'batch_size': 16, 'n_hidden_layers_g_net': 2, 'hidden_dims_g_net': 64, 'af_g_net': 'relu', 'drop_p_g_net': 0.020793388283630174, 'n_hidden_layers_h_net': 1, 'hidden_dims_h_net': 16, 'af_h_net': 'softplus', 'drop_p_h_net': 0.000933182320879717}. Best is trial 11 with value: 0.010767105966806412.
2025-05-25 14:23:12,358 - INFO - Trial 12 finished with value: 0.008831456303596497 and parameters: {'lr': 0.004856830339085826, 'lamb': 0.0, 'batch_size': 16, 'n_hidden_layers_g_net': 2, 'hidden_dims_g_net': 48, 'af_g_net': 'relu', 'drop_p_g_net': 0.0032584659324069857, 'n_hidden_layers_h_net': 1, 'hidden_dims_h_net': 16, 'af_h_net': 'softplus', 'drop_p_h_net': 0.004291404973733279}. Best is trial 12 with value: 0.008831456303596497.
2025-05-25 14:35:07,600 - INFO - Trial 13 finished with value: 0.009612172842025757 and parameters: {'lr': 0.004444515684918873, 'lamb': 0.0, 'batch_size': 16, 'n_hidden_layers_g_net': 2, 'hidden_dims_g_net': 40, 'af_g_net': 'relu', 'drop_p_g_net': 0.007544421118883666, 'n_hidden_layers_h_net': 1, 'hidden_dims_h_net': 24, 'af_h_net': 'softplus', 'drop_p_h_net': 0.006062309930831236}. Best is trial 12 with value: 0.008831456303596497.
2025-05-25 14:46:57,733 - INFO - Trial 14 finished with value: 0.009167549200356007 and parameters: {'lr': 0.004062798829243011, 'lamb': 0.0, 'batch_size': 16, 'n_hidden_layers_g_net': 2, 'hidden_dims_g_net': 40, 'af_g_net': 'relu', 'drop_p_g_net': 0.004947531493603178, 'n_hidden_layers_h_net': 1, 'hidden_dims_h_net': 32, 'af_h_net': 'softplus', 'drop_p_h_net': 0.010416262682324817}. Best is trial 12 with value: 0.008831456303596497.
2025-05-25 14:58:47,330 - INFO - Trial 15 finished with value: 0.01186895277351141 and parameters: {'lr': 0.00468525691980954, 'lamb': 0.0, 'batch_size': 16, 'n_hidden_layers_g_net': 2, 'hidden_dims_g_net': 40, 'af_g_net': 'relu', 'drop_p_g_net': 0.0009764256738193823, 'n_hidden_layers_h_net': 1, 'hidden_dims_h_net': 32, 'af_h_net': 'softplus', 'drop_p_h_net': 0.045797768182926246}. Best is trial 12 with value: 0.008831456303596497.
2025-05-25 15:10:29,021 - INFO - Trial 16 finished with value: 0.017267858609557152 and parameters: {'lr': 0.0005105268277571422, 'lamb': 0.0, 'batch_size': 16, 'n_hidden_layers_g_net': 2, 'hidden_dims_g_net': 48, 'af_g_net': 'softplus', 'drop_p_g_net': 0.004469687169615403, 'n_hidden_layers_h_net': 1, 'hidden_dims_h_net': 40, 'af_h_net': 'softplus', 'drop_p_h_net': 0.021916059516373577}. Best is trial 12 with value: 0.008831456303596497.
2025-05-25 15:16:47,221 - INFO - Trial 17 finished with value: 0.01426001824438572 and parameters: {'lr': 0.019235273387449566, 'lamb': 0.0, 'batch_size': 16, 'n_hidden_layers_g_net': 2, 'hidden_dims_g_net': 32, 'af_g_net': 'relu', 'drop_p_g_net': 0.0005178269936104008, 'n_hidden_layers_h_net': 1, 'hidden_dims_h_net': 40, 'af_h_net': 'softplus', 'drop_p_h_net': 0.0034723588295333644}. Best is trial 12 with value: 0.008831456303596497.
2025-05-25 15:26:55,635 - INFO - Trial 18 finished with value: 0.011702134273946285 and parameters: {'lr': 0.007129892679216654, 'lamb': 0.0, 'batch_size': 16, 'n_hidden_layers_g_net': 2, 'hidden_dims_g_net': 48, 'af_g_net': 'relu', 'drop_p_g_net': 0.005383448696549657, 'n_hidden_layers_h_net': 1, 'hidden_dims_h_net': 16, 'af_h_net': 'softplus', 'drop_p_h_net': 0.016098174537293033}. Best is trial 12 with value: 0.008831456303596497.
2025-05-25 15:38:55,314 - INFO - Trial 19 finished with value: 0.014564773999154568 and parameters: {'lr': 0.00384290474087667, 'lamb': 0.0, 'batch_size': 16, 'n_hidden_layers_g_net': 2, 'hidden_dims_g_net': 32, 'af_g_net': 'softplus', 'drop_p_g_net': 0.0005073898745243696, 'n_hidden_layers_h_net': 1, 'hidden_dims_h_net': 48, 'af_h_net': 'softplus', 'drop_p_h_net': 0.12437938380406142}. Best is trial 12 with value: 0.008831456303596497.
2025-05-25 15:46:26,462 - INFO - Trial 20 finished with value: 0.034398578107357025 and parameters: {'lr': 0.0018265618026664116, 'lamb': 0.0, 'batch_size': 16, 'n_hidden_layers_g_net': 2, 'hidden_dims_g_net': 56, 'af_g_net': 'relu', 'drop_p_g_net': 0.049982520969856184, 'n_hidden_layers_h_net': 2, 'hidden_dims_h_net': 16, 'af_h_net': 'softplus', 'drop_p_h_net': 0.003229217843152723}. Best is trial 12 with value: 0.008831456303596497.
2025-05-25 15:58:18,512 - INFO - Trial 21 finished with value: 0.00896507315337658 and parameters: {'lr': 0.004366104179760562, 'lamb': 0.0, 'batch_size': 16, 'n_hidden_layers_g_net': 2, 'hidden_dims_g_net': 40, 'af_g_net': 'relu', 'drop_p_g_net': 0.00858204895768426, 'n_hidden_layers_h_net': 1, 'hidden_dims_h_net': 24, 'af_h_net': 'softplus', 'drop_p_h_net': 0.007613512039035519}. Best is trial 12 with value: 0.008831456303596497.
2025-05-25 16:07:59,786 - INFO - Trial 22 finished with value: 0.011254177428781986 and parameters: {'lr': 0.010998101150111479, 'lamb': 0.0, 'batch_size': 16, 'n_hidden_layers_g_net': 2, 'hidden_dims_g_net': 40, 'af_g_net': 'relu', 'drop_p_g_net': 0.009001583544305962, 'n_hidden_layers_h_net': 1, 'hidden_dims_h_net': 32, 'af_h_net': 'softplus', 'drop_p_h_net': 0.014265974695449117}. Best is trial 12 with value: 0.008831456303596497.
2025-05-25 16:19:43,638 - INFO - Trial 23 finished with value: 0.01262726355344057 and parameters: {'lr': 0.00342645643570633, 'lamb': 0.0, 'batch_size': 16, 'n_hidden_layers_g_net': 2, 'hidden_dims_g_net': 48, 'af_g_net': 'relu', 'drop_p_g_net': 0.013302141640598708, 'n_hidden_layers_h_net': 1, 'hidden_dims_h_net': 24, 'af_h_net': 'softplus', 'drop_p_h_net': 0.03892203278936685}. Best is trial 12 with value: 0.008831456303596497.
2025-05-25 16:28:37,540 - INFO - Trial 24 finished with value: 0.009528801776468754 and parameters: {'lr': 0.005551629335645715, 'lamb': 0.0, 'batch_size': 16, 'n_hidden_layers_g_net': 2, 'hidden_dims_g_net': 32, 'af_g_net': 'relu', 'drop_p_g_net': 0.003970095566283347, 'n_hidden_layers_h_net': 1, 'hidden_dims_h_net': 16, 'af_h_net': 'softplus', 'drop_p_h_net': 0.0026468023663322056}. Best is trial 12 with value: 0.008831456303596497.
2025-05-25 16:40:24,378 - INFO - Trial 25 finished with value: 0.009275826625525951 and parameters: {'lr': 0.0028140834091976287, 'lamb': 0.0, 'batch_size': 16, 'n_hidden_layers_g_net': 2, 'hidden_dims_g_net': 56, 'af_g_net': 'relu', 'drop_p_g_net': 0.0026330968187554963, 'n_hidden_layers_h_net': 1, 'hidden_dims_h_net': 40, 'af_h_net': 'softplus', 'drop_p_h_net': 0.008103440311594889}. Best is trial 12 with value: 0.008831456303596497.
2025-05-25 16:50:04,912 - INFO - Trial 26 finished with value: 0.015066764317452908 and parameters: {'lr': 0.007840267900454787, 'lamb': 0.0, 'batch_size': 16, 'n_hidden_layers_g_net': 2, 'hidden_dims_g_net': 40, 'af_g_net': 'relu', 'drop_p_g_net': 0.0007743157155070579, 'n_hidden_layers_h_net': 1, 'hidden_dims_h_net': 32, 'af_h_net': 'softplus', 'drop_p_h_net': 0.08157230505460664}. Best is trial 12 with value: 0.008831456303596497.
2025-05-25 16:56:21,078 - INFO - Trial 27 finished with value: 0.015658706426620483 and parameters: {'lr': 0.002176068976589487, 'lamb': 0.0, 'batch_size': 16, 'n_hidden_layers_g_net': 2, 'hidden_dims_g_net': 48, 'af_g_net': 'relu', 'drop_p_g_net': 0.03141070998459672, 'n_hidden_layers_h_net': 1, 'hidden_dims_h_net': 24, 'af_h_net': 'softplus', 'drop_p_h_net': 0.0003511486711071915}. Best is trial 12 with value: 0.008831456303596497.
2025-05-25 17:08:00,920 - INFO - Trial 28 finished with value: 0.009190915152430534 and parameters: {'lr': 0.0012291013559313228, 'lamb': 0.0, 'batch_size': 16, 'n_hidden_layers_g_net': 2, 'hidden_dims_g_net': 32, 'af_g_net': 'softplus', 'drop_p_g_net': 0.010973103245601565, 'n_hidden_layers_h_net': 1, 'hidden_dims_h_net': 16, 'af_h_net': 'softplus', 'drop_p_h_net': 0.0017275222278637897}. Best is trial 12 with value: 0.008831456303596497.
2025-05-25 17:21:35,669 - INFO - Trial 29 finished with value: 0.18985572457313538 and parameters: {'lr': 0.004364298440871781, 'lamb': 0.0, 'batch_size': 16, 'n_hidden_layers_g_net': 2, 'hidden_dims_g_net': 24, 'af_g_net': 'tanh', 'drop_p_g_net': 0.4936388099679684, 'n_hidden_layers_h_net': 2, 'hidden_dims_h_net': 48, 'af_h_net': 'relu', 'drop_p_h_net': 0.022662309537323396}. Best is trial 12 with value: 0.008831456303596497.
