A new study created in Journal with name: model-kuramoto-mpnn-kuramoto_mpnn_ic1_s5
Trial 0 finished with value: 0.004424529615789652 and parameters: {'lr': 0.04944054672192729, 'lamb': 0.0, 'batch_size': 16, 'n_hidden_layers_g_net': 2, 'hidden_dims_g_net': 24, 'af_g_net': 'tanh', 'drop_p_g_net': 0.00018755893287623304, 'n_hidden_layers_h_net': 1, 'hidden_dims_h_net': 24, 'af_h_net': 'softplus', 'drop_p_h_net': 0.010473066470253622}. Best is trial 0 with value: 0.004424529615789652.
Trial 4 finished with value: 0.00509274285286665 and parameters: {'lr': 0.00092776411507332, 'lamb': 0.0, 'batch_size': 32, 'n_hidden_layers_g_net': 2, 'hidden_dims_g_net': 48, 'af_g_net': 'tanh', 'drop_p_g_net': 0.16911237186807876, 'n_hidden_layers_h_net': 2, 'hidden_dims_h_net': 64, 'af_h_net': 'tanh', 'drop_p_h_net': 0.0001633158908625349}. Best is trial 3 with value: 0.004067613743245602.
Trial 6 finished with value: 0.005003625061362982 and parameters: {'lr': 0.002124522980719644, 'lamb': 0.0, 'batch_size': 32, 'n_hidden_layers_g_net': 1, 'hidden_dims_g_net': 32, 'af_g_net': 'relu', 'drop_p_g_net': 0.027032661393135378, 'n_hidden_layers_h_net': 1, 'hidden_dims_h_net': 40, 'af_h_net': 'tanh', 'drop_p_h_net': 0.0011285506442948862}. Best is trial 3 with value: 0.004067613743245602.
Trial 9 finished with value: 0.0026702703908085823 and parameters: {'lr': 0.017638754222410902, 'lamb': 0.0, 'batch_size': 16, 'n_hidden_layers_g_net': 2, 'hidden_dims_g_net': 48, 'af_g_net': 'relu', 'drop_p_g_net': 0.0018582523760735112, 'n_hidden_layers_h_net': 1, 'hidden_dims_h_net': 64, 'af_h_net': 'tanh', 'drop_p_h_net': 0.0002191937510327684}. Best is trial 9 with value: 0.0026702703908085823.
Trial 11 finished with value: 0.014112558215856552 and parameters: {'lr': 0.0005549138204291594, 'lamb': 0.0, 'batch_size': 32, 'n_hidden_layers_g_net': 2, 'hidden_dims_g_net': 32, 'af_g_net': 'relu', 'drop_p_g_net': 0.08677120658714702, 'n_hidden_layers_h_net': 1, 'hidden_dims_h_net': 56, 'af_h_net': 'softplus', 'drop_p_h_net': 0.33102255964735644}. Best is trial 9 with value: 0.0026702703908085823.
Trial 13 finished with value: 0.00410264590755105 and parameters: {'lr': 0.008135967191976757, 'lamb': 0.0, 'batch_size': 16, 'n_hidden_layers_g_net': 2, 'hidden_dims_g_net': 56, 'af_g_net': 'softplus', 'drop_p_g_net': 0.000394262139831382, 'n_hidden_layers_h_net': 2, 'hidden_dims_h_net': 48, 'af_h_net': 'relu', 'drop_p_h_net': 0.0001487519688032893}. Best is trial 9 with value: 0.0026702703908085823.
Trial 15 finished with value: 0.0036391715984791517 and parameters: {'lr': 0.025693246570682605, 'lamb': 0.0, 'batch_size': 16, 'n_hidden_layers_g_net': 2, 'hidden_dims_g_net': 64, 'af_g_net': 'softplus', 'drop_p_g_net': 0.0025895689794439123, 'n_hidden_layers_h_net': 1, 'hidden_dims_h_net': 40, 'af_h_net': 'tanh', 'drop_p_h_net': 0.0007524448692915035}. Best is trial 14 with value: 0.0018739465158432722.
Trial 18 finished with value: 0.004721689969301224 and parameters: {'lr': 0.038287019826518776, 'lamb': 0.0, 'batch_size': 16, 'n_hidden_layers_g_net': 1, 'hidden_dims_g_net': 48, 'af_g_net': 'softplus', 'drop_p_g_net': 0.005439557247872092, 'n_hidden_layers_h_net': 2, 'hidden_dims_h_net': 32, 'af_h_net': 'tanh', 'drop_p_h_net': 0.0005268230356232789}. Best is trial 14 with value: 0.0018739465158432722.
Trial 21 finished with value: 0.007545147556811571 and parameters: {'lr': 0.0049713364765027294, 'lamb': 0.0, 'batch_size': 16, 'n_hidden_layers_g_net': 1, 'hidden_dims_g_net': 56, 'af_g_net': 'relu', 'drop_p_g_net': 0.0001377286709504895, 'n_hidden_layers_h_net': 2, 'hidden_dims_h_net': 8, 'af_h_net': 'tanh', 'drop_p_h_net': 0.0019406813100990533}. Best is trial 14 with value: 0.0018739465158432722.
Trial 24 finished with value: 0.005349951796233654 and parameters: {'lr': 0.016979044098107292, 'lamb': 0.0, 'batch_size': 16, 'n_hidden_layers_g_net': 2, 'hidden_dims_g_net': 48, 'af_g_net': 'relu', 'drop_p_g_net': 0.000852693117112168, 'n_hidden_layers_h_net': 2, 'hidden_dims_h_net': 56, 'af_h_net': 'tanh', 'drop_p_h_net': 0.00012473389553280124}. Best is trial 14 with value: 0.0018739465158432722.
