2025-05-24 10:36:02,529 - INFO - A new study created in Journal with name: model-epidemics-mpnn-epidemics_mpnn_ic1_s5_pd_seed
2025-05-24 10:36:23,875 - INFO - Trial 0 finished with value: 0.01737472228705883 and parameters: {'lr': 0.0028057582076672534, 'lamb': 0.0, 'batch_size': 16, 'n_hidden_layers_g_net': 2, 'hidden_dims_g_net': 16, 'af_g_net': 'tanh', 'drop_p_g_net': 0.016730402817820244, 'n_hidden_layers_h_net': 2, 'hidden_dims_h_net': 8, 'af_h_net': 'relu', 'drop_p_h_net': 0.0004705059281907648}. Best is trial 0 with value: 0.01737472228705883.
2025-05-24 10:36:55,943 - INFO - Trial 1 finished with value: 0.008608137257397175 and parameters: {'lr': 0.0011635338541918904, 'lamb': 0.0, 'batch_size': 32, 'n_hidden_layers_g_net': 1, 'hidden_dims_g_net': 24, 'af_g_net': 'relu', 'drop_p_g_net': 0.002265486450485179, 'n_hidden_layers_h_net': 1, 'hidden_dims_h_net': 56, 'af_h_net': 'tanh', 'drop_p_h_net': 0.00014853153980421636}. Best is trial 1 with value: 0.008608137257397175.
2025-05-24 10:37:12,088 - INFO - Trial 2 finished with value: 0.0034887520596385 and parameters: {'lr': 0.008204643365323961, 'lamb': 0.0, 'batch_size': 16, 'n_hidden_layers_g_net': 2, 'hidden_dims_g_net': 64, 'af_g_net': 'relu', 'drop_p_g_net': 0.033959199243313656, 'n_hidden_layers_h_net': 1, 'hidden_dims_h_net': 8, 'af_h_net': 'tanh', 'drop_p_h_net': 0.0009061902594114382}. Best is trial 2 with value: 0.0034887520596385.
2025-05-24 10:37:27,119 - INFO - Trial 3 finished with value: 0.012403839267790318 and parameters: {'lr': 0.010568529720322864, 'lamb': 0.0, 'batch_size': 32, 'n_hidden_layers_g_net': 2, 'hidden_dims_g_net': 16, 'af_g_net': 'relu', 'drop_p_g_net': 0.2041453670307777, 'n_hidden_layers_h_net': 2, 'hidden_dims_h_net': 64, 'af_h_net': 'softplus', 'drop_p_h_net': 0.0015973023661305591}. Best is trial 2 with value: 0.0034887520596385.
2025-05-24 10:37:43,924 - INFO - Trial 4 finished with value: 0.02038784697651863 and parameters: {'lr': 0.0029945018361271503, 'lamb': 0.0, 'batch_size': 32, 'n_hidden_layers_g_net': 1, 'hidden_dims_g_net': 24, 'af_g_net': 'tanh', 'drop_p_g_net': 0.00018869508789698286, 'n_hidden_layers_h_net': 2, 'hidden_dims_h_net': 56, 'af_h_net': 'tanh', 'drop_p_h_net': 0.04117599592262882}. Best is trial 2 with value: 0.0034887520596385.
2025-05-24 10:37:54,403 - INFO - Trial 5 finished with value: 0.01741134561598301 and parameters: {'lr': 0.014354376740977342, 'lamb': 0.0, 'batch_size': 16, 'n_hidden_layers_g_net': 1, 'hidden_dims_g_net': 8, 'af_g_net': 'relu', 'drop_p_g_net': 0.0001718305701918592, 'n_hidden_layers_h_net': 1, 'hidden_dims_h_net': 24, 'af_h_net': 'tanh', 'drop_p_h_net': 0.005580959150991872}. Best is trial 2 with value: 0.0034887520596385.
2025-05-24 10:38:32,485 - INFO - Trial 6 finished with value: 0.019715458154678345 and parameters: {'lr': 0.000867278332118047, 'lamb': 0.0, 'batch_size': 32, 'n_hidden_layers_g_net': 2, 'hidden_dims_g_net': 56, 'af_g_net': 'softplus', 'drop_p_g_net': 0.0001241722605100823, 'n_hidden_layers_h_net': 1, 'hidden_dims_h_net': 8, 'af_h_net': 'relu', 'drop_p_h_net': 0.22754178673650124}. Best is trial 2 with value: 0.0034887520596385.
2025-05-24 10:38:42,823 - INFO - Trial 7 finished with value: 0.06273170560598373 and parameters: {'lr': 0.0015759936475969447, 'lamb': 0.0, 'batch_size': 32, 'n_hidden_layers_g_net': 1, 'hidden_dims_g_net': 8, 'af_g_net': 'tanh', 'drop_p_g_net': 0.0975468037883334, 'n_hidden_layers_h_net': 2, 'hidden_dims_h_net': 56, 'af_h_net': 'tanh', 'drop_p_h_net': 0.009885776211256199}. Best is trial 2 with value: 0.0034887520596385.
2025-05-24 10:38:57,900 - INFO - Trial 8 finished with value: 0.015242618508636951 and parameters: {'lr': 0.020599198123025936, 'lamb': 0.0, 'batch_size': 16, 'n_hidden_layers_g_net': 1, 'hidden_dims_g_net': 16, 'af_g_net': 'tanh', 'drop_p_g_net': 0.00010610008267254209, 'n_hidden_layers_h_net': 2, 'hidden_dims_h_net': 32, 'af_h_net': 'tanh', 'drop_p_h_net': 0.3074643105596185}. Best is trial 2 with value: 0.0034887520596385.
2025-05-24 10:39:17,595 - INFO - Trial 9 finished with value: 0.004429189022630453 and parameters: {'lr': 0.002215010903383992, 'lamb': 0.0, 'batch_size': 32, 'n_hidden_layers_g_net': 1, 'hidden_dims_g_net': 64, 'af_g_net': 'relu', 'drop_p_g_net': 0.0012969996024538206, 'n_hidden_layers_h_net': 1, 'hidden_dims_h_net': 8, 'af_h_net': 'relu', 'drop_p_h_net': 0.0010732599242723982}. Best is trial 2 with value: 0.0034887520596385.
2025-05-24 10:39:35,079 - INFO - Trial 10 finished with value: 0.014493057504296303 and parameters: {'lr': 0.040644443622328164, 'lamb': 0.0, 'batch_size': 16, 'n_hidden_layers_g_net': 2, 'hidden_dims_g_net': 48, 'af_g_net': 'softplus', 'drop_p_g_net': 0.035744005701785715, 'n_hidden_layers_h_net': 1, 'hidden_dims_h_net': 24, 'af_h_net': 'softplus', 'drop_p_h_net': 0.00011105513565315193}. Best is trial 2 with value: 0.0034887520596385.
2025-05-24 10:39:51,226 - INFO - Trial 11 finished with value: 0.003475989680737257 and parameters: {'lr': 0.006097583959609013, 'lamb': 0.0, 'batch_size': 16, 'n_hidden_layers_g_net': 2, 'hidden_dims_g_net': 64, 'af_g_net': 'relu', 'drop_p_g_net': 0.002424667842638818, 'n_hidden_layers_h_net': 1, 'hidden_dims_h_net': 16, 'af_h_net': 'relu', 'drop_p_h_net': 0.000933182320879717}. Best is trial 11 with value: 0.003475989680737257.
2025-05-24 10:40:14,723 - INFO - Trial 12 finished with value: 0.004079826176166534 and parameters: {'lr': 0.00658415044022175, 'lamb': 0.0, 'batch_size': 16, 'n_hidden_layers_g_net': 2, 'hidden_dims_g_net': 48, 'af_g_net': 'relu', 'drop_p_g_net': 0.004410964282723648, 'n_hidden_layers_h_net': 1, 'hidden_dims_h_net': 16, 'af_h_net': 'relu', 'drop_p_h_net': 0.0037596505299927236}. Best is trial 11 with value: 0.003475989680737257.
2025-05-24 10:40:41,033 - INFO - Trial 13 finished with value: 0.003242842387408018 and parameters: {'lr': 0.005731181713401878, 'lamb': 0.0, 'batch_size': 16, 'n_hidden_layers_g_net': 2, 'hidden_dims_g_net': 64, 'af_g_net': 'relu', 'drop_p_g_net': 0.01356883984285911, 'n_hidden_layers_h_net': 1, 'hidden_dims_h_net': 24, 'af_h_net': 'relu', 'drop_p_h_net': 0.0005305611570338094}. Best is trial 13 with value: 0.003242842387408018.
2025-05-24 10:41:11,345 - INFO - Trial 14 finished with value: 0.004163314588367939 and parameters: {'lr': 0.004522567097114725, 'lamb': 0.0, 'batch_size': 16, 'n_hidden_layers_g_net': 2, 'hidden_dims_g_net': 40, 'af_g_net': 'relu', 'drop_p_g_net': 0.000931744159359553, 'n_hidden_layers_h_net': 1, 'hidden_dims_h_net': 32, 'af_h_net': 'relu', 'drop_p_h_net': 0.0003585585106252492}. Best is trial 13 with value: 0.003242842387408018.
2025-05-24 10:41:40,117 - INFO - Trial 15 finished with value: 0.002387576038017869 and parameters: {'lr': 0.004360350039846077, 'lamb': 0.0, 'batch_size': 16, 'n_hidden_layers_g_net': 2, 'hidden_dims_g_net': 56, 'af_g_net': 'relu', 'drop_p_g_net': 0.010304889977975455, 'n_hidden_layers_h_net': 1, 'hidden_dims_h_net': 24, 'af_h_net': 'relu', 'drop_p_h_net': 0.01361813666537171}. Best is trial 15 with value: 0.002387576038017869.
2025-05-24 10:42:18,381 - INFO - Trial 16 finished with value: 0.024788619950413704 and parameters: {'lr': 0.0005118020803244208, 'lamb': 0.0, 'batch_size': 16, 'n_hidden_layers_g_net': 2, 'hidden_dims_g_net': 56, 'af_g_net': 'softplus', 'drop_p_g_net': 0.012537360608878867, 'n_hidden_layers_h_net': 1, 'hidden_dims_h_net': 40, 'af_h_net': 'relu', 'drop_p_h_net': 0.02618498084582526}. Best is trial 15 with value: 0.002387576038017869.
2025-05-24 10:42:53,063 - INFO - Trial 17 finished with value: 0.005637276917695999 and parameters: {'lr': 0.021628719859925195, 'lamb': 0.0, 'batch_size': 16, 'n_hidden_layers_g_net': 2, 'hidden_dims_g_net': 40, 'af_g_net': 'relu', 'drop_p_g_net': 0.06088507235653425, 'n_hidden_layers_h_net': 1, 'hidden_dims_h_net': 40, 'af_h_net': 'relu', 'drop_p_h_net': 0.06744838441301797}. Best is trial 15 with value: 0.002387576038017869.
2025-05-24 10:43:21,626 - INFO - Trial 18 finished with value: 0.003801879473030567 and parameters: {'lr': 0.004472224831523708, 'lamb': 0.0, 'batch_size': 16, 'n_hidden_layers_g_net': 2, 'hidden_dims_g_net': 56, 'af_g_net': 'relu', 'drop_p_g_net': 0.009798844403114492, 'n_hidden_layers_h_net': 1, 'hidden_dims_h_net': 24, 'af_h_net': 'softplus', 'drop_p_h_net': 0.019232139724826913}. Best is trial 15 with value: 0.002387576038017869.
2025-05-24 10:43:30,547 - INFO - Trial 19 finished with value: 0.046115439385175705 and parameters: {'lr': 0.003865894900870661, 'lamb': 0.0, 'batch_size': 16, 'n_hidden_layers_g_net': 2, 'hidden_dims_g_net': 48, 'af_g_net': 'softplus', 'drop_p_g_net': 0.279926706743702, 'n_hidden_layers_h_net': 1, 'hidden_dims_h_net': 40, 'af_h_net': 'relu', 'drop_p_h_net': 0.002578001839890245}. Best is trial 15 with value: 0.002387576038017869.
2025-05-24 10:44:15,048 - INFO - Trial 20 finished with value: 0.003679450135678053 and parameters: {'lr': 0.01170019195290584, 'lamb': 0.0, 'batch_size': 16, 'n_hidden_layers_g_net': 2, 'hidden_dims_g_net': 32, 'af_g_net': 'relu', 'drop_p_g_net': 0.0005622178249852127, 'n_hidden_layers_h_net': 2, 'hidden_dims_h_net': 16, 'af_h_net': 'relu', 'drop_p_h_net': 0.010751699023833395}. Best is trial 15 with value: 0.002387576038017869.
2025-05-24 10:44:36,429 - INFO - Trial 21 finished with value: 0.003193815005943179 and parameters: {'lr': 0.006177108824944756, 'lamb': 0.0, 'batch_size': 16, 'n_hidden_layers_g_net': 2, 'hidden_dims_g_net': 64, 'af_g_net': 'relu', 'drop_p_g_net': 0.0046656130833911385, 'n_hidden_layers_h_net': 1, 'hidden_dims_h_net': 16, 'af_h_net': 'relu', 'drop_p_h_net': 0.00041728365319628884}. Best is trial 15 with value: 0.002387576038017869.
2025-05-24 10:44:55,621 - INFO - Trial 22 finished with value: 0.004376234021037817 and parameters: {'lr': 0.00833841564013213, 'lamb': 0.0, 'batch_size': 16, 'n_hidden_layers_g_net': 2, 'hidden_dims_g_net': 64, 'af_g_net': 'relu', 'drop_p_g_net': 0.004526990352446074, 'n_hidden_layers_h_net': 1, 'hidden_dims_h_net': 24, 'af_h_net': 'relu', 'drop_p_h_net': 0.00029794652429246545}. Best is trial 15 with value: 0.002387576038017869.
2025-05-24 10:45:20,859 - INFO - Trial 23 finished with value: 0.0036035797093063593 and parameters: {'lr': 0.0020827405518076794, 'lamb': 0.0, 'batch_size': 16, 'n_hidden_layers_g_net': 2, 'hidden_dims_g_net': 56, 'af_g_net': 'relu', 'drop_p_g_net': 0.022477153511984503, 'n_hidden_layers_h_net': 1, 'hidden_dims_h_net': 32, 'af_h_net': 'relu', 'drop_p_h_net': 0.13899129687941614}. Best is trial 15 with value: 0.002387576038017869.
2025-05-24 10:45:35,473 - INFO - Trial 24 finished with value: 0.0043776025995612144 and parameters: {'lr': 0.018433819971238302, 'lamb': 0.0, 'batch_size': 16, 'n_hidden_layers_g_net': 2, 'hidden_dims_g_net': 64, 'af_g_net': 'relu', 'drop_p_g_net': 0.006668395906886755, 'n_hidden_layers_h_net': 1, 'hidden_dims_h_net': 16, 'af_h_net': 'relu', 'drop_p_h_net': 0.002144233595230619}. Best is trial 15 with value: 0.002387576038017869.
2025-05-24 10:45:59,376 - INFO - Trial 25 finished with value: 0.003133057849481702 and parameters: {'lr': 0.005758128746324006, 'lamb': 0.0, 'batch_size': 16, 'n_hidden_layers_g_net': 2, 'hidden_dims_g_net': 56, 'af_g_net': 'relu', 'drop_p_g_net': 0.006722861172199694, 'n_hidden_layers_h_net': 1, 'hidden_dims_h_net': 24, 'af_h_net': 'softplus', 'drop_p_h_net': 0.0001952038874110204}. Best is trial 15 with value: 0.002387576038017869.
2025-05-24 10:46:38,038 - INFO - Trial 26 finished with value: 0.00269660004414618 and parameters: {'lr': 0.003191954616254926, 'lamb': 0.0, 'batch_size': 16, 'n_hidden_layers_g_net': 2, 'hidden_dims_g_net': 48, 'af_g_net': 'relu', 'drop_p_g_net': 0.002998541744110387, 'n_hidden_layers_h_net': 1, 'hidden_dims_h_net': 16, 'af_h_net': 'softplus', 'drop_p_h_net': 0.00016849935399722063}. Best is trial 15 with value: 0.002387576038017869.
2025-05-24 10:47:01,332 - INFO - Trial 27 finished with value: 0.005130337085574865 and parameters: {'lr': 0.003303375026628946, 'lamb': 0.0, 'batch_size': 16, 'n_hidden_layers_g_net': 2, 'hidden_dims_g_net': 48, 'af_g_net': 'relu', 'drop_p_g_net': 0.00046516626046207843, 'n_hidden_layers_h_net': 1, 'hidden_dims_h_net': 32, 'af_h_net': 'softplus', 'drop_p_h_net': 0.00015445080631980556}. Best is trial 15 with value: 0.002387576038017869.
2025-05-24 10:47:31,764 - INFO - Trial 28 finished with value: 0.023672157898545265 and parameters: {'lr': 0.0016725395411763605, 'lamb': 0.0, 'batch_size': 16, 'n_hidden_layers_g_net': 2, 'hidden_dims_g_net': 40, 'af_g_net': 'softplus', 'drop_p_g_net': 0.002698321687319547, 'n_hidden_layers_h_net': 1, 'hidden_dims_h_net': 48, 'af_h_net': 'softplus', 'drop_p_h_net': 0.00020800773871220156}. Best is trial 15 with value: 0.002387576038017869.
2025-05-24 10:48:15,855 - INFO - Trial 29 finished with value: 0.011823771521449089 and parameters: {'lr': 0.00261573143760044, 'lamb': 0.0, 'batch_size': 16, 'n_hidden_layers_g_net': 2, 'hidden_dims_g_net': 56, 'af_g_net': 'tanh', 'drop_p_g_net': 0.007804259666841265, 'n_hidden_layers_h_net': 2, 'hidden_dims_h_net': 24, 'af_h_net': 'softplus', 'drop_p_h_net': 0.004818581655711132}. Best is trial 15 with value: 0.002387576038017869.
