2025-07-29 05:57:55,746 - INFO - A new study created in Journal with name: model-biochemical-llc-biochemical_llc_70db_3
2025-07-29 06:08:32,377 - INFO - Trial 0 finished with value: 0.2942361831665039 and parameters: {'lr': 0.0028057582076672534, 'lamb': 0.009600000000000001, 'batch_size': 16, 'n_hidden_layers_g0': 1, 'hidden_dims_g0': 8, 'af_g0': 'relu', 'drop_p_g0': 0.0, 'n_hidden_layers_g1': 1, 'hidden_dims_g1': 64, 'af_g1': 'relu', 'drop_p_g1': 0.0, 'n_hidden_layers_g2': 1, 'hidden_dims_g2': 24, 'af_g2': 'relu', 'drop_p_g2': 0.0, 'n_hidden_layers_h_net': 2, 'hidden_dims_h_net': 16, 'af_h_net': 'tanh', 'drop_p_h_net': 0.0}. Best is trial 0 with value: 0.2942361831665039.
2025-07-29 06:12:55,375 - INFO - Trial 1 finished with value: 0.2945389151573181 and parameters: {'lr': 0.018591820902866044, 'lamb': 0.002, 'batch_size': 32, 'n_hidden_layers_g0': 2, 'hidden_dims_g0': 16, 'af_g0': 'tanh', 'drop_p_g0': 0.0, 'n_hidden_layers_g1': 2, 'hidden_dims_g1': 24, 'af_g1': 'softplus', 'drop_p_g1': 0.0, 'n_hidden_layers_g2': 1, 'hidden_dims_g2': 32, 'af_g2': 'softplus', 'drop_p_g2': 0.0, 'n_hidden_layers_h_net': 2, 'hidden_dims_h_net': 24, 'af_h_net': 'softplus', 'drop_p_h_net': 0.0}. Best is trial 0 with value: 0.2942361831665039.
2025-07-29 06:17:31,379 - INFO - Trial 2 finished with value: 0.2946183681488037 and parameters: {'lr': 0.04346495755569776, 'lamb': 0.0078000000000000005, 'batch_size': 16, 'n_hidden_layers_g0': 2, 'hidden_dims_g0': 8, 'af_g0': 'tanh', 'drop_p_g0': 0.0, 'n_hidden_layers_g1': 1, 'hidden_dims_g1': 24, 'af_g1': 'relu', 'drop_p_g1': 0.0, 'n_hidden_layers_g2': 2, 'hidden_dims_g2': 16, 'af_g2': 'tanh', 'drop_p_g2': 0.0, 'n_hidden_layers_h_net': 2, 'hidden_dims_h_net': 16, 'af_h_net': 'softplus', 'drop_p_h_net': 0.0}. Best is trial 0 with value: 0.2942361831665039.
2025-07-29 06:21:48,475 - INFO - Trial 3 finished with value: 0.29429659247398376 and parameters: {'lr': 0.014354376740977342, 'lamb': 0.0077, 'batch_size': 32, 'n_hidden_layers_g0': 2, 'hidden_dims_g0': 40, 'af_g0': 'relu', 'drop_p_g0': 0.0, 'n_hidden_layers_g1': 1, 'hidden_dims_g1': 48, 'af_g1': 'softplus', 'drop_p_g1': 0.0, 'n_hidden_layers_g2': 1, 'hidden_dims_g2': 48, 'af_g2': 'tanh', 'drop_p_g2': 0.0, 'n_hidden_layers_h_net': 1, 'hidden_dims_h_net': 40, 'af_h_net': 'relu', 'drop_p_h_net': 0.0}. Best is trial 0 with value: 0.2942361831665039.
2025-07-29 06:26:48,447 - INFO - Trial 4 finished with value: 0.29430922865867615 and parameters: {'lr': 0.0005778676408134936, 'lamb': 0.0064, 'batch_size': 64, 'n_hidden_layers_g0': 1, 'hidden_dims_g0': 32, 'af_g0': 'relu', 'drop_p_g0': 0.0, 'n_hidden_layers_g1': 1, 'hidden_dims_g1': 16, 'af_g1': 'relu', 'drop_p_g1': 0.0, 'n_hidden_layers_g2': 2, 'hidden_dims_g2': 56, 'af_g2': 'softplus', 'drop_p_g2': 0.0, 'n_hidden_layers_h_net': 2, 'hidden_dims_h_net': 64, 'af_h_net': 'relu', 'drop_p_h_net': 0.0}. Best is trial 0 with value: 0.2942361831665039.
2025-07-29 06:34:53,367 - INFO - Trial 5 finished with value: 0.2942552864551544 and parameters: {'lr': 0.0035742553967564933, 'lamb': 0.0082, 'batch_size': 16, 'n_hidden_layers_g0': 1, 'hidden_dims_g0': 16, 'af_g0': 'tanh', 'drop_p_g0': 0.0, 'n_hidden_layers_g1': 1, 'hidden_dims_g1': 40, 'af_g1': 'tanh', 'drop_p_g1': 0.0, 'n_hidden_layers_g2': 2, 'hidden_dims_g2': 24, 'af_g2': 'relu', 'drop_p_g2': 0.0, 'n_hidden_layers_h_net': 1, 'hidden_dims_h_net': 40, 'af_h_net': 'relu', 'drop_p_h_net': 0.0}. Best is trial 0 with value: 0.2942361831665039.
2025-07-29 06:38:06,106 - INFO - Trial 6 finished with value: 0.29428043961524963 and parameters: {'lr': 0.032771911717731424, 'lamb': 0.0024000000000000002, 'batch_size': 64, 'n_hidden_layers_g0': 1, 'hidden_dims_g0': 48, 'af_g0': 'relu', 'drop_p_g0': 0.0, 'n_hidden_layers_g1': 1, 'hidden_dims_g1': 48, 'af_g1': 'relu', 'drop_p_g1': 0.0, 'n_hidden_layers_g2': 2, 'hidden_dims_g2': 24, 'af_g2': 'tanh', 'drop_p_g2': 0.0, 'n_hidden_layers_h_net': 2, 'hidden_dims_h_net': 8, 'af_h_net': 'tanh', 'drop_p_h_net': 0.0}. Best is trial 0 with value: 0.2942361831665039.
2025-07-29 06:42:10,112 - INFO - Trial 7 finished with value: 0.2942655384540558 and parameters: {'lr': 0.0011160993683450788, 'lamb': 0.006900000000000001, 'batch_size': 32, 'n_hidden_layers_g0': 1, 'hidden_dims_g0': 8, 'af_g0': 'relu', 'drop_p_g0': 0.0, 'n_hidden_layers_g1': 2, 'hidden_dims_g1': 56, 'af_g1': 'relu', 'drop_p_g1': 0.0, 'n_hidden_layers_g2': 1, 'hidden_dims_g2': 64, 'af_g2': 'relu', 'drop_p_g2': 0.0, 'n_hidden_layers_h_net': 1, 'hidden_dims_h_net': 48, 'af_h_net': 'relu', 'drop_p_h_net': 0.0}. Best is trial 0 with value: 0.2942361831665039.
2025-07-29 06:46:40,936 - INFO - Trial 8 finished with value: 0.29428157210350037 and parameters: {'lr': 0.009616860064438593, 'lamb': 0.0008, 'batch_size': 32, 'n_hidden_layers_g0': 1, 'hidden_dims_g0': 8, 'af_g0': 'relu', 'drop_p_g0': 0.0, 'n_hidden_layers_g1': 2, 'hidden_dims_g1': 48, 'af_g1': 'tanh', 'drop_p_g1': 0.0, 'n_hidden_layers_g2': 1, 'hidden_dims_g2': 24, 'af_g2': 'tanh', 'drop_p_g2': 0.0, 'n_hidden_layers_h_net': 2, 'hidden_dims_h_net': 40, 'af_h_net': 'softplus', 'drop_p_h_net': 0.0}. Best is trial 0 with value: 0.2942361831665039.
2025-07-29 06:51:45,487 - INFO - Trial 9 finished with value: 0.2942562699317932 and parameters: {'lr': 0.0015379750534360189, 'lamb': 0.0098, 'batch_size': 32, 'n_hidden_layers_g0': 2, 'hidden_dims_g0': 40, 'af_g0': 'relu', 'drop_p_g0': 0.0, 'n_hidden_layers_g1': 2, 'hidden_dims_g1': 24, 'af_g1': 'softplus', 'drop_p_g1': 0.0, 'n_hidden_layers_g2': 2, 'hidden_dims_g2': 64, 'af_g2': 'relu', 'drop_p_g2': 0.0, 'n_hidden_layers_h_net': 2, 'hidden_dims_h_net': 32, 'af_h_net': 'relu', 'drop_p_h_net': 0.0}. Best is trial 0 with value: 0.2942361831665039.
2025-07-29 06:56:12,427 - INFO - Trial 10 finished with value: 0.2942900061607361 and parameters: {'lr': 0.0036350811762907134, 'lamb': 0.0047, 'batch_size': 16, 'n_hidden_layers_g0': 1, 'hidden_dims_g0': 64, 'af_g0': 'softplus', 'drop_p_g0': 0.0, 'n_hidden_layers_g1': 1, 'hidden_dims_g1': 64, 'af_g1': 'relu', 'drop_p_g1': 0.0, 'n_hidden_layers_g2': 1, 'hidden_dims_g2': 8, 'af_g2': 'relu', 'drop_p_g2': 0.0, 'n_hidden_layers_h_net': 1, 'hidden_dims_h_net': 8, 'af_h_net': 'tanh', 'drop_p_h_net': 0.0}. Best is trial 0 with value: 0.2942361831665039.
2025-07-29 07:05:26,468 - INFO - Trial 11 finished with value: 0.2942589223384857 and parameters: {'lr': 0.0037027925744094934, 'lamb': 0.0099, 'batch_size': 16, 'n_hidden_layers_g0': 1, 'hidden_dims_g0': 24, 'af_g0': 'tanh', 'drop_p_g0': 0.0, 'n_hidden_layers_g1': 1, 'hidden_dims_g1': 64, 'af_g1': 'tanh', 'drop_p_g1': 0.0, 'n_hidden_layers_g2': 2, 'hidden_dims_g2': 40, 'af_g2': 'relu', 'drop_p_g2': 0.0, 'n_hidden_layers_h_net': 1, 'hidden_dims_h_net': 56, 'af_h_net': 'tanh', 'drop_p_h_net': 0.0}. Best is trial 0 with value: 0.2942361831665039.
2025-07-29 07:12:34,414 - INFO - Trial 12 finished with value: 0.2942647933959961 and parameters: {'lr': 0.00602315269714888, 'lamb': 0.0088, 'batch_size': 16, 'n_hidden_layers_g0': 1, 'hidden_dims_g0': 24, 'af_g0': 'softplus', 'drop_p_g0': 0.0, 'n_hidden_layers_g1': 1, 'hidden_dims_g1': 40, 'af_g1': 'tanh', 'drop_p_g1': 0.0, 'n_hidden_layers_g2': 2, 'hidden_dims_g2': 32, 'af_g2': 'relu', 'drop_p_g2': 0.0, 'n_hidden_layers_h_net': 1, 'hidden_dims_h_net': 24, 'af_h_net': 'tanh', 'drop_p_h_net': 0.0}. Best is trial 0 with value: 0.2942361831665039.
2025-07-29 07:19:15,831 - INFO - Trial 13 finished with value: 0.29424214363098145 and parameters: {'lr': 0.0018889674555913902, 'lamb': 0.0051, 'batch_size': 16, 'n_hidden_layers_g0': 1, 'hidden_dims_g0': 16, 'af_g0': 'tanh', 'drop_p_g0': 0.0, 'n_hidden_layers_g1': 1, 'hidden_dims_g1': 8, 'af_g1': 'tanh', 'drop_p_g1': 0.0, 'n_hidden_layers_g2': 1, 'hidden_dims_g2': 8, 'af_g2': 'relu', 'drop_p_g2': 0.0, 'n_hidden_layers_h_net': 1, 'hidden_dims_h_net': 32, 'af_h_net': 'relu', 'drop_p_h_net': 0.0}. Best is trial 0 with value: 0.2942361831665039.
2025-07-29 07:31:16,434 - INFO - Trial 14 finished with value: 0.2942369282245636 and parameters: {'lr': 0.0017947293643452572, 'lamb': 0.0047, 'batch_size': 16, 'n_hidden_layers_g0': 1, 'hidden_dims_g0': 24, 'af_g0': 'tanh', 'drop_p_g0': 0.0, 'n_hidden_layers_g1': 1, 'hidden_dims_g1': 8, 'af_g1': 'tanh', 'drop_p_g1': 0.0, 'n_hidden_layers_g2': 1, 'hidden_dims_g2': 8, 'af_g2': 'relu', 'drop_p_g2': 0.0, 'n_hidden_layers_h_net': 1, 'hidden_dims_h_net': 24, 'af_h_net': 'tanh', 'drop_p_h_net': 0.0}. Best is trial 0 with value: 0.2942361831665039.
2025-07-29 07:39:58,418 - INFO - Trial 15 finished with value: 0.294230580329895 and parameters: {'lr': 0.000722201235278976, 'lamb': 0.0051, 'batch_size': 16, 'n_hidden_layers_g0': 1, 'hidden_dims_g0': 24, 'af_g0': 'softplus', 'drop_p_g0': 0.0, 'n_hidden_layers_g1': 1, 'hidden_dims_g1': 8, 'af_g1': 'relu', 'drop_p_g1': 0.0, 'n_hidden_layers_g2': 1, 'hidden_dims_g2': 16, 'af_g2': 'softplus', 'drop_p_g2': 0.0, 'n_hidden_layers_h_net': 2, 'hidden_dims_h_net': 16, 'af_h_net': 'tanh', 'drop_p_h_net': 0.0}. Best is trial 15 with value: 0.294230580329895.
2025-07-29 07:48:50,588 - INFO - Trial 16 finished with value: 0.29423654079437256 and parameters: {'lr': 0.0005671369275133185, 'lamb': 0.0038, 'batch_size': 64, 'n_hidden_layers_g0': 1, 'hidden_dims_g0': 32, 'af_g0': 'softplus', 'drop_p_g0': 0.0, 'n_hidden_layers_g1': 1, 'hidden_dims_g1': 32, 'af_g1': 'relu', 'drop_p_g1': 0.0, 'n_hidden_layers_g2': 1, 'hidden_dims_g2': 16, 'af_g2': 'softplus', 'drop_p_g2': 0.0, 'n_hidden_layers_h_net': 2, 'hidden_dims_h_net': 16, 'af_h_net': 'tanh', 'drop_p_h_net': 0.0}. Best is trial 15 with value: 0.294230580329895.
2025-07-29 07:59:09,517 - INFO - Trial 17 finished with value: 0.2942366600036621 and parameters: {'lr': 0.0008756073881718444, 'lamb': 0.0001, 'batch_size': 16, 'n_hidden_layers_g0': 2, 'hidden_dims_g0': 56, 'af_g0': 'softplus', 'drop_p_g0': 0.0, 'n_hidden_layers_g1': 2, 'hidden_dims_g1': 32, 'af_g1': 'relu', 'drop_p_g1': 0.0, 'n_hidden_layers_g2': 1, 'hidden_dims_g2': 40, 'af_g2': 'softplus', 'drop_p_g2': 0.0, 'n_hidden_layers_h_net': 2, 'hidden_dims_h_net': 16, 'af_h_net': 'tanh', 'drop_p_h_net': 0.0}. Best is trial 15 with value: 0.294230580329895.
2025-07-29 08:08:34,665 - INFO - Trial 18 finished with value: 0.2942371964454651 and parameters: {'lr': 0.0009906066772217153, 'lamb': 0.0059, 'batch_size': 16, 'n_hidden_layers_g0': 1, 'hidden_dims_g0': 16, 'af_g0': 'softplus', 'drop_p_g0': 0.0, 'n_hidden_layers_g1': 1, 'hidden_dims_g1': 16, 'af_g1': 'relu', 'drop_p_g1': 0.0, 'n_hidden_layers_g2': 1, 'hidden_dims_g2': 16, 'af_g2': 'softplus', 'drop_p_g2': 0.0, 'n_hidden_layers_h_net': 2, 'hidden_dims_h_net': 8, 'af_h_net': 'tanh', 'drop_p_h_net': 0.0}. Best is trial 15 with value: 0.294230580329895.
2025-07-29 08:16:31,070 - INFO - Trial 19 finished with value: 0.2943008840084076 and parameters: {'lr': 0.0023437398967516834, 'lamb': 0.0033, 'batch_size': 16, 'n_hidden_layers_g0': 1, 'hidden_dims_g0': 24, 'af_g0': 'softplus', 'drop_p_g0': 0.0, 'n_hidden_layers_g1': 1, 'hidden_dims_g1': 56, 'af_g1': 'relu', 'drop_p_g1': 0.0, 'n_hidden_layers_g2': 1, 'hidden_dims_g2': 24, 'af_g2': 'softplus', 'drop_p_g2': 0.0, 'n_hidden_layers_h_net': 2, 'hidden_dims_h_net': 16, 'af_h_net': 'tanh', 'drop_p_h_net': 0.0}. Best is trial 15 with value: 0.294230580329895.
2025-07-29 08:20:44,025 - INFO - Trial 20 finished with value: 0.2942347824573517 and parameters: {'lr': 0.006070541118224978, 'lamb': 0.0091, 'batch_size': 64, 'n_hidden_layers_g0': 2, 'hidden_dims_g0': 8, 'af_g0': 'softplus', 'drop_p_g0': 0.0, 'n_hidden_layers_g1': 2, 'hidden_dims_g1': 16, 'af_g1': 'relu', 'drop_p_g1': 0.0, 'n_hidden_layers_g2': 1, 'hidden_dims_g2': 32, 'af_g2': 'softplus', 'drop_p_g2': 0.0, 'n_hidden_layers_h_net': 2, 'hidden_dims_h_net': 24, 'af_h_net': 'tanh', 'drop_p_h_net': 0.0}. Best is trial 15 with value: 0.294230580329895.
2025-07-29 08:24:22,447 - INFO - Trial 21 finished with value: 0.2942509651184082 and parameters: {'lr': 0.0068366892970498985, 'lamb': 0.008700000000000001, 'batch_size': 64, 'n_hidden_layers_g0': 2, 'hidden_dims_g0': 8, 'af_g0': 'softplus', 'drop_p_g0': 0.0, 'n_hidden_layers_g1': 2, 'hidden_dims_g1': 16, 'af_g1': 'relu', 'drop_p_g1': 0.0, 'n_hidden_layers_g2': 1, 'hidden_dims_g2': 32, 'af_g2': 'softplus', 'drop_p_g2': 0.0, 'n_hidden_layers_h_net': 2, 'hidden_dims_h_net': 32, 'af_h_net': 'tanh', 'drop_p_h_net': 0.0}. Best is trial 15 with value: 0.294230580329895.
2025-07-29 08:28:24,158 - INFO - Trial 22 finished with value: 0.294264554977417 and parameters: {'lr': 0.009425642586221146, 'lamb': 0.0091, 'batch_size': 64, 'n_hidden_layers_g0': 2, 'hidden_dims_g0': 16, 'af_g0': 'softplus', 'drop_p_g0': 0.0, 'n_hidden_layers_g1': 2, 'hidden_dims_g1': 8, 'af_g1': 'relu', 'drop_p_g1': 0.0, 'n_hidden_layers_g2': 1, 'hidden_dims_g2': 16, 'af_g2': 'softplus', 'drop_p_g2': 0.0, 'n_hidden_layers_h_net': 2, 'hidden_dims_h_net': 24, 'af_h_net': 'tanh', 'drop_p_h_net': 0.0}. Best is trial 15 with value: 0.294230580329895.
2025-07-29 08:36:50,534 - INFO - Trial 23 finished with value: 0.2942345142364502 and parameters: {'lr': 0.002912652613804623, 'lamb': 0.007200000000000001, 'batch_size': 64, 'n_hidden_layers_g0': 2, 'hidden_dims_g0': 8, 'af_g0': 'softplus', 'drop_p_g0': 0.0, 'n_hidden_layers_g1': 2, 'hidden_dims_g1': 16, 'af_g1': 'relu', 'drop_p_g1': 0.0, 'n_hidden_layers_g2': 1, 'hidden_dims_g2': 40, 'af_g2': 'softplus', 'drop_p_g2': 0.0, 'n_hidden_layers_h_net': 2, 'hidden_dims_h_net': 16, 'af_h_net': 'tanh', 'drop_p_h_net': 0.0}. Best is trial 15 with value: 0.294230580329895.
2025-07-29 08:39:57,071 - INFO - Trial 24 finished with value: 0.29425933957099915 and parameters: {'lr': 0.004848410928349713, 'lamb': 0.0071, 'batch_size': 64, 'n_hidden_layers_g0': 2, 'hidden_dims_g0': 32, 'af_g0': 'softplus', 'drop_p_g0': 0.0, 'n_hidden_layers_g1': 2, 'hidden_dims_g1': 16, 'af_g1': 'relu', 'drop_p_g1': 0.0, 'n_hidden_layers_g2': 1, 'hidden_dims_g2': 48, 'af_g2': 'softplus', 'drop_p_g2': 0.0, 'n_hidden_layers_h_net': 2, 'hidden_dims_h_net': 24, 'af_h_net': 'tanh', 'drop_p_h_net': 0.0}. Best is trial 15 with value: 0.294230580329895.
2025-07-29 08:47:59,368 - INFO - Trial 25 finished with value: 0.2942415773868561 and parameters: {'lr': 0.009604119879637758, 'lamb': 0.0057, 'batch_size': 64, 'n_hidden_layers_g0': 2, 'hidden_dims_g0': 16, 'af_g0': 'softplus', 'drop_p_g0': 0.0, 'n_hidden_layers_g1': 2, 'hidden_dims_g1': 8, 'af_g1': 'softplus', 'drop_p_g1': 0.0, 'n_hidden_layers_g2': 1, 'hidden_dims_g2': 48, 'af_g2': 'softplus', 'drop_p_g2': 0.0, 'n_hidden_layers_h_net': 2, 'hidden_dims_h_net': 8, 'af_h_net': 'softplus', 'drop_p_h_net': 0.0}. Best is trial 15 with value: 0.294230580329895.
2025-07-29 08:50:37,329 - INFO - Trial 26 finished with value: 0.2942426800727844 and parameters: {'lr': 0.019946047091243486, 'lamb': 0.0064, 'batch_size': 64, 'n_hidden_layers_g0': 2, 'hidden_dims_g0': 8, 'af_g0': 'softplus', 'drop_p_g0': 0.0, 'n_hidden_layers_g1': 2, 'hidden_dims_g1': 24, 'af_g1': 'relu', 'drop_p_g1': 0.0, 'n_hidden_layers_g2': 1, 'hidden_dims_g2': 40, 'af_g2': 'softplus', 'drop_p_g2': 0.0, 'n_hidden_layers_h_net': 2, 'hidden_dims_h_net': 16, 'af_h_net': 'tanh', 'drop_p_h_net': 0.0}. Best is trial 15 with value: 0.294230580329895.
2025-07-29 08:59:14,307 - INFO - Trial 27 finished with value: 0.29425516724586487 and parameters: {'lr': 0.0013495298228249, 'lamb': 0.007500000000000001, 'batch_size': 64, 'n_hidden_layers_g0': 2, 'hidden_dims_g0': 24, 'af_g0': 'softplus', 'drop_p_g0': 0.0, 'n_hidden_layers_g1': 2, 'hidden_dims_g1': 16, 'af_g1': 'relu', 'drop_p_g1': 0.0, 'n_hidden_layers_g2': 1, 'hidden_dims_g2': 56, 'af_g2': 'softplus', 'drop_p_g2': 0.0, 'n_hidden_layers_h_net': 2, 'hidden_dims_h_net': 32, 'af_h_net': 'tanh', 'drop_p_h_net': 0.0}. Best is trial 15 with value: 0.294230580329895.
2025-07-29 09:08:01,957 - INFO - Trial 28 finished with value: 0.294240802526474 and parameters: {'lr': 0.0007649153439895174, 'lamb': 0.008400000000000001, 'batch_size': 64, 'n_hidden_layers_g0': 2, 'hidden_dims_g0': 48, 'af_g0': 'softplus', 'drop_p_g0': 0.0, 'n_hidden_layers_g1': 2, 'hidden_dims_g1': 8, 'af_g1': 'relu', 'drop_p_g1': 0.0, 'n_hidden_layers_g2': 1, 'hidden_dims_g2': 32, 'af_g2': 'softplus', 'drop_p_g2': 0.0, 'n_hidden_layers_h_net': 2, 'hidden_dims_h_net': 24, 'af_h_net': 'tanh', 'drop_p_h_net': 0.0}. Best is trial 15 with value: 0.294230580329895.
2025-07-29 09:11:13,823 - INFO - Trial 29 finished with value: 0.2942333519458771 and parameters: {'lr': 0.0025767464330949956, 'lamb': 0.0037, 'batch_size': 64, 'n_hidden_layers_g0': 2, 'hidden_dims_g0': 8, 'af_g0': 'softplus', 'drop_p_g0': 0.0, 'n_hidden_layers_g1': 2, 'hidden_dims_g1': 32, 'af_g1': 'relu', 'drop_p_g1': 0.0, 'n_hidden_layers_g2': 1, 'hidden_dims_g2': 40, 'af_g2': 'softplus', 'drop_p_g2': 0.0, 'n_hidden_layers_h_net': 2, 'hidden_dims_h_net': 16, 'af_h_net': 'tanh', 'drop_p_h_net': 0.0}. Best is trial 15 with value: 0.294230580329895.
2025-07-29 09:14:32,196 - INFO - Trial 30 finished with value: 0.2942577302455902 and parameters: {'lr': 0.002555563158306398, 'lamb': 0.0039000000000000003, 'batch_size': 64, 'n_hidden_layers_g0': 2, 'hidden_dims_g0': 16, 'af_g0': 'softplus', 'drop_p_g0': 0.0, 'n_hidden_layers_g1': 2, 'hidden_dims_g1': 32, 'af_g1': 'softplus', 'drop_p_g1': 0.0, 'n_hidden_layers_g2': 1, 'hidden_dims_g2': 40, 'af_g2': 'softplus', 'drop_p_g2': 0.0, 'n_hidden_layers_h_net': 2, 'hidden_dims_h_net': 16, 'af_h_net': 'softplus', 'drop_p_h_net': 0.0}. Best is trial 15 with value: 0.294230580329895.
2025-07-29 09:17:02,612 - INFO - Trial 31 finished with value: 0.29425248503685 and parameters: {'lr': 0.0048518497665835745, 'lamb': 0.0028, 'batch_size': 64, 'n_hidden_layers_g0': 2, 'hidden_dims_g0': 8, 'af_g0': 'softplus', 'drop_p_g0': 0.0, 'n_hidden_layers_g1': 2, 'hidden_dims_g1': 16, 'af_g1': 'relu', 'drop_p_g1': 0.0, 'n_hidden_layers_g2': 1, 'hidden_dims_g2': 48, 'af_g2': 'softplus', 'drop_p_g2': 0.0, 'n_hidden_layers_h_net': 2, 'hidden_dims_h_net': 16, 'af_h_net': 'tanh', 'drop_p_h_net': 0.0}. Best is trial 15 with value: 0.294230580329895.
2025-07-29 09:21:31,252 - INFO - Trial 32 finished with value: 0.2942296266555786 and parameters: {'lr': 0.002958851624356092, 'lamb': 0.0041, 'batch_size': 64, 'n_hidden_layers_g0': 2, 'hidden_dims_g0': 8, 'af_g0': 'softplus', 'drop_p_g0': 0.0, 'n_hidden_layers_g1': 2, 'hidden_dims_g1': 24, 'af_g1': 'relu', 'drop_p_g1': 0.0, 'n_hidden_layers_g2': 1, 'hidden_dims_g2': 32, 'af_g2': 'softplus', 'drop_p_g2': 0.0, 'n_hidden_layers_h_net': 2, 'hidden_dims_h_net': 8, 'af_h_net': 'tanh', 'drop_p_h_net': 0.0}. Best is trial 32 with value: 0.2942296266555786.
2025-07-29 09:30:52,316 - INFO - Trial 33 finished with value: 0.29423514008522034 and parameters: {'lr': 0.0027413918511490446, 'lamb': 0.0016, 'batch_size': 64, 'n_hidden_layers_g0': 2, 'hidden_dims_g0': 8, 'af_g0': 'softplus', 'drop_p_g0': 0.0, 'n_hidden_layers_g1': 2, 'hidden_dims_g1': 24, 'af_g1': 'relu', 'drop_p_g1': 0.0, 'n_hidden_layers_g2': 1, 'hidden_dims_g2': 40, 'af_g2': 'softplus', 'drop_p_g2': 0.0, 'n_hidden_layers_h_net': 2, 'hidden_dims_h_net': 8, 'af_h_net': 'tanh', 'drop_p_h_net': 0.0}. Best is trial 32 with value: 0.2942296266555786.
2025-07-29 09:36:42,153 - INFO - Trial 34 finished with value: 0.29422739148139954 and parameters: {'lr': 0.0014358483814976637, 'lamb': 0.0039000000000000003, 'batch_size': 64, 'n_hidden_layers_g0': 2, 'hidden_dims_g0': 16, 'af_g0': 'softplus', 'drop_p_g0': 0.0, 'n_hidden_layers_g1': 2, 'hidden_dims_g1': 24, 'af_g1': 'relu', 'drop_p_g1': 0.0, 'n_hidden_layers_g2': 1, 'hidden_dims_g2': 56, 'af_g2': 'softplus', 'drop_p_g2': 0.0, 'n_hidden_layers_h_net': 2, 'hidden_dims_h_net': 8, 'af_h_net': 'tanh', 'drop_p_h_net': 0.0}. Best is trial 34 with value: 0.29422739148139954.
2025-07-29 09:46:24,560 - INFO - Trial 35 finished with value: 0.29551059007644653 and parameters: {'lr': 0.0007071707518296956, 'lamb': 0.004, 'batch_size': 64, 'n_hidden_layers_g0': 2, 'hidden_dims_g0': 16, 'af_g0': 'softplus', 'drop_p_g0': 0.0, 'n_hidden_layers_g1': 2, 'hidden_dims_g1': 24, 'af_g1': 'relu', 'drop_p_g1': 0.0, 'n_hidden_layers_g2': 1, 'hidden_dims_g2': 56, 'af_g2': 'tanh', 'drop_p_g2': 0.0, 'n_hidden_layers_h_net': 2, 'hidden_dims_h_net': 8, 'af_h_net': 'softplus', 'drop_p_h_net': 0.0}. Best is trial 34 with value: 0.29422739148139954.
2025-07-29 09:51:11,720 - INFO - Trial 36 finished with value: 0.29424190521240234 and parameters: {'lr': 0.0013025998000818998, 'lamb': 0.003, 'batch_size': 32, 'n_hidden_layers_g0': 2, 'hidden_dims_g0': 16, 'af_g0': 'softplus', 'drop_p_g0': 0.0, 'n_hidden_layers_g1': 2, 'hidden_dims_g1': 40, 'af_g1': 'softplus', 'drop_p_g1': 0.0, 'n_hidden_layers_g2': 1, 'hidden_dims_g2': 56, 'af_g2': 'softplus', 'drop_p_g2': 0.0, 'n_hidden_layers_h_net': 2, 'hidden_dims_h_net': 8, 'af_h_net': 'tanh', 'drop_p_h_net': 0.0}. Best is trial 34 with value: 0.29422739148139954.
2025-07-29 09:55:45,892 - INFO - Trial 37 finished with value: 0.2942334711551666 and parameters: {'lr': 0.001976848723652069, 'lamb': 0.005200000000000001, 'batch_size': 64, 'n_hidden_layers_g0': 2, 'hidden_dims_g0': 24, 'af_g0': 'softplus', 'drop_p_g0': 0.0, 'n_hidden_layers_g1': 2, 'hidden_dims_g1': 32, 'af_g1': 'relu', 'drop_p_g1': 0.0, 'n_hidden_layers_g2': 1, 'hidden_dims_g2': 64, 'af_g2': 'softplus', 'drop_p_g2': 0.0, 'n_hidden_layers_h_net': 2, 'hidden_dims_h_net': 8, 'af_h_net': 'tanh', 'drop_p_h_net': 0.0}. Best is trial 34 with value: 0.29422739148139954.
2025-07-29 09:59:56,899 - INFO - Trial 38 finished with value: 0.2942500710487366 and parameters: {'lr': 0.0010566496759389949, 'lamb': 0.0018000000000000002, 'batch_size': 64, 'n_hidden_layers_g0': 2, 'hidden_dims_g0': 32, 'af_g0': 'tanh', 'drop_p_g0': 0.0, 'n_hidden_layers_g1': 2, 'hidden_dims_g1': 24, 'af_g1': 'relu', 'drop_p_g1': 0.0, 'n_hidden_layers_g2': 1, 'hidden_dims_g2': 48, 'af_g2': 'tanh', 'drop_p_g2': 0.0, 'n_hidden_layers_h_net': 2, 'hidden_dims_h_net': 16, 'af_h_net': 'tanh', 'drop_p_h_net': 0.0}. Best is trial 34 with value: 0.29422739148139954.
