2025-07-29 10:06:16,101 - INFO - Trial 39 finished with value: 0.2943127155303955 and parameters: {'lr': 0.0006726576143485649, 'lamb': 0.0043, 'batch_size': 32, 'n_hidden_layers_g0': 2, 'hidden_dims_g0': 16, 'af_g0': 'relu', 'drop_p_g0': 0.0, 'n_hidden_layers_g1': 2, 'hidden_dims_g1': 40, 'af_g1': 'relu', 'drop_p_g1': 0.0, 'n_hidden_layers_g2': 2, 'hidden_dims_g2': 32, 'af_g2': 'softplus', 'drop_p_g2': 0.0, 'n_hidden_layers_h_net': 2, 'hidden_dims_h_net': 8, 'af_h_net': 'relu', 'drop_p_h_net': 0.0}. Best is trial 34 with value: 0.29422739148139954.
2025-07-29 10:15:11,663 - INFO - Trial 40 finished with value: 0.29423558712005615 and parameters: {'lr': 0.0005064227975776984, 'lamb': 0.0036000000000000003, 'batch_size': 64, 'n_hidden_layers_g0': 2, 'hidden_dims_g0': 8, 'af_g0': 'softplus', 'drop_p_g0': 0.0, 'n_hidden_layers_g1': 2, 'hidden_dims_g1': 32, 'af_g1': 'softplus', 'drop_p_g1': 0.0, 'n_hidden_layers_g2': 1, 'hidden_dims_g2': 24, 'af_g2': 'tanh', 'drop_p_g2': 0.0, 'n_hidden_layers_h_net': 2, 'hidden_dims_h_net': 64, 'af_h_net': 'softplus', 'drop_p_h_net': 0.0}. Best is trial 34 with value: 0.29422739148139954.
2025-07-29 10:21:23,277 - INFO - Trial 41 finished with value: 0.294231116771698 and parameters: {'lr': 0.0019549533282939673, 'lamb': 0.0054, 'batch_size': 64, 'n_hidden_layers_g0': 2, 'hidden_dims_g0': 24, 'af_g0': 'softplus', 'drop_p_g0': 0.0, 'n_hidden_layers_g1': 2, 'hidden_dims_g1': 32, 'af_g1': 'relu', 'drop_p_g1': 0.0, 'n_hidden_layers_g2': 1, 'hidden_dims_g2': 64, 'af_g2': 'softplus', 'drop_p_g2': 0.0, 'n_hidden_layers_h_net': 2, 'hidden_dims_h_net': 8, 'af_h_net': 'tanh', 'drop_p_h_net': 0.0}. Best is trial 34 with value: 0.29422739148139954.
2025-07-29 10:29:26,185 - INFO - Trial 42 finished with value: 0.29423725605010986 and parameters: {'lr': 0.0015279946821910517, 'lamb': 0.0056, 'batch_size': 64, 'n_hidden_layers_g0': 2, 'hidden_dims_g0': 24, 'af_g0': 'softplus', 'drop_p_g0': 0.0, 'n_hidden_layers_g1': 2, 'hidden_dims_g1': 24, 'af_g1': 'relu', 'drop_p_g1': 0.0, 'n_hidden_layers_g2': 1, 'hidden_dims_g2': 64, 'af_g2': 'softplus', 'drop_p_g2': 0.0, 'n_hidden_layers_h_net': 2, 'hidden_dims_h_net': 8, 'af_h_net': 'tanh', 'drop_p_h_net': 0.0}. Best is trial 34 with value: 0.29422739148139954.
2025-07-29 10:35:19,020 - INFO - Trial 43 finished with value: 0.2942516803741455 and parameters: {'lr': 0.003338108929687351, 'lamb': 0.0046, 'batch_size': 64, 'n_hidden_layers_g0': 2, 'hidden_dims_g0': 16, 'af_g0': 'softplus', 'drop_p_g0': 0.0, 'n_hidden_layers_g1': 2, 'hidden_dims_g1': 32, 'af_g1': 'relu', 'drop_p_g1': 0.0, 'n_hidden_layers_g2': 1, 'hidden_dims_g2': 56, 'af_g2': 'softplus', 'drop_p_g2': 0.0, 'n_hidden_layers_h_net': 2, 'hidden_dims_h_net': 16, 'af_h_net': 'tanh', 'drop_p_h_net': 0.0}. Best is trial 34 with value: 0.29422739148139954.
2025-07-29 10:40:38,807 - INFO - Trial 44 finished with value: 0.29425927996635437 and parameters: {'lr': 0.002071443621416447, 'lamb': 0.006200000000000001, 'batch_size': 64, 'n_hidden_layers_g0': 2, 'hidden_dims_g0': 32, 'af_g0': 'relu', 'drop_p_g0': 0.0, 'n_hidden_layers_g1': 2, 'hidden_dims_g1': 40, 'af_g1': 'relu', 'drop_p_g1': 0.0, 'n_hidden_layers_g2': 1, 'hidden_dims_g2': 64, 'af_g2': 'softplus', 'drop_p_g2': 0.0, 'n_hidden_layers_h_net': 2, 'hidden_dims_h_net': 8, 'af_h_net': 'tanh', 'drop_p_h_net': 0.0}. Best is trial 34 with value: 0.29422739148139954.
2025-07-29 10:47:01,055 - INFO - Trial 45 finished with value: 0.2942444086074829 and parameters: {'lr': 0.001342469701289407, 'lamb': 0.0025, 'batch_size': 16, 'n_hidden_layers_g0': 2, 'hidden_dims_g0': 8, 'af_g0': 'softplus', 'drop_p_g0': 0.0, 'n_hidden_layers_g1': 2, 'hidden_dims_g1': 48, 'af_g1': 'relu', 'drop_p_g1': 0.0, 'n_hidden_layers_g2': 1, 'hidden_dims_g2': 56, 'af_g2': 'softplus', 'drop_p_g2': 0.0, 'n_hidden_layers_h_net': 2, 'hidden_dims_h_net': 16, 'af_h_net': 'relu', 'drop_p_h_net': 0.0}. Best is trial 34 with value: 0.29422739148139954.
2025-07-29 10:51:19,692 - INFO - Trial 46 finished with value: 0.2942703366279602 and parameters: {'lr': 0.003951742629904368, 'lamb': 0.0053, 'batch_size': 64, 'n_hidden_layers_g0': 2, 'hidden_dims_g0': 24, 'af_g0': 'tanh', 'drop_p_g0': 0.0, 'n_hidden_layers_g1': 1, 'hidden_dims_g1': 24, 'af_g1': 'relu', 'drop_p_g1': 0.0, 'n_hidden_layers_g2': 1, 'hidden_dims_g2': 64, 'af_g2': 'softplus', 'drop_p_g2': 0.0, 'n_hidden_layers_h_net': 2, 'hidden_dims_h_net': 48, 'af_h_net': 'tanh', 'drop_p_h_net': 0.0}. Best is trial 34 with value: 0.29422739148139954.
2025-07-29 10:56:01,749 - INFO - Trial 47 finished with value: 0.2942512631416321 and parameters: {'lr': 0.0008816086229238934, 'lamb': 0.0043, 'batch_size': 32, 'n_hidden_layers_g0': 1, 'hidden_dims_g0': 16, 'af_g0': 'softplus', 'drop_p_g0': 0.0, 'n_hidden_layers_g1': 2, 'hidden_dims_g1': 32, 'af_g1': 'tanh', 'drop_p_g1': 0.0, 'n_hidden_layers_g2': 2, 'hidden_dims_g2': 48, 'af_g2': 'softplus', 'drop_p_g2': 0.0, 'n_hidden_layers_h_net': 2, 'hidden_dims_h_net': 8, 'af_h_net': 'tanh', 'drop_p_h_net': 0.0}. Best is trial 34 with value: 0.29422739148139954.
2025-07-29 11:06:56,206 - INFO - Trial 48 finished with value: 0.294244647026062 and parameters: {'lr': 0.0016677906840051535, 'lamb': 0.0032, 'batch_size': 16, 'n_hidden_layers_g0': 2, 'hidden_dims_g0': 40, 'af_g0': 'relu', 'drop_p_g0': 0.0, 'n_hidden_layers_g1': 1, 'hidden_dims_g1': 40, 'af_g1': 'relu', 'drop_p_g1': 0.0, 'n_hidden_layers_g2': 1, 'hidden_dims_g2': 24, 'af_g2': 'tanh', 'drop_p_g2': 0.0, 'n_hidden_layers_h_net': 1, 'hidden_dims_h_net': 8, 'af_h_net': 'tanh', 'drop_p_h_net': 0.0}. Best is trial 34 with value: 0.29422739148139954.
2025-07-29 11:11:09,623 - INFO - Trial 49 finished with value: 0.2942442297935486 and parameters: {'lr': 0.0022922194137968096, 'lamb': 0.0048000000000000004, 'batch_size': 16, 'n_hidden_layers_g0': 1, 'hidden_dims_g0': 24, 'af_g0': 'softplus', 'drop_p_g0': 0.0, 'n_hidden_layers_g1': 2, 'hidden_dims_g1': 32, 'af_g1': 'relu', 'drop_p_g1': 0.0, 'n_hidden_layers_g2': 1, 'hidden_dims_g2': 16, 'af_g2': 'softplus', 'drop_p_g2': 0.0, 'n_hidden_layers_h_net': 2, 'hidden_dims_h_net': 16, 'af_h_net': 'relu', 'drop_p_h_net': 0.0}. Best is trial 34 with value: 0.29422739148139954.
2025-07-29 11:15:04,029 - INFO - Trial 50 finished with value: 0.29423925280570984 and parameters: {'lr': 0.0011116175569006093, 'lamb': 0.0023, 'batch_size': 64, 'n_hidden_layers_g0': 2, 'hidden_dims_g0': 40, 'af_g0': 'tanh', 'drop_p_g0': 0.0, 'n_hidden_layers_g1': 1, 'hidden_dims_g1': 48, 'af_g1': 'tanh', 'drop_p_g1': 0.0, 'n_hidden_layers_g2': 1, 'hidden_dims_g2': 8, 'af_g2': 'relu', 'drop_p_g2': 0.0, 'n_hidden_layers_h_net': 2, 'hidden_dims_h_net': 56, 'af_h_net': 'tanh', 'drop_p_h_net': 0.0}. Best is trial 34 with value: 0.29422739148139954.
2025-07-29 11:19:02,414 - INFO - Trial 51 finished with value: 0.2942427396774292 and parameters: {'lr': 0.002066876973576779, 'lamb': 0.0055000000000000005, 'batch_size': 64, 'n_hidden_layers_g0': 2, 'hidden_dims_g0': 24, 'af_g0': 'softplus', 'drop_p_g0': 0.0, 'n_hidden_layers_g1': 2, 'hidden_dims_g1': 32, 'af_g1': 'relu', 'drop_p_g1': 0.0, 'n_hidden_layers_g2': 1, 'hidden_dims_g2': 64, 'af_g2': 'softplus', 'drop_p_g2': 0.0, 'n_hidden_layers_h_net': 2, 'hidden_dims_h_net': 8, 'af_h_net': 'tanh', 'drop_p_h_net': 0.0}. Best is trial 34 with value: 0.29422739148139954.
2025-07-29 11:27:00,969 - INFO - Trial 52 finished with value: 0.294242799282074 and parameters: {'lr': 0.002970881953518002, 'lamb': 0.004200000000000001, 'batch_size': 64, 'n_hidden_layers_g0': 2, 'hidden_dims_g0': 24, 'af_g0': 'softplus', 'drop_p_g0': 0.0, 'n_hidden_layers_g1': 2, 'hidden_dims_g1': 24, 'af_g1': 'relu', 'drop_p_g1': 0.0, 'n_hidden_layers_g2': 1, 'hidden_dims_g2': 64, 'af_g2': 'softplus', 'drop_p_g2': 0.0, 'n_hidden_layers_h_net': 2, 'hidden_dims_h_net': 8, 'af_h_net': 'tanh', 'drop_p_h_net': 0.0}. Best is trial 34 with value: 0.29422739148139954.
2025-07-29 11:30:11,564 - INFO - Trial 53 finished with value: 0.29424598813056946 and parameters: {'lr': 0.004151129149398057, 'lamb': 0.0051, 'batch_size': 64, 'n_hidden_layers_g0': 2, 'hidden_dims_g0': 32, 'af_g0': 'softplus', 'drop_p_g0': 0.0, 'n_hidden_layers_g1': 2, 'hidden_dims_g1': 32, 'af_g1': 'relu', 'drop_p_g1': 0.0, 'n_hidden_layers_g2': 1, 'hidden_dims_g2': 56, 'af_g2': 'softplus', 'drop_p_g2': 0.0, 'n_hidden_layers_h_net': 2, 'hidden_dims_h_net': 8, 'af_h_net': 'tanh', 'drop_p_h_net': 0.0}. Best is trial 34 with value: 0.29422739148139954.
2025-07-29 11:33:06,721 - INFO - Trial 54 finished with value: 0.2942507565021515 and parameters: {'lr': 0.001762100880780164, 'lamb': 0.0061, 'batch_size': 64, 'n_hidden_layers_g0': 2, 'hidden_dims_g0': 24, 'af_g0': 'softplus', 'drop_p_g0': 0.0, 'n_hidden_layers_g1': 2, 'hidden_dims_g1': 40, 'af_g1': 'relu', 'drop_p_g1': 0.0, 'n_hidden_layers_g2': 1, 'hidden_dims_g2': 64, 'af_g2': 'softplus', 'drop_p_g2': 0.0, 'n_hidden_layers_h_net': 2, 'hidden_dims_h_net': 8, 'af_h_net': 'tanh', 'drop_p_h_net': 0.0}. Best is trial 34 with value: 0.29422739148139954.
2025-07-29 11:47:33,806 - INFO - Trial 55 finished with value: 0.29435083270072937 and parameters: {'lr': 0.043619815380164066, 'lamb': 0.0035, 'batch_size': 16, 'n_hidden_layers_g0': 1, 'hidden_dims_g0': 8, 'af_g0': 'softplus', 'drop_p_g0': 0.0, 'n_hidden_layers_g1': 2, 'hidden_dims_g1': 24, 'af_g1': 'relu', 'drop_p_g1': 0.0, 'n_hidden_layers_g2': 1, 'hidden_dims_g2': 64, 'af_g2': 'softplus', 'drop_p_g2': 0.0, 'n_hidden_layers_h_net': 2, 'hidden_dims_h_net': 16, 'af_h_net': 'tanh', 'drop_p_h_net': 0.0}. Best is trial 34 with value: 0.29422739148139954.
2025-07-29 11:53:01,610 - INFO - Trial 56 finished with value: 0.29424428939819336 and parameters: {'lr': 0.0032491531489427226, 'lamb': 0.0068000000000000005, 'batch_size': 32, 'n_hidden_layers_g0': 2, 'hidden_dims_g0': 16, 'af_g0': 'softplus', 'drop_p_g0': 0.0, 'n_hidden_layers_g1': 2, 'hidden_dims_g1': 32, 'af_g1': 'relu', 'drop_p_g1': 0.0, 'n_hidden_layers_g2': 1, 'hidden_dims_g2': 56, 'af_g2': 'softplus', 'drop_p_g2': 0.0, 'n_hidden_layers_h_net': 2, 'hidden_dims_h_net': 16, 'af_h_net': 'tanh', 'drop_p_h_net': 0.0}. Best is trial 34 with value: 0.29422739148139954.
2025-07-29 12:01:03,469 - INFO - Trial 57 finished with value: 0.2942351996898651 and parameters: {'lr': 0.0022888843874340117, 'lamb': 0.0046, 'batch_size': 64, 'n_hidden_layers_g0': 2, 'hidden_dims_g0': 32, 'af_g0': 'softplus', 'drop_p_g0': 0.0, 'n_hidden_layers_g1': 1, 'hidden_dims_g1': 32, 'af_g1': 'relu', 'drop_p_g1': 0.0, 'n_hidden_layers_g2': 1, 'hidden_dims_g2': 16, 'af_g2': 'relu', 'drop_p_g2': 0.0, 'n_hidden_layers_h_net': 1, 'hidden_dims_h_net': 40, 'af_h_net': 'tanh', 'drop_p_h_net': 0.0}. Best is trial 34 with value: 0.29422739148139954.
2025-07-29 12:07:47,337 - INFO - Trial 58 finished with value: 0.29424524307250977 and parameters: {'lr': 0.001266224433991016, 'lamb': 0.0053, 'batch_size': 64, 'n_hidden_layers_g0': 1, 'hidden_dims_g0': 64, 'af_g0': 'softplus', 'drop_p_g0': 0.0, 'n_hidden_layers_g1': 2, 'hidden_dims_g1': 40, 'af_g1': 'softplus', 'drop_p_g1': 0.0, 'n_hidden_layers_g2': 1, 'hidden_dims_g2': 24, 'af_g2': 'softplus', 'drop_p_g2': 0.0, 'n_hidden_layers_h_net': 2, 'hidden_dims_h_net': 8, 'af_h_net': 'softplus', 'drop_p_h_net': 0.0}. Best is trial 34 with value: 0.29422739148139954.
2025-07-29 12:19:30,048 - INFO - Trial 59 finished with value: 0.294315367937088 and parameters: {'lr': 0.0015268373974646706, 'lamb': 0.005, 'batch_size': 16, 'n_hidden_layers_g0': 2, 'hidden_dims_g0': 8, 'af_g0': 'relu', 'drop_p_g0': 0.0, 'n_hidden_layers_g1': 2, 'hidden_dims_g1': 24, 'af_g1': 'tanh', 'drop_p_g1': 0.0, 'n_hidden_layers_g2': 2, 'hidden_dims_g2': 64, 'af_g2': 'softplus', 'drop_p_g2': 0.0, 'n_hidden_layers_h_net': 2, 'hidden_dims_h_net': 24, 'af_h_net': 'tanh', 'drop_p_h_net': 0.0}. Best is trial 34 with value: 0.29422739148139954.
2025-07-29 12:25:54,847 - INFO - Trial 60 finished with value: 0.29423680901527405 and parameters: {'lr': 0.0018994539696006983, 'lamb': 0.0035, 'batch_size': 64, 'n_hidden_layers_g0': 2, 'hidden_dims_g0': 16, 'af_g0': 'softplus', 'drop_p_g0': 0.0, 'n_hidden_layers_g1': 1, 'hidden_dims_g1': 16, 'af_g1': 'relu', 'drop_p_g1': 0.0, 'n_hidden_layers_g2': 1, 'hidden_dims_g2': 32, 'af_g2': 'softplus', 'drop_p_g2': 0.0, 'n_hidden_layers_h_net': 2, 'hidden_dims_h_net': 16, 'af_h_net': 'relu', 'drop_p_h_net': 0.0}. Best is trial 34 with value: 0.29422739148139954.
2025-07-29 12:33:44,106 - INFO - Trial 61 finished with value: 0.29424232244491577 and parameters: {'lr': 0.0026957351517450205, 'lamb': 0.0067, 'batch_size': 64, 'n_hidden_layers_g0': 2, 'hidden_dims_g0': 8, 'af_g0': 'softplus', 'drop_p_g0': 0.0, 'n_hidden_layers_g1': 2, 'hidden_dims_g1': 8, 'af_g1': 'relu', 'drop_p_g1': 0.0, 'n_hidden_layers_g2': 1, 'hidden_dims_g2': 40, 'af_g2': 'softplus', 'drop_p_g2': 0.0, 'n_hidden_layers_h_net': 2, 'hidden_dims_h_net': 16, 'af_h_net': 'tanh', 'drop_p_h_net': 0.0}. Best is trial 34 with value: 0.29422739148139954.
2025-07-29 12:40:02,810 - INFO - Trial 62 finished with value: 0.29424044489860535 and parameters: {'lr': 0.004185314669068924, 'lamb': 0.0074, 'batch_size': 64, 'n_hidden_layers_g0': 2, 'hidden_dims_g0': 8, 'af_g0': 'softplus', 'drop_p_g0': 0.0, 'n_hidden_layers_g1': 2, 'hidden_dims_g1': 16, 'af_g1': 'relu', 'drop_p_g1': 0.0, 'n_hidden_layers_g2': 1, 'hidden_dims_g2': 40, 'af_g2': 'softplus', 'drop_p_g2': 0.0, 'n_hidden_layers_h_net': 2, 'hidden_dims_h_net': 16, 'af_h_net': 'tanh', 'drop_p_h_net': 0.0}. Best is trial 34 with value: 0.29422739148139954.
2025-07-29 12:49:32,418 - INFO - Trial 63 finished with value: 0.2942720353603363 and parameters: {'lr': 0.002881696864901372, 'lamb': 0.0059, 'batch_size': 64, 'n_hidden_layers_g0': 2, 'hidden_dims_g0': 8, 'af_g0': 'softplus', 'drop_p_g0': 0.0, 'n_hidden_layers_g1': 2, 'hidden_dims_g1': 8, 'af_g1': 'relu', 'drop_p_g1': 0.0, 'n_hidden_layers_g2': 1, 'hidden_dims_g2': 48, 'af_g2': 'softplus', 'drop_p_g2': 0.0, 'n_hidden_layers_h_net': 2, 'hidden_dims_h_net': 24, 'af_h_net': 'tanh', 'drop_p_h_net': 0.0}. Best is trial 34 with value: 0.29422739148139954.
2025-07-29 12:53:26,172 - INFO - Trial 64 finished with value: 0.2942400276660919 and parameters: {'lr': 0.0023781988009880313, 'lamb': 0.004, 'batch_size': 64, 'n_hidden_layers_g0': 2, 'hidden_dims_g0': 16, 'af_g0': 'softplus', 'drop_p_g0': 0.0, 'n_hidden_layers_g1': 2, 'hidden_dims_g1': 16, 'af_g1': 'relu', 'drop_p_g1': 0.0, 'n_hidden_layers_g2': 1, 'hidden_dims_g2': 32, 'af_g2': 'softplus', 'drop_p_g2': 0.0, 'n_hidden_layers_h_net': 2, 'hidden_dims_h_net': 8, 'af_h_net': 'tanh', 'drop_p_h_net': 0.0}. Best is trial 34 with value: 0.29422739148139954.
2025-07-29 12:57:40,572 - INFO - Trial 65 finished with value: 0.2942357659339905 and parameters: {'lr': 0.006405584826007763, 'lamb': 0.0079, 'batch_size': 64, 'n_hidden_layers_g0': 2, 'hidden_dims_g0': 16, 'af_g0': 'softplus', 'drop_p_g0': 0.0, 'n_hidden_layers_g1': 2, 'hidden_dims_g1': 24, 'af_g1': 'relu', 'drop_p_g1': 0.0, 'n_hidden_layers_g2': 1, 'hidden_dims_g2': 40, 'af_g2': 'softplus', 'drop_p_g2': 0.0, 'n_hidden_layers_h_net': 2, 'hidden_dims_h_net': 16, 'af_h_net': 'tanh', 'drop_p_h_net': 0.0}. Best is trial 34 with value: 0.29422739148139954.
2025-07-29 13:04:30,924 - INFO - Trial 66 finished with value: 0.2942546010017395 and parameters: {'lr': 0.0009223384215662948, 'lamb': 0.0045000000000000005, 'batch_size': 64, 'n_hidden_layers_g0': 2, 'hidden_dims_g0': 8, 'af_g0': 'softplus', 'drop_p_g0': 0.0, 'n_hidden_layers_g1': 2, 'hidden_dims_g1': 16, 'af_g1': 'relu', 'drop_p_g1': 0.0, 'n_hidden_layers_g2': 1, 'hidden_dims_g2': 56, 'af_g2': 'softplus', 'drop_p_g2': 0.0, 'n_hidden_layers_h_net': 2, 'hidden_dims_h_net': 8, 'af_h_net': 'tanh', 'drop_p_h_net': 0.0}. Best is trial 34 with value: 0.29422739148139954.
2025-07-29 13:12:47,573 - INFO - Trial 67 finished with value: 0.2942699193954468 and parameters: {'lr': 0.007492852494953176, 'lamb': 0.006500000000000001, 'batch_size': 16, 'n_hidden_layers_g0': 2, 'hidden_dims_g0': 24, 'af_g0': 'tanh', 'drop_p_g0': 0.0, 'n_hidden_layers_g1': 2, 'hidden_dims_g1': 8, 'af_g1': 'relu', 'drop_p_g1': 0.0, 'n_hidden_layers_g2': 1, 'hidden_dims_g2': 48, 'af_g2': 'tanh', 'drop_p_g2': 0.0, 'n_hidden_layers_h_net': 2, 'hidden_dims_h_net': 16, 'af_h_net': 'tanh', 'drop_p_h_net': 0.0}. Best is trial 34 with value: 0.29422739148139954.
2025-07-29 13:15:57,878 - INFO - Trial 68 finished with value: 0.29423511028289795 and parameters: {'lr': 0.005333743037117495, 'lamb': 0.0049, 'batch_size': 64, 'n_hidden_layers_g0': 1, 'hidden_dims_g0': 16, 'af_g0': 'softplus', 'drop_p_g0': 0.0, 'n_hidden_layers_g1': 2, 'hidden_dims_g1': 32, 'af_g1': 'relu', 'drop_p_g1': 0.0, 'n_hidden_layers_g2': 1, 'hidden_dims_g2': 8, 'af_g2': 'relu', 'drop_p_g2': 0.0, 'n_hidden_layers_h_net': 2, 'hidden_dims_h_net': 32, 'af_h_net': 'tanh', 'drop_p_h_net': 0.0}. Best is trial 34 with value: 0.29422739148139954.
2025-07-29 13:22:48,798 - INFO - Trial 69 finished with value: 0.29424339532852173 and parameters: {'lr': 0.0031350665186697315, 'lamb': 0.0038, 'batch_size': 64, 'n_hidden_layers_g0': 2, 'hidden_dims_g0': 8, 'af_g0': 'softplus', 'drop_p_g0': 0.0, 'n_hidden_layers_g1': 2, 'hidden_dims_g1': 16, 'af_g1': 'softplus', 'drop_p_g1': 0.0, 'n_hidden_layers_g2': 1, 'hidden_dims_g2': 40, 'af_g2': 'softplus', 'drop_p_g2': 0.0, 'n_hidden_layers_h_net': 2, 'hidden_dims_h_net': 8, 'af_h_net': 'softplus', 'drop_p_h_net': 0.0}. Best is trial 34 with value: 0.29422739148139954.
