Using an existing study with name 'model-population-mpnn-population_mpnn_ic3_s5' instead of creating a new one.
Trial 2 finished with value: 0.00023274082923308015 and parameters: {'lr': 0.008224186867832035, 'lamb': 0.0, 'batch_size': 16, 'n_hidden_layers_g_net': 1, 'hidden_dims_g_net': 56, 'af_g_net': 'relu', 'drop_p_g_net': 0.3178538876413872, 'n_hidden_layers_h_net': 2, 'hidden_dims_h_net': 56, 'af_h_net': 'softplus', 'drop_p_h_net': 0.00045597092932767963}. Best is trial 0 with value: 0.00021123707119841129.
Trial 5 finished with value: 0.0007842633640393615 and parameters: {'lr': 0.013344002083002944, 'lamb': 0.0, 'batch_size': 32, 'n_hidden_layers_g_net': 1, 'hidden_dims_g_net': 16, 'af_g_net': 'tanh', 'drop_p_g_net': 0.0009743717941449498, 'n_hidden_layers_h_net': 2, 'hidden_dims_h_net': 16, 'af_h_net': 'tanh', 'drop_p_h_net': 0.0007197891051919157}. Best is trial 0 with value: 0.00021123707119841129.
Trial 6 finished with value: 0.001148717594332993 and parameters: {'lr': 0.0014883373311427887, 'lamb': 0.0, 'batch_size': 32, 'n_hidden_layers_g_net': 1, 'hidden_dims_g_net': 16, 'af_g_net': 'tanh', 'drop_p_g_net': 0.0040059878568104714, 'n_hidden_layers_h_net': 2, 'hidden_dims_h_net': 32, 'af_h_net': 'softplus', 'drop_p_h_net': 0.00016869507231967784}. Best is trial 0 with value: 0.00021123707119841129.
Trial 8 finished with value: 0.0012960926396772265 and parameters: {'lr': 0.037934662329902245, 'lamb': 0.0, 'batch_size': 16, 'n_hidden_layers_g_net': 2, 'hidden_dims_g_net': 32, 'af_g_net': 'tanh', 'drop_p_g_net': 0.1717601051357291, 'n_hidden_layers_h_net': 2, 'hidden_dims_h_net': 8, 'af_h_net': 'tanh', 'drop_p_h_net': 0.19486469840191675}. Best is trial 9 with value: 0.0001872399589046836.
Trial 12 finished with value: 0.00035198836121708155 and parameters: {'lr': 0.003544217102543922, 'lamb': 0.0, 'batch_size': 16, 'n_hidden_layers_g_net': 1, 'hidden_dims_g_net': 40, 'af_g_net': 'softplus', 'drop_p_g_net': 0.00043134674013518164, 'n_hidden_layers_h_net': 1, 'hidden_dims_h_net': 64, 'af_h_net': 'tanh', 'drop_p_h_net': 0.007994401778146682}. Best is trial 9 with value: 0.0001872399589046836.
Trial 14 finished with value: 0.00023421074729412794 and parameters: {'lr': 0.003621469570205723, 'lamb': 0.0, 'batch_size': 16, 'n_hidden_layers_g_net': 1, 'hidden_dims_g_net': 64, 'af_g_net': 'relu', 'drop_p_g_net': 0.002592439290621311, 'n_hidden_layers_h_net': 2, 'hidden_dims_h_net': 32, 'af_h_net': 'tanh', 'drop_p_h_net': 0.00011302990839920841}. Best is trial 13 with value: 0.0001844389335019514.
Trial 16 finished with value: 0.00031191407470032573 and parameters: {'lr': 0.006726980938238367, 'lamb': 0.0, 'batch_size': 16, 'n_hidden_layers_g_net': 1, 'hidden_dims_g_net': 40, 'af_g_net': 'relu', 'drop_p_g_net': 0.0007816588620241351, 'n_hidden_layers_h_net': 1, 'hidden_dims_h_net': 24, 'af_h_net': 'tanh', 'drop_p_h_net': 0.005429161618914989}. Best is trial 13 with value: 0.0001844389335019514.
Trial 17 finished with value: 0.00026106947916559875 and parameters: {'lr': 0.0022984811831076373, 'lamb': 0.0, 'batch_size': 16, 'n_hidden_layers_g_net': 1, 'hidden_dims_g_net': 48, 'af_g_net': 'relu', 'drop_p_g_net': 0.002558509048351489, 'n_hidden_layers_h_net': 1, 'hidden_dims_h_net': 24, 'af_h_net': 'relu', 'drop_p_h_net': 0.004390763904309466}. Best is trial 15 with value: 0.00018026219913735986.
Trial 20 finished with value: 0.00028757521067745984 and parameters: {'lr': 0.004565251137705199, 'lamb': 0.0, 'batch_size': 16, 'n_hidden_layers_g_net': 2, 'hidden_dims_g_net': 32, 'af_g_net': 'softplus', 'drop_p_g_net': 0.00017456438345821886, 'n_hidden_layers_h_net': 1, 'hidden_dims_h_net': 48, 'af_h_net': 'tanh', 'drop_p_h_net': 0.0212256270536955}. Best is trial 15 with value: 0.00018026219913735986.
Trial 23 finished with value: 0.00022927849204279482 and parameters: {'lr': 0.0022284362441962495, 'lamb': 0.0, 'batch_size': 16, 'n_hidden_layers_g_net': 1, 'hidden_dims_g_net': 48, 'af_g_net': 'relu', 'drop_p_g_net': 0.006785357235850797, 'n_hidden_layers_h_net': 1, 'hidden_dims_h_net': 48, 'af_h_net': 'tanh', 'drop_p_h_net': 0.0014989694770327874}. Best is trial 21 with value: 0.00016929360572248697.
