2025-07-29 22:25:37,520 - INFO - Trial 39 finished with value: 93.0447998046875 and parameters: {'lr': 0.01754227830347334, 'lamb': 0.006, 'batch_size': 32, 'n_hidden_layers_g0': 2, 'hidden_dims_g0': 16, 'af_g0': 'relu', 'drop_p_g0': 0.0, 'n_hidden_layers_g1': 1, 'hidden_dims_g1': 48, 'af_g1': 'tanh', 'drop_p_g1': 0.0, 'n_hidden_layers_g2': 1, 'hidden_dims_g2': 32, 'af_g2': 'relu', 'drop_p_g2': 0.0, 'n_hidden_layers_h_net': 1, 'hidden_dims_h_net': 40, 'af_h_net': 'relu', 'drop_p_h_net': 0.0}. Best is trial 12 with value: 93.04145812988281.
2025-07-29 22:32:10,253 - INFO - Trial 40 finished with value: 93.04530334472656 and parameters: {'lr': 0.023903623163807737, 'lamb': 0.005200000000000001, 'batch_size': 16, 'n_hidden_layers_g0': 1, 'hidden_dims_g0': 48, 'af_g0': 'relu', 'drop_p_g0': 0.0, 'n_hidden_layers_g1': 1, 'hidden_dims_g1': 32, 'af_g1': 'softplus', 'drop_p_g1': 0.0, 'n_hidden_layers_g2': 2, 'hidden_dims_g2': 8, 'af_g2': 'relu', 'drop_p_g2': 0.0, 'n_hidden_layers_h_net': 2, 'hidden_dims_h_net': 64, 'af_h_net': 'relu', 'drop_p_h_net': 0.0}. Best is trial 12 with value: 93.04145812988281.
2025-07-29 22:43:47,530 - INFO - Trial 41 finished with value: 93.04331970214844 and parameters: {'lr': 0.01910514645527149, 'lamb': 0.0076, 'batch_size': 16, 'n_hidden_layers_g0': 1, 'hidden_dims_g0': 16, 'af_g0': 'tanh', 'drop_p_g0': 0.0, 'n_hidden_layers_g1': 1, 'hidden_dims_g1': 32, 'af_g1': 'tanh', 'drop_p_g1': 0.0, 'n_hidden_layers_g2': 2, 'hidden_dims_g2': 16, 'af_g2': 'relu', 'drop_p_g2': 0.0, 'n_hidden_layers_h_net': 1, 'hidden_dims_h_net': 56, 'af_h_net': 'relu', 'drop_p_h_net': 0.0}. Best is trial 12 with value: 93.04145812988281.
2025-07-29 22:54:10,621 - INFO - Trial 42 finished with value: 93.04290771484375 and parameters: {'lr': 0.03203333366582035, 'lamb': 0.009300000000000001, 'batch_size': 16, 'n_hidden_layers_g0': 1, 'hidden_dims_g0': 8, 'af_g0': 'tanh', 'drop_p_g0': 0.0, 'n_hidden_layers_g1': 1, 'hidden_dims_g1': 40, 'af_g1': 'tanh', 'drop_p_g1': 0.0, 'n_hidden_layers_g2': 2, 'hidden_dims_g2': 16, 'af_g2': 'relu', 'drop_p_g2': 0.0, 'n_hidden_layers_h_net': 1, 'hidden_dims_h_net': 56, 'af_h_net': 'relu', 'drop_p_h_net': 0.0}. Best is trial 12 with value: 93.04145812988281.
2025-07-29 22:58:57,423 - INFO - Trial 43 finished with value: 93.04450225830078 and parameters: {'lr': 0.03657243489906519, 'lamb': 0.0092, 'batch_size': 16, 'n_hidden_layers_g0': 1, 'hidden_dims_g0': 8, 'af_g0': 'tanh', 'drop_p_g0': 0.0, 'n_hidden_layers_g1': 1, 'hidden_dims_g1': 32, 'af_g1': 'tanh', 'drop_p_g1': 0.0, 'n_hidden_layers_g2': 2, 'hidden_dims_g2': 16, 'af_g2': 'relu', 'drop_p_g2': 0.0, 'n_hidden_layers_h_net': 1, 'hidden_dims_h_net': 56, 'af_h_net': 'relu', 'drop_p_h_net': 0.0}. Best is trial 12 with value: 93.04145812988281.
2025-07-29 23:02:43,073 - INFO - Trial 44 finished with value: 93.04430389404297 and parameters: {'lr': 0.029335441283944462, 'lamb': 0.006900000000000001, 'batch_size': 16, 'n_hidden_layers_g0': 1, 'hidden_dims_g0': 8, 'af_g0': 'tanh', 'drop_p_g0': 0.0, 'n_hidden_layers_g1': 1, 'hidden_dims_g1': 40, 'af_g1': 'tanh', 'drop_p_g1': 0.0, 'n_hidden_layers_g2': 2, 'hidden_dims_g2': 48, 'af_g2': 'relu', 'drop_p_g2': 0.0, 'n_hidden_layers_h_net': 1, 'hidden_dims_h_net': 64, 'af_h_net': 'relu', 'drop_p_h_net': 0.0}. Best is trial 12 with value: 93.04145812988281.
2025-07-29 23:07:23,846 - INFO - Trial 45 finished with value: 93.04360961914062 and parameters: {'lr': 0.047910854471913976, 'lamb': 0.0085, 'batch_size': 32, 'n_hidden_layers_g0': 1, 'hidden_dims_g0': 8, 'af_g0': 'tanh', 'drop_p_g0': 0.0, 'n_hidden_layers_g1': 1, 'hidden_dims_g1': 24, 'af_g1': 'tanh', 'drop_p_g1': 0.0, 'n_hidden_layers_g2': 2, 'hidden_dims_g2': 8, 'af_g2': 'relu', 'drop_p_g2': 0.0, 'n_hidden_layers_h_net': 1, 'hidden_dims_h_net': 56, 'af_h_net': 'relu', 'drop_p_h_net': 0.0}. Best is trial 12 with value: 93.04145812988281.
2025-07-29 23:11:11,136 - INFO - Trial 46 finished with value: 93.04535675048828 and parameters: {'lr': 0.01842034801788766, 'lamb': 0.0095, 'batch_size': 16, 'n_hidden_layers_g0': 1, 'hidden_dims_g0': 24, 'af_g0': 'tanh', 'drop_p_g0': 0.0, 'n_hidden_layers_g1': 1, 'hidden_dims_g1': 48, 'af_g1': 'tanh', 'drop_p_g1': 0.0, 'n_hidden_layers_g2': 2, 'hidden_dims_g2': 16, 'af_g2': 'tanh', 'drop_p_g2': 0.0, 'n_hidden_layers_h_net': 1, 'hidden_dims_h_net': 48, 'af_h_net': 'softplus', 'drop_p_h_net': 0.0}. Best is trial 12 with value: 93.04145812988281.
2025-07-29 23:14:27,490 - INFO - Trial 47 finished with value: 93.04435729980469 and parameters: {'lr': 0.03894908531459748, 'lamb': 0.008, 'batch_size': 16, 'n_hidden_layers_g0': 1, 'hidden_dims_g0': 16, 'af_g0': 'tanh', 'drop_p_g0': 0.0, 'n_hidden_layers_g1': 1, 'hidden_dims_g1': 32, 'af_g1': 'tanh', 'drop_p_g1': 0.0, 'n_hidden_layers_g2': 2, 'hidden_dims_g2': 24, 'af_g2': 'relu', 'drop_p_g2': 0.0, 'n_hidden_layers_h_net': 1, 'hidden_dims_h_net': 56, 'af_h_net': 'relu', 'drop_p_h_net': 0.0}. Best is trial 12 with value: 93.04145812988281.
2025-07-29 23:18:07,941 - INFO - Trial 48 finished with value: 93.04471588134766 and parameters: {'lr': 0.026951072058936414, 'lamb': 0.0044, 'batch_size': 16, 'n_hidden_layers_g0': 1, 'hidden_dims_g0': 8, 'af_g0': 'relu', 'drop_p_g0': 0.0, 'n_hidden_layers_g1': 1, 'hidden_dims_g1': 40, 'af_g1': 'relu', 'drop_p_g1': 0.0, 'n_hidden_layers_g2': 2, 'hidden_dims_g2': 16, 'af_g2': 'softplus', 'drop_p_g2': 0.0, 'n_hidden_layers_h_net': 1, 'hidden_dims_h_net': 48, 'af_h_net': 'tanh', 'drop_p_h_net': 0.0}. Best is trial 12 with value: 93.04145812988281.
2025-07-29 23:22:47,529 - INFO - Trial 49 finished with value: 93.04357147216797 and parameters: {'lr': 0.02167420658049853, 'lamb': 0.009600000000000001, 'batch_size': 64, 'n_hidden_layers_g0': 2, 'hidden_dims_g0': 24, 'af_g0': 'softplus', 'drop_p_g0': 0.0, 'n_hidden_layers_g1': 2, 'hidden_dims_g1': 32, 'af_g1': 'tanh', 'drop_p_g1': 0.0, 'n_hidden_layers_g2': 2, 'hidden_dims_g2': 56, 'af_g2': 'relu', 'drop_p_g2': 0.0, 'n_hidden_layers_h_net': 1, 'hidden_dims_h_net': 64, 'af_h_net': 'relu', 'drop_p_h_net': 0.0}. Best is trial 12 with value: 93.04145812988281.
2025-07-29 23:27:40,605 - INFO - Trial 50 finished with value: 93.04532623291016 and parameters: {'lr': 0.012822020346708495, 'lamb': 0.0077, 'batch_size': 16, 'n_hidden_layers_g0': 1, 'hidden_dims_g0': 16, 'af_g0': 'tanh', 'drop_p_g0': 0.0, 'n_hidden_layers_g1': 1, 'hidden_dims_g1': 24, 'af_g1': 'tanh', 'drop_p_g1': 0.0, 'n_hidden_layers_g2': 2, 'hidden_dims_g2': 8, 'af_g2': 'relu', 'drop_p_g2': 0.0, 'n_hidden_layers_h_net': 1, 'hidden_dims_h_net': 56, 'af_h_net': 'softplus', 'drop_p_h_net': 0.0}. Best is trial 12 with value: 93.04145812988281.
2025-07-29 23:33:27,393 - INFO - Trial 51 finished with value: 93.04422760009766 and parameters: {'lr': 0.03342686536822075, 'lamb': 0.009000000000000001, 'batch_size': 16, 'n_hidden_layers_g0': 1, 'hidden_dims_g0': 16, 'af_g0': 'tanh', 'drop_p_g0': 0.0, 'n_hidden_layers_g1': 1, 'hidden_dims_g1': 40, 'af_g1': 'tanh', 'drop_p_g1': 0.0, 'n_hidden_layers_g2': 2, 'hidden_dims_g2': 16, 'af_g2': 'relu', 'drop_p_g2': 0.0, 'n_hidden_layers_h_net': 1, 'hidden_dims_h_net': 24, 'af_h_net': 'relu', 'drop_p_h_net': 0.0}. Best is trial 12 with value: 93.04145812988281.
2025-07-29 23:39:48,137 - INFO - Trial 52 finished with value: 93.04474639892578 and parameters: {'lr': 0.006036615982263223, 'lamb': 0.0083, 'batch_size': 16, 'n_hidden_layers_g0': 1, 'hidden_dims_g0': 24, 'af_g0': 'tanh', 'drop_p_g0': 0.0, 'n_hidden_layers_g1': 1, 'hidden_dims_g1': 40, 'af_g1': 'tanh', 'drop_p_g1': 0.0, 'n_hidden_layers_g2': 2, 'hidden_dims_g2': 24, 'af_g2': 'relu', 'drop_p_g2': 0.0, 'n_hidden_layers_h_net': 1, 'hidden_dims_h_net': 48, 'af_h_net': 'relu', 'drop_p_h_net': 0.0}. Best is trial 12 with value: 93.04145812988281.
2025-07-29 23:47:28,214 - INFO - Trial 53 finished with value: 93.04419708251953 and parameters: {'lr': 0.04199965804759533, 'lamb': 0.0071, 'batch_size': 16, 'n_hidden_layers_g0': 1, 'hidden_dims_g0': 16, 'af_g0': 'tanh', 'drop_p_g0': 0.0, 'n_hidden_layers_g1': 1, 'hidden_dims_g1': 40, 'af_g1': 'tanh', 'drop_p_g1': 0.0, 'n_hidden_layers_g2': 2, 'hidden_dims_g2': 24, 'af_g2': 'relu', 'drop_p_g2': 0.0, 'n_hidden_layers_h_net': 1, 'hidden_dims_h_net': 64, 'af_h_net': 'relu', 'drop_p_h_net': 0.0}. Best is trial 12 with value: 93.04145812988281.
2025-07-29 23:50:53,791 - INFO - Trial 54 finished with value: 93.04644775390625 and parameters: {'lr': 0.002072995185797986, 'lamb': 0.0097, 'batch_size': 16, 'n_hidden_layers_g0': 1, 'hidden_dims_g0': 8, 'af_g0': 'tanh', 'drop_p_g0': 0.0, 'n_hidden_layers_g1': 1, 'hidden_dims_g1': 32, 'af_g1': 'tanh', 'drop_p_g1': 0.0, 'n_hidden_layers_g2': 2, 'hidden_dims_g2': 16, 'af_g2': 'relu', 'drop_p_g2': 0.0, 'n_hidden_layers_h_net': 1, 'hidden_dims_h_net': 8, 'af_h_net': 'relu', 'drop_p_h_net': 0.0}. Best is trial 12 with value: 93.04145812988281.
2025-07-29 23:59:24,696 - INFO - Trial 55 finished with value: 93.04325866699219 and parameters: {'lr': 0.004478420694208712, 'lamb': 0.0088, 'batch_size': 32, 'n_hidden_layers_g0': 1, 'hidden_dims_g0': 64, 'af_g0': 'tanh', 'drop_p_g0': 0.0, 'n_hidden_layers_g1': 1, 'hidden_dims_g1': 48, 'af_g1': 'tanh', 'drop_p_g1': 0.0, 'n_hidden_layers_g2': 2, 'hidden_dims_g2': 8, 'af_g2': 'tanh', 'drop_p_g2': 0.0, 'n_hidden_layers_h_net': 1, 'hidden_dims_h_net': 32, 'af_h_net': 'relu', 'drop_p_h_net': 0.0}. Best is trial 12 with value: 93.04145812988281.
2025-07-30 00:07:56,498 - INFO - Trial 56 finished with value: 93.0464096069336 and parameters: {'lr': 0.0005020438532125371, 'lamb': 0.008700000000000001, 'batch_size': 32, 'n_hidden_layers_g0': 1, 'hidden_dims_g0': 48, 'af_g0': 'tanh', 'drop_p_g0': 0.0, 'n_hidden_layers_g1': 1, 'hidden_dims_g1': 48, 'af_g1': 'tanh', 'drop_p_g1': 0.0, 'n_hidden_layers_g2': 2, 'hidden_dims_g2': 8, 'af_g2': 'tanh', 'drop_p_g2': 0.0, 'n_hidden_layers_h_net': 1, 'hidden_dims_h_net': 16, 'af_h_net': 'relu', 'drop_p_h_net': 0.0}. Best is trial 12 with value: 93.04145812988281.
2025-07-30 00:09:59,320 - INFO - Trial 57 finished with value: 93.04505920410156 and parameters: {'lr': 0.011849293322525453, 'lamb': 0.0092, 'batch_size': 32, 'n_hidden_layers_g0': 1, 'hidden_dims_g0': 64, 'af_g0': 'tanh', 'drop_p_g0': 0.0, 'n_hidden_layers_g1': 1, 'hidden_dims_g1': 48, 'af_g1': 'softplus', 'drop_p_g1': 0.0, 'n_hidden_layers_g2': 2, 'hidden_dims_g2': 8, 'af_g2': 'tanh', 'drop_p_g2': 0.0, 'n_hidden_layers_h_net': 1, 'hidden_dims_h_net': 16, 'af_h_net': 'softplus', 'drop_p_h_net': 0.0}. Best is trial 12 with value: 93.04145812988281.
2025-07-30 00:18:31,730 - INFO - Trial 58 finished with value: 93.04364776611328 and parameters: {'lr': 0.003920889266009185, 'lamb': 0.01, 'batch_size': 32, 'n_hidden_layers_g0': 2, 'hidden_dims_g0': 56, 'af_g0': 'tanh', 'drop_p_g0': 0.0, 'n_hidden_layers_g1': 1, 'hidden_dims_g1': 48, 'af_g1': 'tanh', 'drop_p_g1': 0.0, 'n_hidden_layers_g2': 2, 'hidden_dims_g2': 8, 'af_g2': 'tanh', 'drop_p_g2': 0.0, 'n_hidden_layers_h_net': 1, 'hidden_dims_h_net': 56, 'af_h_net': 'relu', 'drop_p_h_net': 0.0}. Best is trial 12 with value: 93.04145812988281.
2025-07-30 00:20:29,702 - INFO - Trial 59 finished with value: 93.0454330444336 and parameters: {'lr': 0.01625581195038001, 'lamb': 0.0029000000000000002, 'batch_size': 32, 'n_hidden_layers_g0': 1, 'hidden_dims_g0': 56, 'af_g0': 'relu', 'drop_p_g0': 0.0, 'n_hidden_layers_g1': 1, 'hidden_dims_g1': 40, 'af_g1': 'tanh', 'drop_p_g1': 0.0, 'n_hidden_layers_g2': 2, 'hidden_dims_g2': 16, 'af_g2': 'tanh', 'drop_p_g2': 0.0, 'n_hidden_layers_h_net': 1, 'hidden_dims_h_net': 40, 'af_h_net': 'tanh', 'drop_p_h_net': 0.0}. Best is trial 12 with value: 93.04145812988281.
2025-07-30 00:22:20,168 - INFO - Trial 60 finished with value: 93.04551696777344 and parameters: {'lr': 0.004922241004546831, 'lamb': 0.0017000000000000001, 'batch_size': 32, 'n_hidden_layers_g0': 1, 'hidden_dims_g0': 32, 'af_g0': 'softplus', 'drop_p_g0': 0.0, 'n_hidden_layers_g1': 1, 'hidden_dims_g1': 56, 'af_g1': 'tanh', 'drop_p_g1': 0.0, 'n_hidden_layers_g2': 2, 'hidden_dims_g2': 8, 'af_g2': 'tanh', 'drop_p_g2': 0.0, 'n_hidden_layers_h_net': 1, 'hidden_dims_h_net': 32, 'af_h_net': 'relu', 'drop_p_h_net': 0.0}. Best is trial 12 with value: 93.04145812988281.
2025-07-30 00:28:09,284 - INFO - Trial 61 finished with value: 93.04412078857422 and parameters: {'lr': 0.008172972932265925, 'lamb': 0.0089, 'batch_size': 16, 'n_hidden_layers_g0': 1, 'hidden_dims_g0': 40, 'af_g0': 'tanh', 'drop_p_g0': 0.0, 'n_hidden_layers_g1': 1, 'hidden_dims_g1': 40, 'af_g1': 'tanh', 'drop_p_g1': 0.0, 'n_hidden_layers_g2': 2, 'hidden_dims_g2': 16, 'af_g2': 'relu', 'drop_p_g2': 0.0, 'n_hidden_layers_h_net': 1, 'hidden_dims_h_net': 48, 'af_h_net': 'relu', 'drop_p_h_net': 0.0}. Best is trial 12 with value: 93.04145812988281.
2025-07-30 00:42:53,670 - INFO - Trial 62 finished with value: 93.04363250732422 and parameters: {'lr': 0.0025464833896535893, 'lamb': 0.008, 'batch_size': 16, 'n_hidden_layers_g0': 1, 'hidden_dims_g0': 16, 'af_g0': 'tanh', 'drop_p_g0': 0.0, 'n_hidden_layers_g1': 1, 'hidden_dims_g1': 32, 'af_g1': 'tanh', 'drop_p_g1': 0.0, 'n_hidden_layers_g2': 2, 'hidden_dims_g2': 24, 'af_g2': 'relu', 'drop_p_g2': 0.0, 'n_hidden_layers_h_net': 1, 'hidden_dims_h_net': 56, 'af_h_net': 'relu', 'drop_p_h_net': 0.0}. Best is trial 12 with value: 93.04145812988281.
2025-07-30 00:57:28,096 - INFO - Trial 63 finished with value: 93.04285430908203 and parameters: {'lr': 0.0033480261650560743, 'lamb': 0.0085, 'batch_size': 16, 'n_hidden_layers_g0': 1, 'hidden_dims_g0': 24, 'af_g0': 'tanh', 'drop_p_g0': 0.0, 'n_hidden_layers_g1': 1, 'hidden_dims_g1': 40, 'af_g1': 'tanh', 'drop_p_g1': 0.0, 'n_hidden_layers_g2': 2, 'hidden_dims_g2': 16, 'af_g2': 'softplus', 'drop_p_g2': 0.0, 'n_hidden_layers_h_net': 1, 'hidden_dims_h_net': 32, 'af_h_net': 'relu', 'drop_p_h_net': 0.0}. Best is trial 12 with value: 93.04145812988281.
2025-07-30 01:04:54,937 - INFO - Trial 64 finished with value: 93.04490661621094 and parameters: {'lr': 0.004218970216667217, 'lamb': 0.0085, 'batch_size': 16, 'n_hidden_layers_g0': 1, 'hidden_dims_g0': 24, 'af_g0': 'tanh', 'drop_p_g0': 0.0, 'n_hidden_layers_g1': 1, 'hidden_dims_g1': 40, 'af_g1': 'tanh', 'drop_p_g1': 0.0, 'n_hidden_layers_g2': 2, 'hidden_dims_g2': 16, 'af_g2': 'softplus', 'drop_p_g2': 0.0, 'n_hidden_layers_h_net': 1, 'hidden_dims_h_net': 32, 'af_h_net': 'relu', 'drop_p_h_net': 0.0}. Best is trial 12 with value: 93.04145812988281.
2025-07-30 01:10:26,093 - INFO - Trial 65 finished with value: 93.04573059082031 and parameters: {'lr': 0.0012505214075705599, 'lamb': 0.0048000000000000004, 'batch_size': 64, 'n_hidden_layers_g0': 1, 'hidden_dims_g0': 24, 'af_g0': 'tanh', 'drop_p_g0': 0.0, 'n_hidden_layers_g1': 1, 'hidden_dims_g1': 32, 'af_g1': 'tanh', 'drop_p_g1': 0.0, 'n_hidden_layers_g2': 2, 'hidden_dims_g2': 8, 'af_g2': 'softplus', 'drop_p_g2': 0.0, 'n_hidden_layers_h_net': 1, 'hidden_dims_h_net': 24, 'af_h_net': 'relu', 'drop_p_h_net': 0.0}. Best is trial 12 with value: 93.04145812988281.
2025-07-30 01:13:26,386 - INFO - Trial 66 finished with value: 93.0450439453125 and parameters: {'lr': 0.005487557981121184, 'lamb': 0.0091, 'batch_size': 16, 'n_hidden_layers_g0': 1, 'hidden_dims_g0': 32, 'af_g0': 'tanh', 'drop_p_g0': 0.0, 'n_hidden_layers_g1': 1, 'hidden_dims_g1': 64, 'af_g1': 'tanh', 'drop_p_g1': 0.0, 'n_hidden_layers_g2': 2, 'hidden_dims_g2': 16, 'af_g2': 'softplus', 'drop_p_g2': 0.0, 'n_hidden_layers_h_net': 1, 'hidden_dims_h_net': 32, 'af_h_net': 'softplus', 'drop_p_h_net': 0.0}. Best is trial 12 with value: 93.04145812988281.
2025-07-30 01:28:02,023 - INFO - Trial 67 finished with value: 93.04337310791016 and parameters: {'lr': 0.003437648712427597, 'lamb': 0.0066, 'batch_size': 16, 'n_hidden_layers_g0': 1, 'hidden_dims_g0': 16, 'af_g0': 'tanh', 'drop_p_g0': 0.0, 'n_hidden_layers_g1': 1, 'hidden_dims_g1': 40, 'af_g1': 'relu', 'drop_p_g1': 0.0, 'n_hidden_layers_g2': 2, 'hidden_dims_g2': 8, 'af_g2': 'softplus', 'drop_p_g2': 0.0, 'n_hidden_layers_h_net': 1, 'hidden_dims_h_net': 32, 'af_h_net': 'relu', 'drop_p_h_net': 0.0}. Best is trial 12 with value: 93.04145812988281.
2025-07-30 01:34:06,786 - INFO - Trial 68 finished with value: 93.04419708251953 and parameters: {'lr': 0.009761158951716212, 'lamb': 0.009600000000000001, 'batch_size': 16, 'n_hidden_layers_g0': 2, 'hidden_dims_g0': 40, 'af_g0': 'tanh', 'drop_p_g0': 0.0, 'n_hidden_layers_g1': 1, 'hidden_dims_g1': 48, 'af_g1': 'tanh', 'drop_p_g1': 0.0, 'n_hidden_layers_g2': 2, 'hidden_dims_g2': 16, 'af_g2': 'softplus', 'drop_p_g2': 0.0, 'n_hidden_layers_h_net': 1, 'hidden_dims_h_net': 64, 'af_h_net': 'relu', 'drop_p_h_net': 0.0}. Best is trial 12 with value: 93.04145812988281.
2025-07-30 01:38:31,215 - INFO - Trial 69 finished with value: 93.04409790039062 and parameters: {'lr': 0.028227353291745527, 'lamb': 0.0056, 'batch_size': 32, 'n_hidden_layers_g0': 1, 'hidden_dims_g0': 24, 'af_g0': 'tanh', 'drop_p_g0': 0.0, 'n_hidden_layers_g1': 1, 'hidden_dims_g1': 8, 'af_g1': 'tanh', 'drop_p_g1': 0.0, 'n_hidden_layers_g2': 2, 'hidden_dims_g2': 16, 'af_g2': 'tanh', 'drop_p_g2': 0.0, 'n_hidden_layers_h_net': 1, 'hidden_dims_h_net': 40, 'af_h_net': 'tanh', 'drop_p_h_net': 0.0}. Best is trial 12 with value: 93.04145812988281.
