2025-07-29 18:55:12,145 - INFO - A new study created in Journal with name: model-biochemical-llc-biochemical_llc_20db_3
2025-07-29 18:58:17,156 - INFO - Trial 0 finished with value: 93.04590606689453 and parameters: {'lr': 0.0028057582076672534, 'lamb': 0.009600000000000001, 'batch_size': 16, 'n_hidden_layers_g0': 1, 'hidden_dims_g0': 8, 'af_g0': 'relu', 'drop_p_g0': 0.0, 'n_hidden_layers_g1': 1, 'hidden_dims_g1': 64, 'af_g1': 'relu', 'drop_p_g1': 0.0, 'n_hidden_layers_g2': 1, 'hidden_dims_g2': 24, 'af_g2': 'relu', 'drop_p_g2': 0.0, 'n_hidden_layers_h_net': 2, 'hidden_dims_h_net': 16, 'af_h_net': 'tanh', 'drop_p_h_net': 0.0}. Best is trial 0 with value: 93.04590606689453.
2025-07-29 19:01:21,196 - INFO - Trial 1 finished with value: 93.04489135742188 and parameters: {'lr': 0.018591820902866044, 'lamb': 0.002, 'batch_size': 32, 'n_hidden_layers_g0': 2, 'hidden_dims_g0': 16, 'af_g0': 'tanh', 'drop_p_g0': 0.0, 'n_hidden_layers_g1': 2, 'hidden_dims_g1': 24, 'af_g1': 'softplus', 'drop_p_g1': 0.0, 'n_hidden_layers_g2': 1, 'hidden_dims_g2': 32, 'af_g2': 'softplus', 'drop_p_g2': 0.0, 'n_hidden_layers_h_net': 2, 'hidden_dims_h_net': 24, 'af_h_net': 'softplus', 'drop_p_h_net': 0.0}. Best is trial 1 with value: 93.04489135742188.
2025-07-29 19:07:51,307 - INFO - Trial 2 finished with value: 93.04364013671875 and parameters: {'lr': 0.04346495755569776, 'lamb': 0.0078000000000000005, 'batch_size': 16, 'n_hidden_layers_g0': 2, 'hidden_dims_g0': 8, 'af_g0': 'tanh', 'drop_p_g0': 0.0, 'n_hidden_layers_g1': 1, 'hidden_dims_g1': 24, 'af_g1': 'relu', 'drop_p_g1': 0.0, 'n_hidden_layers_g2': 2, 'hidden_dims_g2': 16, 'af_g2': 'tanh', 'drop_p_g2': 0.0, 'n_hidden_layers_h_net': 2, 'hidden_dims_h_net': 16, 'af_h_net': 'softplus', 'drop_p_h_net': 0.0}. Best is trial 2 with value: 93.04364013671875.
2025-07-29 19:16:52,890 - INFO - Trial 3 finished with value: 93.04410552978516 and parameters: {'lr': 0.014354376740977342, 'lamb': 0.0077, 'batch_size': 32, 'n_hidden_layers_g0': 2, 'hidden_dims_g0': 40, 'af_g0': 'relu', 'drop_p_g0': 0.0, 'n_hidden_layers_g1': 1, 'hidden_dims_g1': 48, 'af_g1': 'softplus', 'drop_p_g1': 0.0, 'n_hidden_layers_g2': 1, 'hidden_dims_g2': 48, 'af_g2': 'tanh', 'drop_p_g2': 0.0, 'n_hidden_layers_h_net': 1, 'hidden_dims_h_net': 40, 'af_h_net': 'relu', 'drop_p_h_net': 0.0}. Best is trial 2 with value: 93.04364013671875.
2025-07-29 19:18:07,177 - INFO - Trial 4 finished with value: 93.0458755493164 and parameters: {'lr': 0.0005778676408134936, 'lamb': 0.0064, 'batch_size': 64, 'n_hidden_layers_g0': 1, 'hidden_dims_g0': 32, 'af_g0': 'relu', 'drop_p_g0': 0.0, 'n_hidden_layers_g1': 1, 'hidden_dims_g1': 16, 'af_g1': 'relu', 'drop_p_g1': 0.0, 'n_hidden_layers_g2': 2, 'hidden_dims_g2': 56, 'af_g2': 'softplus', 'drop_p_g2': 0.0, 'n_hidden_layers_h_net': 2, 'hidden_dims_h_net': 64, 'af_h_net': 'relu', 'drop_p_h_net': 0.0}. Best is trial 2 with value: 93.04364013671875.
2025-07-29 19:33:14,757 - INFO - Trial 5 finished with value: 93.04338836669922 and parameters: {'lr': 0.0035742553967564933, 'lamb': 0.0082, 'batch_size': 16, 'n_hidden_layers_g0': 1, 'hidden_dims_g0': 16, 'af_g0': 'tanh', 'drop_p_g0': 0.0, 'n_hidden_layers_g1': 1, 'hidden_dims_g1': 40, 'af_g1': 'tanh', 'drop_p_g1': 0.0, 'n_hidden_layers_g2': 2, 'hidden_dims_g2': 24, 'af_g2': 'relu', 'drop_p_g2': 0.0, 'n_hidden_layers_h_net': 1, 'hidden_dims_h_net': 40, 'af_h_net': 'relu', 'drop_p_h_net': 0.0}. Best is trial 5 with value: 93.04338836669922.
2025-07-29 19:36:54,042 - INFO - Trial 6 finished with value: 93.04471588134766 and parameters: {'lr': 0.032771911717731424, 'lamb': 0.0024000000000000002, 'batch_size': 64, 'n_hidden_layers_g0': 1, 'hidden_dims_g0': 48, 'af_g0': 'relu', 'drop_p_g0': 0.0, 'n_hidden_layers_g1': 1, 'hidden_dims_g1': 48, 'af_g1': 'relu', 'drop_p_g1': 0.0, 'n_hidden_layers_g2': 2, 'hidden_dims_g2': 24, 'af_g2': 'tanh', 'drop_p_g2': 0.0, 'n_hidden_layers_h_net': 2, 'hidden_dims_h_net': 8, 'af_h_net': 'tanh', 'drop_p_h_net': 0.0}. Best is trial 5 with value: 93.04338836669922.
2025-07-29 19:39:21,740 - INFO - Trial 7 finished with value: 93.04594421386719 and parameters: {'lr': 0.0011160993683450788, 'lamb': 0.006900000000000001, 'batch_size': 32, 'n_hidden_layers_g0': 1, 'hidden_dims_g0': 8, 'af_g0': 'relu', 'drop_p_g0': 0.0, 'n_hidden_layers_g1': 2, 'hidden_dims_g1': 56, 'af_g1': 'relu', 'drop_p_g1': 0.0, 'n_hidden_layers_g2': 1, 'hidden_dims_g2': 64, 'af_g2': 'relu', 'drop_p_g2': 0.0, 'n_hidden_layers_h_net': 1, 'hidden_dims_h_net': 48, 'af_h_net': 'relu', 'drop_p_h_net': 0.0}. Best is trial 5 with value: 93.04338836669922.
2025-07-29 19:41:13,215 - INFO - Trial 8 finished with value: 93.04535675048828 and parameters: {'lr': 0.009616860064438593, 'lamb': 0.0008, 'batch_size': 32, 'n_hidden_layers_g0': 1, 'hidden_dims_g0': 8, 'af_g0': 'relu', 'drop_p_g0': 0.0, 'n_hidden_layers_g1': 2, 'hidden_dims_g1': 48, 'af_g1': 'tanh', 'drop_p_g1': 0.0, 'n_hidden_layers_g2': 1, 'hidden_dims_g2': 24, 'af_g2': 'tanh', 'drop_p_g2': 0.0, 'n_hidden_layers_h_net': 2, 'hidden_dims_h_net': 40, 'af_h_net': 'softplus', 'drop_p_h_net': 0.0}. Best is trial 5 with value: 93.04338836669922.
2025-07-29 19:43:27,504 - INFO - Trial 9 finished with value: 93.04590606689453 and parameters: {'lr': 0.0015379750534360189, 'lamb': 0.0098, 'batch_size': 32, 'n_hidden_layers_g0': 2, 'hidden_dims_g0': 40, 'af_g0': 'relu', 'drop_p_g0': 0.0, 'n_hidden_layers_g1': 2, 'hidden_dims_g1': 24, 'af_g1': 'softplus', 'drop_p_g1': 0.0, 'n_hidden_layers_g2': 2, 'hidden_dims_g2': 64, 'af_g2': 'relu', 'drop_p_g2': 0.0, 'n_hidden_layers_h_net': 2, 'hidden_dims_h_net': 32, 'af_h_net': 'relu', 'drop_p_h_net': 0.0}. Best is trial 5 with value: 93.04338836669922.
2025-07-29 19:53:37,246 - INFO - Trial 10 finished with value: 93.04519653320312 and parameters: {'lr': 0.004894530976108318, 'lamb': 0.0047, 'batch_size': 16, 'n_hidden_layers_g0': 1, 'hidden_dims_g0': 64, 'af_g0': 'softplus', 'drop_p_g0': 0.0, 'n_hidden_layers_g1': 1, 'hidden_dims_g1': 8, 'af_g1': 'tanh', 'drop_p_g1': 0.0, 'n_hidden_layers_g2': 2, 'hidden_dims_g2': 8, 'af_g2': 'relu', 'drop_p_g2': 0.0, 'n_hidden_layers_h_net': 1, 'hidden_dims_h_net': 56, 'af_h_net': 'relu', 'drop_p_h_net': 0.0}. Best is trial 5 with value: 93.04338836669922.
2025-07-29 19:57:55,789 - INFO - Trial 11 finished with value: 93.04535675048828 and parameters: {'lr': 0.00523585731310674, 'lamb': 0.0082, 'batch_size': 16, 'n_hidden_layers_g0': 2, 'hidden_dims_g0': 24, 'af_g0': 'tanh', 'drop_p_g0': 0.0, 'n_hidden_layers_g1': 1, 'hidden_dims_g1': 32, 'af_g1': 'tanh', 'drop_p_g1': 0.0, 'n_hidden_layers_g2': 2, 'hidden_dims_g2': 8, 'af_g2': 'tanh', 'drop_p_g2': 0.0, 'n_hidden_layers_h_net': 1, 'hidden_dims_h_net': 24, 'af_h_net': 'softplus', 'drop_p_h_net': 0.0}. Best is trial 5 with value: 93.04338836669922.
2025-07-29 20:02:17,132 - INFO - Trial 12 finished with value: 93.04145812988281 and parameters: {'lr': 0.04985341137518216, 'lamb': 0.005, 'batch_size': 16, 'n_hidden_layers_g0': 2, 'hidden_dims_g0': 24, 'af_g0': 'tanh', 'drop_p_g0': 0.0, 'n_hidden_layers_g1': 1, 'hidden_dims_g1': 32, 'af_g1': 'tanh', 'drop_p_g1': 0.0, 'n_hidden_layers_g2': 2, 'hidden_dims_g2': 16, 'af_g2': 'relu', 'drop_p_g2': 0.0, 'n_hidden_layers_h_net': 1, 'hidden_dims_h_net': 8, 'af_h_net': 'softplus', 'drop_p_h_net': 0.0}. Best is trial 12 with value: 93.04145812988281.
2025-07-29 20:05:38,950 - INFO - Trial 13 finished with value: 93.04521942138672 and parameters: {'lr': 0.004465589588815272, 'lamb': 0.0051, 'batch_size': 16, 'n_hidden_layers_g0': 2, 'hidden_dims_g0': 24, 'af_g0': 'tanh', 'drop_p_g0': 0.0, 'n_hidden_layers_g1': 1, 'hidden_dims_g1': 40, 'af_g1': 'tanh', 'drop_p_g1': 0.0, 'n_hidden_layers_g2': 2, 'hidden_dims_g2': 32, 'af_g2': 'relu', 'drop_p_g2': 0.0, 'n_hidden_layers_h_net': 1, 'hidden_dims_h_net': 48, 'af_h_net': 'softplus', 'drop_p_h_net': 0.0}. Best is trial 12 with value: 93.04145812988281.
2025-07-29 20:08:40,393 - INFO - Trial 14 finished with value: 93.0455551147461 and parameters: {'lr': 0.0021629951006930893, 'lamb': 0.0043, 'batch_size': 16, 'n_hidden_layers_g0': 1, 'hidden_dims_g0': 24, 'af_g0': 'tanh', 'drop_p_g0': 0.0, 'n_hidden_layers_g1': 1, 'hidden_dims_g1': 40, 'af_g1': 'tanh', 'drop_p_g1': 0.0, 'n_hidden_layers_g2': 2, 'hidden_dims_g2': 40, 'af_g2': 'relu', 'drop_p_g2': 0.0, 'n_hidden_layers_h_net': 1, 'hidden_dims_h_net': 32, 'af_h_net': 'tanh', 'drop_p_h_net': 0.0}. Best is trial 12 with value: 93.04145812988281.
2025-07-29 20:12:12,533 - INFO - Trial 15 finished with value: 93.04541778564453 and parameters: {'lr': 0.009153650119678024, 'lamb': 0.0033, 'batch_size': 16, 'n_hidden_layers_g0': 2, 'hidden_dims_g0': 32, 'af_g0': 'softplus', 'drop_p_g0': 0.0, 'n_hidden_layers_g1': 1, 'hidden_dims_g1': 32, 'af_g1': 'tanh', 'drop_p_g1': 0.0, 'n_hidden_layers_g2': 2, 'hidden_dims_g2': 16, 'af_g2': 'relu', 'drop_p_g2': 0.0, 'n_hidden_layers_h_net': 1, 'hidden_dims_h_net': 8, 'af_h_net': 'relu', 'drop_p_h_net': 0.0}. Best is trial 12 with value: 93.04145812988281.
2025-07-29 20:13:23,569 - INFO - Trial 16 finished with value: 93.0450439453125 and parameters: {'lr': 0.025850319912467515, 'lamb': 0.0057, 'batch_size': 64, 'n_hidden_layers_g0': 1, 'hidden_dims_g0': 16, 'af_g0': 'tanh', 'drop_p_g0': 0.0, 'n_hidden_layers_g1': 1, 'hidden_dims_g1': 32, 'af_g1': 'tanh', 'drop_p_g1': 0.0, 'n_hidden_layers_g2': 2, 'hidden_dims_g2': 16, 'af_g2': 'softplus', 'drop_p_g2': 0.0, 'n_hidden_layers_h_net': 1, 'hidden_dims_h_net': 48, 'af_h_net': 'softplus', 'drop_p_h_net': 0.0}. Best is trial 12 with value: 93.04145812988281.
2025-07-29 20:18:09,457 - INFO - Trial 17 finished with value: 93.04562377929688 and parameters: {'lr': 0.0008298551585798594, 'lamb': 0.0036000000000000003, 'batch_size': 16, 'n_hidden_layers_g0': 2, 'hidden_dims_g0': 56, 'af_g0': 'tanh', 'drop_p_g0': 0.0, 'n_hidden_layers_g1': 2, 'hidden_dims_g1': 64, 'af_g1': 'tanh', 'drop_p_g1': 0.0, 'n_hidden_layers_g2': 2, 'hidden_dims_g2': 40, 'af_g2': 'relu', 'drop_p_g2': 0.0, 'n_hidden_layers_h_net': 1, 'hidden_dims_h_net': 24, 'af_h_net': 'softplus', 'drop_p_h_net': 0.0}. Best is trial 12 with value: 93.04145812988281.
2025-07-29 20:23:30,735 - INFO - Trial 18 finished with value: 93.04362487792969 and parameters: {'lr': 0.010035647851653864, 'lamb': 0.0088, 'batch_size': 16, 'n_hidden_layers_g0': 1, 'hidden_dims_g0': 16, 'af_g0': 'tanh', 'drop_p_g0': 0.0, 'n_hidden_layers_g1': 1, 'hidden_dims_g1': 40, 'af_g1': 'tanh', 'drop_p_g1': 0.0, 'n_hidden_layers_g2': 2, 'hidden_dims_g2': 8, 'af_g2': 'relu', 'drop_p_g2': 0.0, 'n_hidden_layers_h_net': 1, 'hidden_dims_h_net': 64, 'af_h_net': 'relu', 'drop_p_h_net': 0.0}. Best is trial 12 with value: 93.04145812988281.
2025-07-29 20:26:57,897 - INFO - Trial 19 finished with value: 93.04568481445312 and parameters: {'lr': 0.003759631495405213, 'lamb': 0.0063, 'batch_size': 16, 'n_hidden_layers_g0': 2, 'hidden_dims_g0': 24, 'af_g0': 'softplus', 'drop_p_g0': 0.0, 'n_hidden_layers_g1': 1, 'hidden_dims_g1': 16, 'af_g1': 'tanh', 'drop_p_g1': 0.0, 'n_hidden_layers_g2': 2, 'hidden_dims_g2': 24, 'af_g2': 'relu', 'drop_p_g2': 0.0, 'n_hidden_layers_h_net': 1, 'hidden_dims_h_net': 16, 'af_h_net': 'tanh', 'drop_p_h_net': 0.0}. Best is trial 12 with value: 93.04145812988281.
2025-07-29 20:28:40,956 - INFO - Trial 20 finished with value: 93.0453109741211 and parameters: {'lr': 0.0019155912937031836, 'lamb': 0.0002, 'batch_size': 64, 'n_hidden_layers_g0': 1, 'hidden_dims_g0': 32, 'af_g0': 'tanh', 'drop_p_g0': 0.0, 'n_hidden_layers_g1': 2, 'hidden_dims_g1': 56, 'af_g1': 'softplus', 'drop_p_g1': 0.0, 'n_hidden_layers_g2': 1, 'hidden_dims_g2': 32, 'af_g2': 'softplus', 'drop_p_g2': 0.0, 'n_hidden_layers_h_net': 1, 'hidden_dims_h_net': 32, 'af_h_net': 'softplus', 'drop_p_h_net': 0.0}. Best is trial 12 with value: 93.04145812988281.
2025-07-29 20:35:14,767 - INFO - Trial 21 finished with value: 93.04447937011719 and parameters: {'lr': 0.007889494053959424, 'lamb': 0.0088, 'batch_size': 16, 'n_hidden_layers_g0': 1, 'hidden_dims_g0': 16, 'af_g0': 'tanh', 'drop_p_g0': 0.0, 'n_hidden_layers_g1': 1, 'hidden_dims_g1': 40, 'af_g1': 'tanh', 'drop_p_g1': 0.0, 'n_hidden_layers_g2': 2, 'hidden_dims_g2': 8, 'af_g2': 'relu', 'drop_p_g2': 0.0, 'n_hidden_layers_h_net': 1, 'hidden_dims_h_net': 64, 'af_h_net': 'relu', 'drop_p_h_net': 0.0}. Best is trial 12 with value: 93.04145812988281.
2025-07-29 20:46:46,882 - INFO - Trial 22 finished with value: 93.0429458618164 and parameters: {'lr': 0.015476208088816824, 'lamb': 0.009000000000000001, 'batch_size': 16, 'n_hidden_layers_g0': 1, 'hidden_dims_g0': 16, 'af_g0': 'tanh', 'drop_p_g0': 0.0, 'n_hidden_layers_g1': 1, 'hidden_dims_g1': 40, 'af_g1': 'tanh', 'drop_p_g1': 0.0, 'n_hidden_layers_g2': 2, 'hidden_dims_g2': 16, 'af_g2': 'relu', 'drop_p_g2': 0.0, 'n_hidden_layers_h_net': 1, 'hidden_dims_h_net': 56, 'af_h_net': 'relu', 'drop_p_h_net': 0.0}. Best is trial 12 with value: 93.04145812988281.
2025-07-29 20:50:38,702 - INFO - Trial 23 finished with value: 93.04451751708984 and parameters: {'lr': 0.04965504495741865, 'lamb': 0.007200000000000001, 'batch_size': 16, 'n_hidden_layers_g0': 1, 'hidden_dims_g0': 16, 'af_g0': 'tanh', 'drop_p_g0': 0.0, 'n_hidden_layers_g1': 1, 'hidden_dims_g1': 32, 'af_g1': 'tanh', 'drop_p_g1': 0.0, 'n_hidden_layers_g2': 2, 'hidden_dims_g2': 16, 'af_g2': 'relu', 'drop_p_g2': 0.0, 'n_hidden_layers_h_net': 1, 'hidden_dims_h_net': 56, 'af_h_net': 'relu', 'drop_p_h_net': 0.0}. Best is trial 12 with value: 93.04145812988281.
2025-07-29 20:55:30,989 - INFO - Trial 24 finished with value: 93.04362487792969 and parameters: {'lr': 0.02034334950190271, 'lamb': 0.009000000000000001, 'batch_size': 16, 'n_hidden_layers_g0': 1, 'hidden_dims_g0': 24, 'af_g0': 'tanh', 'drop_p_g0': 0.0, 'n_hidden_layers_g1': 1, 'hidden_dims_g1': 48, 'af_g1': 'tanh', 'drop_p_g1': 0.0, 'n_hidden_layers_g2': 2, 'hidden_dims_g2': 16, 'af_g2': 'relu', 'drop_p_g2': 0.0, 'n_hidden_layers_h_net': 1, 'hidden_dims_h_net': 56, 'af_h_net': 'relu', 'drop_p_h_net': 0.0}. Best is trial 12 with value: 93.04145812988281.
2025-07-29 21:01:50,939 - INFO - Trial 25 finished with value: 93.04463958740234 and parameters: {'lr': 0.014541346034505472, 'lamb': 0.0056, 'batch_size': 16, 'n_hidden_layers_g0': 1, 'hidden_dims_g0': 16, 'af_g0': 'tanh', 'drop_p_g0': 0.0, 'n_hidden_layers_g1': 1, 'hidden_dims_g1': 56, 'af_g1': 'tanh', 'drop_p_g1': 0.0, 'n_hidden_layers_g2': 2, 'hidden_dims_g2': 24, 'af_g2': 'relu', 'drop_p_g2': 0.0, 'n_hidden_layers_h_net': 1, 'hidden_dims_h_net': 40, 'af_h_net': 'relu', 'drop_p_h_net': 0.0}. Best is trial 12 with value: 93.04145812988281.
2025-07-29 21:08:35,617 - INFO - Trial 26 finished with value: 93.04505920410156 and parameters: {'lr': 0.03197966776377379, 'lamb': 0.0099, 'batch_size': 16, 'n_hidden_layers_g0': 2, 'hidden_dims_g0': 32, 'af_g0': 'softplus', 'drop_p_g0': 0.0, 'n_hidden_layers_g1': 1, 'hidden_dims_g1': 40, 'af_g1': 'tanh', 'drop_p_g1': 0.0, 'n_hidden_layers_g2': 2, 'hidden_dims_g2': 16, 'af_g2': 'relu', 'drop_p_g2': 0.0, 'n_hidden_layers_h_net': 1, 'hidden_dims_h_net': 48, 'af_h_net': 'relu', 'drop_p_h_net': 0.0}. Best is trial 12 with value: 93.04145812988281.
2025-07-29 21:13:21,955 - INFO - Trial 27 finished with value: 93.04437255859375 and parameters: {'lr': 0.007253114577797741, 'lamb': 0.0066, 'batch_size': 16, 'n_hidden_layers_g0': 1, 'hidden_dims_g0': 24, 'af_g0': 'tanh', 'drop_p_g0': 0.0, 'n_hidden_layers_g1': 1, 'hidden_dims_g1': 24, 'af_g1': 'tanh', 'drop_p_g1': 0.0, 'n_hidden_layers_g2': 2, 'hidden_dims_g2': 32, 'af_g2': 'relu', 'drop_p_g2': 0.0, 'n_hidden_layers_h_net': 1, 'hidden_dims_h_net': 56, 'af_h_net': 'relu', 'drop_p_h_net': 0.0}. Best is trial 12 with value: 93.04145812988281.
2025-07-29 21:20:22,476 - INFO - Trial 28 finished with value: 93.04508209228516 and parameters: {'lr': 0.012866517276736211, 'lamb': 0.0083, 'batch_size': 16, 'n_hidden_layers_g0': 2, 'hidden_dims_g0': 40, 'af_g0': 'tanh', 'drop_p_g0': 0.0, 'n_hidden_layers_g1': 1, 'hidden_dims_g1': 32, 'af_g1': 'tanh', 'drop_p_g1': 0.0, 'n_hidden_layers_g2': 2, 'hidden_dims_g2': 24, 'af_g2': 'softplus', 'drop_p_g2': 0.0, 'n_hidden_layers_h_net': 1, 'hidden_dims_h_net': 40, 'af_h_net': 'tanh', 'drop_p_h_net': 0.0}. Best is trial 12 with value: 93.04145812988281.
2025-07-29 21:21:37,267 - INFO - Trial 29 finished with value: 93.04557037353516 and parameters: {'lr': 0.0064303904768964965, 'lamb': 0.009300000000000001, 'batch_size': 64, 'n_hidden_layers_g0': 1, 'hidden_dims_g0': 8, 'af_g0': 'tanh', 'drop_p_g0': 0.0, 'n_hidden_layers_g1': 1, 'hidden_dims_g1': 16, 'af_g1': 'softplus', 'drop_p_g1': 0.0, 'n_hidden_layers_g2': 1, 'hidden_dims_g2': 24, 'af_g2': 'relu', 'drop_p_g2': 0.0, 'n_hidden_layers_h_net': 1, 'hidden_dims_h_net': 16, 'af_h_net': 'softplus', 'drop_p_h_net': 0.0}. Best is trial 12 with value: 93.04145812988281.
2025-07-29 21:25:05,083 - INFO - Trial 30 finished with value: 93.04563903808594 and parameters: {'lr': 0.003185891619476034, 'lamb': 0.0039000000000000003, 'batch_size': 16, 'n_hidden_layers_g0': 1, 'hidden_dims_g0': 8, 'af_g0': 'softplus', 'drop_p_g0': 0.0, 'n_hidden_layers_g1': 1, 'hidden_dims_g1': 48, 'af_g1': 'relu', 'drop_p_g1': 0.0, 'n_hidden_layers_g2': 2, 'hidden_dims_g2': 40, 'af_g2': 'relu', 'drop_p_g2': 0.0, 'n_hidden_layers_h_net': 1, 'hidden_dims_h_net': 32, 'af_h_net': 'tanh', 'drop_p_h_net': 0.0}. Best is trial 12 with value: 93.04145812988281.
2025-07-29 21:35:58,104 - INFO - Trial 31 finished with value: 93.04432678222656 and parameters: {'lr': 0.011151540156345773, 'lamb': 0.0086, 'batch_size': 16, 'n_hidden_layers_g0': 1, 'hidden_dims_g0': 16, 'af_g0': 'tanh', 'drop_p_g0': 0.0, 'n_hidden_layers_g1': 1, 'hidden_dims_g1': 40, 'af_g1': 'tanh', 'drop_p_g1': 0.0, 'n_hidden_layers_g2': 2, 'hidden_dims_g2': 8, 'af_g2': 'relu', 'drop_p_g2': 0.0, 'n_hidden_layers_h_net': 1, 'hidden_dims_h_net': 64, 'af_h_net': 'relu', 'drop_p_h_net': 0.0}. Best is trial 12 with value: 93.04145812988281.
2025-07-29 21:52:40,907 - INFO - Trial 32 finished with value: 93.0430679321289 and parameters: {'lr': 0.01670758091291718, 'lamb': 0.009300000000000001, 'batch_size': 16, 'n_hidden_layers_g0': 1, 'hidden_dims_g0': 16, 'af_g0': 'tanh', 'drop_p_g0': 0.0, 'n_hidden_layers_g1': 1, 'hidden_dims_g1': 40, 'af_g1': 'tanh', 'drop_p_g1': 0.0, 'n_hidden_layers_g2': 2, 'hidden_dims_g2': 8, 'af_g2': 'relu', 'drop_p_g2': 0.0, 'n_hidden_layers_h_net': 1, 'hidden_dims_h_net': 64, 'af_h_net': 'relu', 'drop_p_h_net': 0.0}. Best is trial 12 with value: 93.04145812988281.
2025-07-29 22:00:15,455 - INFO - Trial 33 finished with value: 93.04350280761719 and parameters: {'lr': 0.02134043766754216, 'lamb': 0.0076, 'batch_size': 16, 'n_hidden_layers_g0': 1, 'hidden_dims_g0': 16, 'af_g0': 'tanh', 'drop_p_g0': 0.0, 'n_hidden_layers_g1': 1, 'hidden_dims_g1': 32, 'af_g1': 'tanh', 'drop_p_g1': 0.0, 'n_hidden_layers_g2': 2, 'hidden_dims_g2': 16, 'af_g2': 'relu', 'drop_p_g2': 0.0, 'n_hidden_layers_h_net': 1, 'hidden_dims_h_net': 56, 'af_h_net': 'relu', 'drop_p_h_net': 0.0}. Best is trial 12 with value: 93.04145812988281.
2025-07-29 22:04:57,613 - INFO - Trial 34 finished with value: 93.0445327758789 and parameters: {'lr': 0.034822292775815486, 'lamb': 0.0094, 'batch_size': 16, 'n_hidden_layers_g0': 1, 'hidden_dims_g0': 8, 'af_g0': 'tanh', 'drop_p_g0': 0.0, 'n_hidden_layers_g1': 1, 'hidden_dims_g1': 24, 'af_g1': 'tanh', 'drop_p_g1': 0.0, 'n_hidden_layers_g2': 2, 'hidden_dims_g2': 8, 'af_g2': 'relu', 'drop_p_g2': 0.0, 'n_hidden_layers_h_net': 1, 'hidden_dims_h_net': 64, 'af_h_net': 'relu', 'drop_p_h_net': 0.0}. Best is trial 12 with value: 93.04145812988281.
2025-07-29 22:07:04,407 - INFO - Trial 35 finished with value: 93.04460906982422 and parameters: {'lr': 0.02544999934579799, 'lamb': 0.008, 'batch_size': 32, 'n_hidden_layers_g0': 1, 'hidden_dims_g0': 24, 'af_g0': 'tanh', 'drop_p_g0': 0.0, 'n_hidden_layers_g1': 1, 'hidden_dims_g1': 48, 'af_g1': 'softplus', 'drop_p_g1': 0.0, 'n_hidden_layers_g2': 2, 'hidden_dims_g2': 16, 'af_g2': 'tanh', 'drop_p_g2': 0.0, 'n_hidden_layers_h_net': 2, 'hidden_dims_h_net': 48, 'af_h_net': 'softplus', 'drop_p_h_net': 0.0}. Best is trial 12 with value: 93.04145812988281.
2025-07-29 22:15:50,876 - INFO - Trial 36 finished with value: 93.04374694824219 and parameters: {'lr': 0.015888729701989016, 'lamb': 0.01, 'batch_size': 16, 'n_hidden_layers_g0': 2, 'hidden_dims_g0': 8, 'af_g0': 'tanh', 'drop_p_g0': 0.0, 'n_hidden_layers_g1': 1, 'hidden_dims_g1': 40, 'af_g1': 'relu', 'drop_p_g1': 0.0, 'n_hidden_layers_g2': 1, 'hidden_dims_g2': 8, 'af_g2': 'softplus', 'drop_p_g2': 0.0, 'n_hidden_layers_h_net': 1, 'hidden_dims_h_net': 24, 'af_h_net': 'relu', 'drop_p_h_net': 0.0}. Best is trial 12 with value: 93.04145812988281.
2025-07-29 22:20:05,147 - INFO - Trial 37 finished with value: 93.04413604736328 and parameters: {'lr': 0.041600512643517835, 'lamb': 0.0074, 'batch_size': 16, 'n_hidden_layers_g0': 1, 'hidden_dims_g0': 32, 'af_g0': 'tanh', 'drop_p_g0': 0.0, 'n_hidden_layers_g1': 1, 'hidden_dims_g1': 24, 'af_g1': 'tanh', 'drop_p_g1': 0.0, 'n_hidden_layers_g2': 2, 'hidden_dims_g2': 16, 'af_g2': 'relu', 'drop_p_g2': 0.0, 'n_hidden_layers_h_net': 2, 'hidden_dims_h_net': 56, 'af_h_net': 'relu', 'drop_p_h_net': 0.0}. Best is trial 12 with value: 93.04145812988281.
2025-07-29 22:21:16,412 - INFO - Trial 38 finished with value: 93.04487609863281 and parameters: {'lr': 0.002833972780806064, 'lamb': 0.0025, 'batch_size': 64, 'n_hidden_layers_g0': 1, 'hidden_dims_g0': 16, 'af_g0': 'tanh', 'drop_p_g0': 0.0, 'n_hidden_layers_g1': 2, 'hidden_dims_g1': 56, 'af_g1': 'relu', 'drop_p_g1': 0.0, 'n_hidden_layers_g2': 2, 'hidden_dims_g2': 24, 'af_g2': 'tanh', 'drop_p_g2': 0.0, 'n_hidden_layers_h_net': 1, 'hidden_dims_h_net': 8, 'af_h_net': 'softplus', 'drop_p_h_net': 0.0}. Best is trial 12 with value: 93.04145812988281.
