Using an existing study with name 'model-population-mpnn-population_mpnn_ic5_s5' instead of creating a new one.
Trial 2 finished with value: 0.0017642078455537558 and parameters: {'lr': 0.017617691342334704, 'lamb': 0.0, 'batch_size': 16, 'n_hidden_layers_g_net': 1, 'hidden_dims_g_net': 8, 'af_g_net': 'softplus', 'drop_p_g_net': 0.16299342133912287, 'n_hidden_layers_h_net': 2, 'hidden_dims_h_net': 40, 'af_h_net': 'relu', 'drop_p_h_net': 0.018914631111825696}. Best is trial 1 with value: 0.00017997696704696864.
Trial 8 finished with value: 0.0002801743394229561 and parameters: {'lr': 0.042142681029947754, 'lamb': 0.0, 'batch_size': 16, 'n_hidden_layers_g_net': 1, 'hidden_dims_g_net': 32, 'af_g_net': 'relu', 'drop_p_g_net': 0.13828623755436303, 'n_hidden_layers_h_net': 1, 'hidden_dims_h_net': 64, 'af_h_net': 'softplus', 'drop_p_h_net': 0.0003867207338111057}. Best is trial 1 with value: 0.00017997696704696864.
Trial 10 finished with value: 0.00037270173197612166 and parameters: {'lr': 0.002177233664090213, 'lamb': 0.0, 'batch_size': 16, 'n_hidden_layers_g_net': 2, 'hidden_dims_g_net': 32, 'af_g_net': 'tanh', 'drop_p_g_net': 0.051179667276976544, 'n_hidden_layers_h_net': 2, 'hidden_dims_h_net': 56, 'af_h_net': 'relu', 'drop_p_h_net': 0.008227255945860077}. Best is trial 7 with value: 0.00011784596426878124.
Trial 16 finished with value: 0.0016573526663705707 and parameters: {'lr': 0.005278562459201762, 'lamb': 0.0, 'batch_size': 32, 'n_hidden_layers_g_net': 2, 'hidden_dims_g_net': 48, 'af_g_net': 'relu', 'drop_p_g_net': 0.49415700092377457, 'n_hidden_layers_h_net': 1, 'hidden_dims_h_net': 8, 'af_h_net': 'softplus', 'drop_p_h_net': 0.12239350347842357}. Best is trial 7 with value: 0.00011784596426878124.
Trial 18 finished with value: 0.00020600113202817738 and parameters: {'lr': 0.005380600229253769, 'lamb': 0.0, 'batch_size': 32, 'n_hidden_layers_g_net': 2, 'hidden_dims_g_net': 48, 'af_g_net': 'relu', 'drop_p_g_net': 0.0001195523088853648, 'n_hidden_layers_h_net': 1, 'hidden_dims_h_net': 40, 'af_h_net': 'tanh', 'drop_p_h_net': 0.024188517231436564}. Best is trial 7 with value: 0.00011784596426878124.
Trial 21 finished with value: 0.00015598093159496784 and parameters: {'lr': 0.0014076690904785635, 'lamb': 0.0, 'batch_size': 32, 'n_hidden_layers_g_net': 2, 'hidden_dims_g_net': 64, 'af_g_net': 'softplus', 'drop_p_g_net': 0.002953478471375333, 'n_hidden_layers_h_net': 2, 'hidden_dims_h_net': 24, 'af_h_net': 'relu', 'drop_p_h_net': 0.016143117466759362}. Best is trial 7 with value: 0.00011784596426878124.
Trial 24 finished with value: 0.00015615997835993767 and parameters: {'lr': 0.0016879972434045434, 'lamb': 0.0, 'batch_size': 32, 'n_hidden_layers_g_net': 2, 'hidden_dims_g_net': 56, 'af_g_net': 'softplus', 'drop_p_g_net': 0.0032073828222822544, 'n_hidden_layers_h_net': 2, 'hidden_dims_h_net': 24, 'af_h_net': 'relu', 'drop_p_h_net': 0.002210951103421509}. Best is trial 7 with value: 0.00011784596426878124.
Trial 26 finished with value: 0.00022999996144790202 and parameters: {'lr': 0.000611359911286037, 'lamb': 0.0, 'batch_size': 32, 'n_hidden_layers_g_net': 2, 'hidden_dims_g_net': 64, 'af_g_net': 'softplus', 'drop_p_g_net': 0.0012782431237403204, 'n_hidden_layers_h_net': 1, 'hidden_dims_h_net': 16, 'af_h_net': 'relu', 'drop_p_h_net': 0.013886077953475613}. Best is trial 7 with value: 0.00011784596426878124.
Trial 28 finished with value: 0.00021351648319978267 and parameters: {'lr': 0.000893477803340146, 'lamb': 0.0, 'batch_size': 16, 'n_hidden_layers_g_net': 2, 'hidden_dims_g_net': 64, 'af_g_net': 'softplus', 'drop_p_g_net': 0.012942160513685243, 'n_hidden_layers_h_net': 1, 'hidden_dims_h_net': 32, 'af_h_net': 'relu', 'drop_p_h_net': 0.0016005290362808794}. Best is trial 7 with value: 0.00011784596426878124.
Trial 29 finished with value: 0.0007644796278327703 and parameters: {'lr': 0.0017245981223163473, 'lamb': 0.0, 'batch_size': 32, 'n_hidden_layers_g_net': 2, 'hidden_dims_g_net': 56, 'af_g_net': 'tanh', 'drop_p_g_net': 0.02664093468023378, 'n_hidden_layers_h_net': 1, 'hidden_dims_h_net': 8, 'af_h_net': 'relu', 'drop_p_h_net': 0.07478259298771642}. Best is trial 7 with value: 0.00011784596426878124.
