Using an existing study with name 'model-epidemics-mpnn-epidemics_mpnn_ic1_s5' instead of creating a new one.
Trial 2 finished with value: 0.00013006133667659014 and parameters: {'lr': 0.004029577504723336, 'lamb': 0.0, 'batch_size': 32, 'n_hidden_layers_g_net': 2, 'hidden_dims_g_net': 48, 'af_g_net': 'tanh', 'drop_p_g_net': 0.05908368086790094, 'n_hidden_layers_h_net': 2, 'hidden_dims_h_net': 56, 'af_h_net': 'tanh', 'drop_p_h_net': 0.19688890061434222}. Best is trial 2 with value: 0.00013006133667659014.
Trial 5 finished with value: 0.0003534423594828695 and parameters: {'lr': 0.028292039297598277, 'lamb': 0.0, 'batch_size': 32, 'n_hidden_layers_g_net': 2, 'hidden_dims_g_net': 40, 'af_g_net': 'softplus', 'drop_p_g_net': 0.0187476435482243, 'n_hidden_layers_h_net': 2, 'hidden_dims_h_net': 16, 'af_h_net': 'relu', 'drop_p_h_net': 0.07564679219759111}. Best is trial 2 with value: 0.00013006133667659014.
Trial 10 finished with value: 0.00017179943097289652 and parameters: {'lr': 0.0024070804710791334, 'lamb': 0.0, 'batch_size': 16, 'n_hidden_layers_g_net': 2, 'hidden_dims_g_net': 48, 'af_g_net': 'relu', 'drop_p_g_net': 0.011896878313373702, 'n_hidden_layers_h_net': 2, 'hidden_dims_h_net': 8, 'af_h_net': 'softplus', 'drop_p_h_net': 0.16310245236120538}. Best is trial 2 with value: 0.00013006133667659014.
Trial 14 finished with value: 0.0002753994194790721 and parameters: {'lr': 0.007620812989027785, 'lamb': 0.0, 'batch_size': 32, 'n_hidden_layers_g_net': 2, 'hidden_dims_g_net': 48, 'af_g_net': 'tanh', 'drop_p_g_net': 0.3092066775668787, 'n_hidden_layers_h_net': 1, 'hidden_dims_h_net': 64, 'af_h_net': 'tanh', 'drop_p_h_net': 0.41576138346823677}. Best is trial 2 with value: 0.00013006133667659014.
Trial 16 finished with value: 0.0005431040190160275 and parameters: {'lr': 0.0014687170803459665, 'lamb': 0.0, 'batch_size': 32, 'n_hidden_layers_g_net': 2, 'hidden_dims_g_net': 64, 'af_g_net': 'tanh', 'drop_p_g_net': 0.0839337871387888, 'n_hidden_layers_h_net': 2, 'hidden_dims_h_net': 48, 'af_h_net': 'tanh', 'drop_p_h_net': 0.14455472492010862}. Best is trial 2 with value: 0.00013006133667659014.
Trial 17 finished with value: 9.383665019413456e-05 and parameters: {'lr': 0.01113185163149966, 'lamb': 0.0, 'batch_size': 32, 'n_hidden_layers_g_net': 2, 'hidden_dims_g_net': 32, 'af_g_net': 'tanh', 'drop_p_g_net': 0.09692562074249841, 'n_hidden_layers_h_net': 2, 'hidden_dims_h_net': 24, 'af_h_net': 'tanh', 'drop_p_h_net': 0.015621553998152161}. Best is trial 15 with value: 6.432415830204263e-05.
Trial 19 finished with value: 0.00047573959454894066 and parameters: {'lr': 0.00891438137315162, 'lamb': 0.0, 'batch_size': 32, 'n_hidden_layers_g_net': 2, 'hidden_dims_g_net': 8, 'af_g_net': 'tanh', 'drop_p_g_net': 0.16449146649399574, 'n_hidden_layers_h_net': 1, 'hidden_dims_h_net': 24, 'af_h_net': 'tanh', 'drop_p_h_net': 0.019597043776805344}. Best is trial 15 with value: 6.432415830204263e-05.
Trial 22 finished with value: 0.00011092583008576185 and parameters: {'lr': 0.005802955902581901, 'lamb': 0.0, 'batch_size': 32, 'n_hidden_layers_g_net': 2, 'hidden_dims_g_net': 64, 'af_g_net': 'tanh', 'drop_p_g_net': 0.1697135715639096, 'n_hidden_layers_h_net': 2, 'hidden_dims_h_net': 48, 'af_h_net': 'tanh', 'drop_p_h_net': 0.0011206040070865606}. Best is trial 15 with value: 6.432415830204263e-05.
Trial 25 finished with value: 0.00010062447108794004 and parameters: {'lr': 0.014769787810876647, 'lamb': 0.0, 'batch_size': 32, 'n_hidden_layers_g_net': 2, 'hidden_dims_g_net': 56, 'af_g_net': 'tanh', 'drop_p_g_net': 0.024550236161121015, 'n_hidden_layers_h_net': 2, 'hidden_dims_h_net': 32, 'af_h_net': 'tanh', 'drop_p_h_net': 0.0007380404049522788}. Best is trial 24 with value: 5.7994937378680333e-05.
Trial 28 finished with value: 0.00010610905155772343 and parameters: {'lr': 0.005612073833137684, 'lamb': 0.0, 'batch_size': 16, 'n_hidden_layers_g_net': 2, 'hidden_dims_g_net': 56, 'af_g_net': 'tanh', 'drop_p_g_net': 0.2274642759718396, 'n_hidden_layers_h_net': 2, 'hidden_dims_h_net': 40, 'af_h_net': 'tanh', 'drop_p_h_net': 0.002564799776136514}. Best is trial 27 with value: 4.595987775246613e-05.
