Using an existing study with name 'model-population-mpnn-population_mpnn_ic3_s5' instead of creating a new one.
Trial 1 finished with value: 0.0004158519150223583 and parameters: {'lr': 0.02777859530449744, 'lamb': 0.0, 'batch_size': 32, 'n_hidden_layers_g_net': 2, 'hidden_dims_g_net': 64, 'af_g_net': 'relu', 'drop_p_g_net': 0.02768183790160873, 'n_hidden_layers_h_net': 2, 'hidden_dims_h_net': 40, 'af_h_net': 'softplus', 'drop_p_h_net': 0.23610908375230083}. Best is trial 1 with value: 0.0004158519150223583.
Trial 3 finished with value: 0.0007966296398080885 and parameters: {'lr': 0.038541461370266886, 'lamb': 0.0, 'batch_size': 32, 'n_hidden_layers_g_net': 2, 'hidden_dims_g_net': 16, 'af_g_net': 'tanh', 'drop_p_g_net': 0.008954429248756213, 'n_hidden_layers_h_net': 1, 'hidden_dims_h_net': 8, 'af_h_net': 'relu', 'drop_p_h_net': 0.0017051173709347579}. Best is trial 0 with value: 0.00021123707119841129.
Trial 7 finished with value: 0.00034347493783570826 and parameters: {'lr': 0.0008677482391018508, 'lamb': 0.0, 'batch_size': 32, 'n_hidden_layers_g_net': 2, 'hidden_dims_g_net': 48, 'af_g_net': 'relu', 'drop_p_g_net': 0.04428924220424161, 'n_hidden_layers_h_net': 2, 'hidden_dims_h_net': 48, 'af_h_net': 'softplus', 'drop_p_h_net': 0.04892469966626246}. Best is trial 0 with value: 0.00021123707119841129.
Trial 10 finished with value: 0.00048697818419896066 and parameters: {'lr': 0.0014740635699607542, 'lamb': 0.0, 'batch_size': 16, 'n_hidden_layers_g_net': 1, 'hidden_dims_g_net': 56, 'af_g_net': 'relu', 'drop_p_g_net': 0.0001620166322335277, 'n_hidden_layers_h_net': 2, 'hidden_dims_h_net': 16, 'af_h_net': 'tanh', 'drop_p_h_net': 0.41536214070817246}. Best is trial 9 with value: 0.0001872399589046836.
Trial 13 finished with value: 0.0001844389335019514 and parameters: {'lr': 0.0033920950258449307, 'lamb': 0.0, 'batch_size': 16, 'n_hidden_layers_g_net': 1, 'hidden_dims_g_net': 40, 'af_g_net': 'relu', 'drop_p_g_net': 0.0023798831996973877, 'n_hidden_layers_h_net': 1, 'hidden_dims_h_net': 32, 'af_h_net': 'tanh', 'drop_p_h_net': 0.00445046300596747}. Best is trial 13 with value: 0.0001844389335019514.
Trial 15 finished with value: 0.00018026219913735986 and parameters: {'lr': 0.0037547439011687504, 'lamb': 0.0, 'batch_size': 16, 'n_hidden_layers_g_net': 1, 'hidden_dims_g_net': 40, 'af_g_net': 'relu', 'drop_p_g_net': 0.0022733141118652087, 'n_hidden_layers_h_net': 1, 'hidden_dims_h_net': 32, 'af_h_net': 'tanh', 'drop_p_h_net': 0.004133209495844104}. Best is trial 15 with value: 0.00018026219913735986.
Trial 18 finished with value: 0.00035363505594432354 and parameters: {'lr': 0.012767228905153314, 'lamb': 0.0, 'batch_size': 16, 'n_hidden_layers_g_net': 1, 'hidden_dims_g_net': 32, 'af_g_net': 'softplus', 'drop_p_g_net': 0.0015918021079019415, 'n_hidden_layers_h_net': 1, 'hidden_dims_h_net': 24, 'af_h_net': 'relu', 'drop_p_h_net': 0.013088042382166206}. Best is trial 15 with value: 0.00018026219913735986.
Trial 21 finished with value: 0.00016929360572248697 and parameters: {'lr': 0.004860937943673071, 'lamb': 0.0, 'batch_size': 16, 'n_hidden_layers_g_net': 2, 'hidden_dims_g_net': 40, 'af_g_net': 'relu', 'drop_p_g_net': 0.00024564122695403467, 'n_hidden_layers_h_net': 1, 'hidden_dims_h_net': 48, 'af_h_net': 'tanh', 'drop_p_h_net': 0.01844957609250405}. Best is trial 21 with value: 0.00016929360572248697.
Trial 25 finished with value: 0.00018350618483964354 and parameters: {'lr': 0.0025477626939417533, 'lamb': 0.0, 'batch_size': 16, 'n_hidden_layers_g_net': 2, 'hidden_dims_g_net': 40, 'af_g_net': 'relu', 'drop_p_g_net': 0.00047464334088413414, 'n_hidden_layers_h_net': 1, 'hidden_dims_h_net': 48, 'af_h_net': 'tanh', 'drop_p_h_net': 0.0026579093278320514}. Best is trial 21 with value: 0.00016929360572248697.
Trial 27 finished with value: 0.000284655048744753 and parameters: {'lr': 0.008152621808609583, 'lamb': 0.0, 'batch_size': 16, 'n_hidden_layers_g_net': 2, 'hidden_dims_g_net': 24, 'af_g_net': 'relu', 'drop_p_g_net': 0.0003379089187559021, 'n_hidden_layers_h_net': 1, 'hidden_dims_h_net': 56, 'af_h_net': 'tanh', 'drop_p_h_net': 0.063889670018147}. Best is trial 26 with value: 0.000162272117449902.
