2025-07-27 19:03:55,449 - INFO - A new study created in Journal with name: model-epidemics-llc-epidemics_llc_2
2025-07-27 19:10:27,371 - INFO - Trial 0 finished with value: 0.0006491129752248526 and parameters: {'lr': 0.0028057582076672534, 'lamb': 0.009600000000000001, 'batch_size': 16, 'n_hidden_layers_g0': 1, 'hidden_dims_g0': 8, 'af_g0': 'relu', 'drop_p_g0': 0.0, 'n_hidden_layers_g1': 1, 'hidden_dims_g1': 64, 'af_g1': 'relu', 'drop_p_g1': 0.0, 'n_hidden_layers_g2': 1, 'hidden_dims_g2': 24, 'af_g2': 'relu', 'drop_p_g2': 0.0, 'n_hidden_layers_h_net': 2, 'hidden_dims_h_net': 16, 'af_h_net': 'tanh', 'drop_p_h_net': 0.0}. Best is trial 0 with value: 0.0006491129752248526.
2025-07-27 19:14:59,173 - INFO - Trial 1 finished with value: 0.003095196560025215 and parameters: {'lr': 0.018591820902866044, 'lamb': 0.002, 'batch_size': 32, 'n_hidden_layers_g0': 2, 'hidden_dims_g0': 16, 'af_g0': 'tanh', 'drop_p_g0': 0.0, 'n_hidden_layers_g1': 2, 'hidden_dims_g1': 24, 'af_g1': 'softplus', 'drop_p_g1': 0.0, 'n_hidden_layers_g2': 1, 'hidden_dims_g2': 32, 'af_g2': 'softplus', 'drop_p_g2': 0.0, 'n_hidden_layers_h_net': 2, 'hidden_dims_h_net': 24, 'af_h_net': 'softplus', 'drop_p_h_net': 0.0}. Best is trial 0 with value: 0.0006491129752248526.
2025-07-27 19:19:02,643 - INFO - Trial 2 finished with value: 0.0038042659871280193 and parameters: {'lr': 0.04346495755569776, 'lamb': 0.0078000000000000005, 'batch_size': 16, 'n_hidden_layers_g0': 2, 'hidden_dims_g0': 8, 'af_g0': 'tanh', 'drop_p_g0': 0.0, 'n_hidden_layers_g1': 1, 'hidden_dims_g1': 24, 'af_g1': 'relu', 'drop_p_g1': 0.0, 'n_hidden_layers_g2': 2, 'hidden_dims_g2': 16, 'af_g2': 'tanh', 'drop_p_g2': 0.0, 'n_hidden_layers_h_net': 2, 'hidden_dims_h_net': 16, 'af_h_net': 'softplus', 'drop_p_h_net': 0.0}. Best is trial 0 with value: 0.0006491129752248526.
2025-07-27 19:22:48,154 - INFO - Trial 3 finished with value: 0.0025753516238182783 and parameters: {'lr': 0.014354376740977342, 'lamb': 0.0077, 'batch_size': 32, 'n_hidden_layers_g0': 2, 'hidden_dims_g0': 40, 'af_g0': 'relu', 'drop_p_g0': 0.0, 'n_hidden_layers_g1': 1, 'hidden_dims_g1': 48, 'af_g1': 'softplus', 'drop_p_g1': 0.0, 'n_hidden_layers_g2': 1, 'hidden_dims_g2': 48, 'af_g2': 'tanh', 'drop_p_g2': 0.0, 'n_hidden_layers_h_net': 1, 'hidden_dims_h_net': 40, 'af_h_net': 'relu', 'drop_p_h_net': 0.0}. Best is trial 0 with value: 0.0006491129752248526.
2025-07-27 19:24:58,836 - INFO - Trial 4 finished with value: 0.0030154073610901833 and parameters: {'lr': 0.0005778676408134936, 'lamb': 0.0064, 'batch_size': 64, 'n_hidden_layers_g0': 1, 'hidden_dims_g0': 32, 'af_g0': 'relu', 'drop_p_g0': 0.0, 'n_hidden_layers_g1': 1, 'hidden_dims_g1': 16, 'af_g1': 'relu', 'drop_p_g1': 0.0, 'n_hidden_layers_g2': 2, 'hidden_dims_g2': 56, 'af_g2': 'softplus', 'drop_p_g2': 0.0, 'n_hidden_layers_h_net': 2, 'hidden_dims_h_net': 64, 'af_h_net': 'relu', 'drop_p_h_net': 0.0}. Best is trial 0 with value: 0.0006491129752248526.
2025-07-27 19:38:46,285 - INFO - Trial 5 finished with value: 0.00041978468652814627 and parameters: {'lr': 0.0035742553967564933, 'lamb': 0.0082, 'batch_size': 16, 'n_hidden_layers_g0': 1, 'hidden_dims_g0': 16, 'af_g0': 'tanh', 'drop_p_g0': 0.0, 'n_hidden_layers_g1': 1, 'hidden_dims_g1': 40, 'af_g1': 'tanh', 'drop_p_g1': 0.0, 'n_hidden_layers_g2': 2, 'hidden_dims_g2': 24, 'af_g2': 'relu', 'drop_p_g2': 0.0, 'n_hidden_layers_h_net': 1, 'hidden_dims_h_net': 40, 'af_h_net': 'relu', 'drop_p_h_net': 0.0}. Best is trial 5 with value: 0.00041978468652814627.
2025-07-27 19:40:59,726 - INFO - Trial 6 finished with value: 0.004880781751126051 and parameters: {'lr': 0.032771911717731424, 'lamb': 0.0024000000000000002, 'batch_size': 64, 'n_hidden_layers_g0': 1, 'hidden_dims_g0': 48, 'af_g0': 'relu', 'drop_p_g0': 0.0, 'n_hidden_layers_g1': 1, 'hidden_dims_g1': 48, 'af_g1': 'relu', 'drop_p_g1': 0.0, 'n_hidden_layers_g2': 2, 'hidden_dims_g2': 24, 'af_g2': 'tanh', 'drop_p_g2': 0.0, 'n_hidden_layers_h_net': 2, 'hidden_dims_h_net': 8, 'af_h_net': 'tanh', 'drop_p_h_net': 0.0}. Best is trial 5 with value: 0.00041978468652814627.
2025-07-27 19:43:56,589 - INFO - Trial 7 finished with value: 0.0005656789289787412 and parameters: {'lr': 0.0011160993683450788, 'lamb': 0.006900000000000001, 'batch_size': 32, 'n_hidden_layers_g0': 1, 'hidden_dims_g0': 8, 'af_g0': 'relu', 'drop_p_g0': 0.0, 'n_hidden_layers_g1': 2, 'hidden_dims_g1': 56, 'af_g1': 'relu', 'drop_p_g1': 0.0, 'n_hidden_layers_g2': 1, 'hidden_dims_g2': 64, 'af_g2': 'relu', 'drop_p_g2': 0.0, 'n_hidden_layers_h_net': 1, 'hidden_dims_h_net': 48, 'af_h_net': 'relu', 'drop_p_h_net': 0.0}. Best is trial 5 with value: 0.00041978468652814627.
2025-07-27 19:46:50,500 - INFO - Trial 8 finished with value: 0.0030122625175863504 and parameters: {'lr': 0.009616860064438593, 'lamb': 0.0008, 'batch_size': 32, 'n_hidden_layers_g0': 1, 'hidden_dims_g0': 8, 'af_g0': 'relu', 'drop_p_g0': 0.0, 'n_hidden_layers_g1': 2, 'hidden_dims_g1': 48, 'af_g1': 'tanh', 'drop_p_g1': 0.0, 'n_hidden_layers_g2': 1, 'hidden_dims_g2': 24, 'af_g2': 'tanh', 'drop_p_g2': 0.0, 'n_hidden_layers_h_net': 2, 'hidden_dims_h_net': 40, 'af_h_net': 'softplus', 'drop_p_h_net': 0.0}. Best is trial 5 with value: 0.00041978468652814627.
2025-07-27 19:57:38,655 - INFO - Trial 9 finished with value: 0.0006429323111660779 and parameters: {'lr': 0.0015379750534360189, 'lamb': 0.0098, 'batch_size': 32, 'n_hidden_layers_g0': 2, 'hidden_dims_g0': 40, 'af_g0': 'relu', 'drop_p_g0': 0.0, 'n_hidden_layers_g1': 2, 'hidden_dims_g1': 24, 'af_g1': 'softplus', 'drop_p_g1': 0.0, 'n_hidden_layers_g2': 2, 'hidden_dims_g2': 64, 'af_g2': 'relu', 'drop_p_g2': 0.0, 'n_hidden_layers_h_net': 2, 'hidden_dims_h_net': 32, 'af_h_net': 'relu', 'drop_p_h_net': 0.0}. Best is trial 5 with value: 0.00041978468652814627.
2025-07-27 20:12:35,765 - INFO - Trial 10 finished with value: 0.000573785393498838 and parameters: {'lr': 0.004894530976108318, 'lamb': 0.0047, 'batch_size': 16, 'n_hidden_layers_g0': 1, 'hidden_dims_g0': 64, 'af_g0': 'softplus', 'drop_p_g0': 0.0, 'n_hidden_layers_g1': 1, 'hidden_dims_g1': 8, 'af_g1': 'tanh', 'drop_p_g1': 0.0, 'n_hidden_layers_g2': 2, 'hidden_dims_g2': 8, 'af_g2': 'relu', 'drop_p_g2': 0.0, 'n_hidden_layers_h_net': 1, 'hidden_dims_h_net': 56, 'af_h_net': 'relu', 'drop_p_h_net': 0.0}. Best is trial 5 with value: 0.00041978468652814627.
2025-07-27 20:18:59,262 - INFO - Trial 11 finished with value: 0.000504236260894686 and parameters: {'lr': 0.0011004194546369631, 'lamb': 0.0057, 'batch_size': 16, 'n_hidden_layers_g0': 1, 'hidden_dims_g0': 24, 'af_g0': 'tanh', 'drop_p_g0': 0.0, 'n_hidden_layers_g1': 2, 'hidden_dims_g1': 64, 'af_g1': 'tanh', 'drop_p_g1': 0.0, 'n_hidden_layers_g2': 1, 'hidden_dims_g2': 40, 'af_g2': 'relu', 'drop_p_g2': 0.0, 'n_hidden_layers_h_net': 1, 'hidden_dims_h_net': 48, 'af_h_net': 'relu', 'drop_p_h_net': 0.0}. Best is trial 5 with value: 0.00041978468652814627.
2025-07-27 20:22:18,063 - INFO - Trial 12 finished with value: 0.001042368821799755 and parameters: {'lr': 0.002644666628796103, 'lamb': 0.0047, 'batch_size': 16, 'n_hidden_layers_g0': 1, 'hidden_dims_g0': 24, 'af_g0': 'tanh', 'drop_p_g0': 0.0, 'n_hidden_layers_g1': 2, 'hidden_dims_g1': 40, 'af_g1': 'tanh', 'drop_p_g1': 0.0, 'n_hidden_layers_g2': 2, 'hidden_dims_g2': 40, 'af_g2': 'relu', 'drop_p_g2': 0.0, 'n_hidden_layers_h_net': 1, 'hidden_dims_h_net': 48, 'af_h_net': 'relu', 'drop_p_h_net': 0.0}. Best is trial 5 with value: 0.00041978468652814627.
2025-07-27 20:32:12,057 - INFO - Trial 13 finished with value: 0.0002922035055235028 and parameters: {'lr': 0.0005596061791556214, 'lamb': 0.0057, 'batch_size': 16, 'n_hidden_layers_g0': 1, 'hidden_dims_g0': 24, 'af_g0': 'tanh', 'drop_p_g0': 0.0, 'n_hidden_layers_g1': 2, 'hidden_dims_g1': 64, 'af_g1': 'tanh', 'drop_p_g1': 0.0, 'n_hidden_layers_g2': 1, 'hidden_dims_g2': 40, 'af_g2': 'relu', 'drop_p_g2': 0.0, 'n_hidden_layers_h_net': 1, 'hidden_dims_h_net': 56, 'af_h_net': 'relu', 'drop_p_h_net': 0.0}. Best is trial 13 with value: 0.0002922035055235028.
2025-07-27 20:35:33,489 - INFO - Trial 14 finished with value: 0.000966060848440975 and parameters: {'lr': 0.0005017754536399296, 'lamb': 0.0086, 'batch_size': 16, 'n_hidden_layers_g0': 1, 'hidden_dims_g0': 24, 'af_g0': 'tanh', 'drop_p_g0': 0.0, 'n_hidden_layers_g1': 1, 'hidden_dims_g1': 32, 'af_g1': 'tanh', 'drop_p_g1': 0.0, 'n_hidden_layers_g2': 1, 'hidden_dims_g2': 32, 'af_g2': 'relu', 'drop_p_g2': 0.0, 'n_hidden_layers_h_net': 1, 'hidden_dims_h_net': 64, 'af_h_net': 'tanh', 'drop_p_h_net': 0.0}. Best is trial 13 with value: 0.0002922035055235028.
2025-07-27 20:46:18,572 - INFO - Trial 15 finished with value: 0.0007431103731505573 and parameters: {'lr': 0.006698233270579552, 'lamb': 0.0039000000000000003, 'batch_size': 16, 'n_hidden_layers_g0': 1, 'hidden_dims_g0': 32, 'af_g0': 'softplus', 'drop_p_g0': 0.0, 'n_hidden_layers_g1': 2, 'hidden_dims_g1': 40, 'af_g1': 'tanh', 'drop_p_g1': 0.0, 'n_hidden_layers_g2': 2, 'hidden_dims_g2': 48, 'af_g2': 'softplus', 'drop_p_g2': 0.0, 'n_hidden_layers_h_net': 1, 'hidden_dims_h_net': 56, 'af_h_net': 'relu', 'drop_p_h_net': 0.0}. Best is trial 13 with value: 0.0002922035055235028.
2025-07-27 20:48:06,408 - INFO - Trial 16 finished with value: 0.0011406505946069956 and parameters: {'lr': 0.003061008506423889, 'lamb': 0.0033, 'batch_size': 64, 'n_hidden_layers_g0': 1, 'hidden_dims_g0': 16, 'af_g0': 'tanh', 'drop_p_g0': 0.0, 'n_hidden_layers_g1': 1, 'hidden_dims_g1': 56, 'af_g1': 'tanh', 'drop_p_g1': 0.0, 'n_hidden_layers_g2': 1, 'hidden_dims_g2': 8, 'af_g2': 'relu', 'drop_p_g2': 0.0, 'n_hidden_layers_h_net': 1, 'hidden_dims_h_net': 32, 'af_h_net': 'relu', 'drop_p_h_net': 0.0}. Best is trial 13 with value: 0.0002922035055235028.
2025-07-27 20:56:22,588 - INFO - Trial 17 finished with value: 0.00040029024239629507 and parameters: {'lr': 0.0015691300041345442, 'lamb': 0.006, 'batch_size': 16, 'n_hidden_layers_g0': 2, 'hidden_dims_g0': 56, 'af_g0': 'tanh', 'drop_p_g0': 0.0, 'n_hidden_layers_g1': 2, 'hidden_dims_g1': 56, 'af_g1': 'tanh', 'drop_p_g1': 0.0, 'n_hidden_layers_g2': 2, 'hidden_dims_g2': 48, 'af_g2': 'relu', 'drop_p_g2': 0.0, 'n_hidden_layers_h_net': 1, 'hidden_dims_h_net': 56, 'af_h_net': 'relu', 'drop_p_h_net': 0.0}. Best is trial 13 with value: 0.0002922035055235028.
2025-07-27 21:07:27,350 - INFO - Trial 18 finished with value: 0.0005238083540461957 and parameters: {'lr': 0.0008512677833427498, 'lamb': 0.0059, 'batch_size': 16, 'n_hidden_layers_g0': 2, 'hidden_dims_g0': 64, 'af_g0': 'tanh', 'drop_p_g0': 0.0, 'n_hidden_layers_g1': 2, 'hidden_dims_g1': 64, 'af_g1': 'tanh', 'drop_p_g1': 0.0, 'n_hidden_layers_g2': 1, 'hidden_dims_g2': 48, 'af_g2': 'relu', 'drop_p_g2': 0.0, 'n_hidden_layers_h_net': 1, 'hidden_dims_h_net': 56, 'af_h_net': 'softplus', 'drop_p_h_net': 0.0}. Best is trial 13 with value: 0.0002922035055235028.
2025-07-27 21:21:51,397 - INFO - Trial 19 finished with value: 0.0005240699392743409 and parameters: {'lr': 0.0018723761094488047, 'lamb': 0.0, 'batch_size': 16, 'n_hidden_layers_g0': 2, 'hidden_dims_g0': 56, 'af_g0': 'softplus', 'drop_p_g0': 0.0, 'n_hidden_layers_g1': 2, 'hidden_dims_g1': 56, 'af_g1': 'tanh', 'drop_p_g1': 0.0, 'n_hidden_layers_g2': 2, 'hidden_dims_g2': 56, 'af_g2': 'softplus', 'drop_p_g2': 0.0, 'n_hidden_layers_h_net': 1, 'hidden_dims_h_net': 64, 'af_h_net': 'tanh', 'drop_p_h_net': 0.0}. Best is trial 13 with value: 0.0002922035055235028.
2025-07-27 21:27:49,295 - INFO - Trial 20 finished with value: 0.0003893379762303084 and parameters: {'lr': 0.000895396480689841, 'lamb': 0.007, 'batch_size': 64, 'n_hidden_layers_g0': 2, 'hidden_dims_g0': 48, 'af_g0': 'tanh', 'drop_p_g0': 0.0, 'n_hidden_layers_g1': 2, 'hidden_dims_g1': 56, 'af_g1': 'softplus', 'drop_p_g1': 0.0, 'n_hidden_layers_g2': 1, 'hidden_dims_g2': 40, 'af_g2': 'relu', 'drop_p_g2': 0.0, 'n_hidden_layers_h_net': 1, 'hidden_dims_h_net': 56, 'af_h_net': 'relu', 'drop_p_h_net': 0.0}. Best is trial 13 with value: 0.0002922035055235028.
2025-07-27 21:32:31,895 - INFO - Trial 21 finished with value: 0.0005319274496287107 and parameters: {'lr': 0.0007707066823085148, 'lamb': 0.006900000000000001, 'batch_size': 64, 'n_hidden_layers_g0': 2, 'hidden_dims_g0': 48, 'af_g0': 'tanh', 'drop_p_g0': 0.0, 'n_hidden_layers_g1': 2, 'hidden_dims_g1': 56, 'af_g1': 'softplus', 'drop_p_g1': 0.0, 'n_hidden_layers_g2': 1, 'hidden_dims_g2': 40, 'af_g2': 'relu', 'drop_p_g2': 0.0, 'n_hidden_layers_h_net': 1, 'hidden_dims_h_net': 56, 'af_h_net': 'relu', 'drop_p_h_net': 0.0}. Best is trial 13 with value: 0.0002922035055235028.
2025-07-27 21:35:51,929 - INFO - Trial 22 finished with value: 0.000522152753546834 and parameters: {'lr': 0.0017731402053007864, 'lamb': 0.0053, 'batch_size': 64, 'n_hidden_layers_g0': 2, 'hidden_dims_g0': 56, 'af_g0': 'tanh', 'drop_p_g0': 0.0, 'n_hidden_layers_g1': 2, 'hidden_dims_g1': 64, 'af_g1': 'softplus', 'drop_p_g1': 0.0, 'n_hidden_layers_g2': 1, 'hidden_dims_g2': 56, 'af_g2': 'relu', 'drop_p_g2': 0.0, 'n_hidden_layers_h_net': 1, 'hidden_dims_h_net': 48, 'af_h_net': 'relu', 'drop_p_h_net': 0.0}. Best is trial 13 with value: 0.0002922035055235028.
2025-07-27 21:38:45,596 - INFO - Trial 23 finished with value: 0.0013152320170775056 and parameters: {'lr': 0.0007693206914186824, 'lamb': 0.0068000000000000005, 'batch_size': 64, 'n_hidden_layers_g0': 2, 'hidden_dims_g0': 48, 'af_g0': 'tanh', 'drop_p_g0': 0.0, 'n_hidden_layers_g1': 2, 'hidden_dims_g1': 56, 'af_g1': 'softplus', 'drop_p_g1': 0.0, 'n_hidden_layers_g2': 1, 'hidden_dims_g2': 48, 'af_g2': 'relu', 'drop_p_g2': 0.0, 'n_hidden_layers_h_net': 1, 'hidden_dims_h_net': 64, 'af_h_net': 'relu', 'drop_p_h_net': 0.0}. Best is trial 13 with value: 0.0002922035055235028.
2025-07-27 21:43:29,597 - INFO - Trial 24 finished with value: 0.0006544513162225485 and parameters: {'lr': 0.0014286529955561864, 'lamb': 0.004200000000000001, 'batch_size': 64, 'n_hidden_layers_g0': 2, 'hidden_dims_g0': 56, 'af_g0': 'tanh', 'drop_p_g0': 0.0, 'n_hidden_layers_g1': 2, 'hidden_dims_g1': 48, 'af_g1': 'softplus', 'drop_p_g1': 0.0, 'n_hidden_layers_g2': 1, 'hidden_dims_g2': 32, 'af_g2': 'relu', 'drop_p_g2': 0.0, 'n_hidden_layers_h_net': 1, 'hidden_dims_h_net': 56, 'af_h_net': 'relu', 'drop_p_h_net': 0.0}. Best is trial 13 with value: 0.0002922035055235028.
2025-07-27 21:53:35,542 - INFO - Trial 25 finished with value: 0.0002761348441708833 and parameters: {'lr': 0.0005165932615802574, 'lamb': 0.006200000000000001, 'batch_size': 16, 'n_hidden_layers_g0': 2, 'hidden_dims_g0': 40, 'af_g0': 'tanh', 'drop_p_g0': 0.0, 'n_hidden_layers_g1': 2, 'hidden_dims_g1': 64, 'af_g1': 'tanh', 'drop_p_g1': 0.0, 'n_hidden_layers_g2': 1, 'hidden_dims_g2': 40, 'af_g2': 'relu', 'drop_p_g2': 0.0, 'n_hidden_layers_h_net': 1, 'hidden_dims_h_net': 48, 'af_h_net': 'relu', 'drop_p_h_net': 0.0}. Best is trial 25 with value: 0.0002761348441708833.
2025-07-27 21:59:28,809 - INFO - Trial 26 finished with value: 0.0016370051307603717 and parameters: {'lr': 0.0005099274457908427, 'lamb': 0.0088, 'batch_size': 64, 'n_hidden_layers_g0': 2, 'hidden_dims_g0': 40, 'af_g0': 'softplus', 'drop_p_g0': 0.0, 'n_hidden_layers_g1': 2, 'hidden_dims_g1': 64, 'af_g1': 'softplus', 'drop_p_g1': 0.0, 'n_hidden_layers_g2': 1, 'hidden_dims_g2': 40, 'af_g2': 'relu', 'drop_p_g2': 0.0, 'n_hidden_layers_h_net': 1, 'hidden_dims_h_net': 48, 'af_h_net': 'relu', 'drop_p_h_net': 0.0}. Best is trial 25 with value: 0.0002761348441708833.
2025-07-27 22:12:11,884 - INFO - Trial 27 finished with value: 0.00038705914630554616 and parameters: {'lr': 0.0007269075995014889, 'lamb': 0.007200000000000001, 'batch_size': 16, 'n_hidden_layers_g0': 2, 'hidden_dims_g0': 32, 'af_g0': 'tanh', 'drop_p_g0': 0.0, 'n_hidden_layers_g1': 2, 'hidden_dims_g1': 64, 'af_g1': 'tanh', 'drop_p_g1': 0.0, 'n_hidden_layers_g2': 1, 'hidden_dims_g2': 32, 'af_g2': 'relu', 'drop_p_g2': 0.0, 'n_hidden_layers_h_net': 1, 'hidden_dims_h_net': 40, 'af_h_net': 'relu', 'drop_p_h_net': 0.0}. Best is trial 25 with value: 0.0002761348441708833.
2025-07-27 22:18:33,571 - INFO - Trial 28 finished with value: 0.0007070880383253098 and parameters: {'lr': 0.0006143812886354888, 'lamb': 0.005200000000000001, 'batch_size': 16, 'n_hidden_layers_g0': 2, 'hidden_dims_g0': 32, 'af_g0': 'tanh', 'drop_p_g0': 0.0, 'n_hidden_layers_g1': 2, 'hidden_dims_g1': 64, 'af_g1': 'tanh', 'drop_p_g1': 0.0, 'n_hidden_layers_g2': 1, 'hidden_dims_g2': 32, 'af_g2': 'softplus', 'drop_p_g2': 0.0, 'n_hidden_layers_h_net': 1, 'hidden_dims_h_net': 32, 'af_h_net': 'tanh', 'drop_p_h_net': 0.0}. Best is trial 25 with value: 0.0002761348441708833.
2025-07-27 22:25:19,943 - INFO - Trial 29 finished with value: 0.0005021708202548325 and parameters: {'lr': 0.0011846590035737542, 'lamb': 0.0089, 'batch_size': 16, 'n_hidden_layers_g0': 2, 'hidden_dims_g0': 24, 'af_g0': 'tanh', 'drop_p_g0': 0.0, 'n_hidden_layers_g1': 2, 'hidden_dims_g1': 64, 'af_g1': 'tanh', 'drop_p_g1': 0.0, 'n_hidden_layers_g2': 1, 'hidden_dims_g2': 16, 'af_g2': 'tanh', 'drop_p_g2': 0.0, 'n_hidden_layers_h_net': 1, 'hidden_dims_h_net': 24, 'af_h_net': 'softplus', 'drop_p_h_net': 0.0}. Best is trial 25 with value: 0.0002761348441708833.
2025-07-27 22:31:55,942 - INFO - Trial 30 finished with value: 0.000553575751837343 and parameters: {'lr': 0.0023794795798456137, 'lamb': 0.0076, 'batch_size': 16, 'n_hidden_layers_g0': 2, 'hidden_dims_g0': 32, 'af_g0': 'softplus', 'drop_p_g0': 0.0, 'n_hidden_layers_g1': 2, 'hidden_dims_g1': 48, 'af_g1': 'tanh', 'drop_p_g1': 0.0, 'n_hidden_layers_g2': 1, 'hidden_dims_g2': 16, 'af_g2': 'relu', 'drop_p_g2': 0.0, 'n_hidden_layers_h_net': 1, 'hidden_dims_h_net': 40, 'af_h_net': 'tanh', 'drop_p_h_net': 0.0}. Best is trial 25 with value: 0.0002761348441708833.
2025-07-27 22:40:26,652 - INFO - Trial 31 finished with value: 0.0004159168165642768 and parameters: {'lr': 0.0008908214201923246, 'lamb': 0.0073, 'batch_size': 16, 'n_hidden_layers_g0': 2, 'hidden_dims_g0': 40, 'af_g0': 'tanh', 'drop_p_g0': 0.0, 'n_hidden_layers_g1': 2, 'hidden_dims_g1': 64, 'af_g1': 'tanh', 'drop_p_g1': 0.0, 'n_hidden_layers_g2': 1, 'hidden_dims_g2': 40, 'af_g2': 'relu', 'drop_p_g2': 0.0, 'n_hidden_layers_h_net': 1, 'hidden_dims_h_net': 48, 'af_h_net': 'relu', 'drop_p_h_net': 0.0}. Best is trial 25 with value: 0.0002761348441708833.
2025-07-27 22:50:30,181 - INFO - Trial 32 finished with value: 0.0002993446250911802 and parameters: {'lr': 0.0007032625961954412, 'lamb': 0.006500000000000001, 'batch_size': 16, 'n_hidden_layers_g0': 2, 'hidden_dims_g0': 48, 'af_g0': 'tanh', 'drop_p_g0': 0.0, 'n_hidden_layers_g1': 2, 'hidden_dims_g1': 56, 'af_g1': 'tanh', 'drop_p_g1': 0.0, 'n_hidden_layers_g2': 1, 'hidden_dims_g2': 32, 'af_g2': 'relu', 'drop_p_g2': 0.0, 'n_hidden_layers_h_net': 1, 'hidden_dims_h_net': 40, 'af_h_net': 'relu', 'drop_p_h_net': 0.0}. Best is trial 25 with value: 0.0002761348441708833.
2025-07-27 23:03:09,502 - INFO - Trial 33 finished with value: 0.00036809113225899637 and parameters: {'lr': 0.0006674456708565753, 'lamb': 0.0063, 'batch_size': 16, 'n_hidden_layers_g0': 2, 'hidden_dims_g0': 32, 'af_g0': 'tanh', 'drop_p_g0': 0.0, 'n_hidden_layers_g1': 2, 'hidden_dims_g1': 64, 'af_g1': 'tanh', 'drop_p_g1': 0.0, 'n_hidden_layers_g2': 1, 'hidden_dims_g2': 32, 'af_g2': 'relu', 'drop_p_g2': 0.0, 'n_hidden_layers_h_net': 1, 'hidden_dims_h_net': 24, 'af_h_net': 'relu', 'drop_p_h_net': 0.0}. Best is trial 25 with value: 0.0002761348441708833.
2025-07-27 23:11:47,257 - INFO - Trial 34 finished with value: 0.0003636819019448012 and parameters: {'lr': 0.0006693170918883703, 'lamb': 0.0063, 'batch_size': 16, 'n_hidden_layers_g0': 2, 'hidden_dims_g0': 40, 'af_g0': 'tanh', 'drop_p_g0': 0.0, 'n_hidden_layers_g1': 2, 'hidden_dims_g1': 56, 'af_g1': 'tanh', 'drop_p_g1': 0.0, 'n_hidden_layers_g2': 1, 'hidden_dims_g2': 24, 'af_g2': 'relu', 'drop_p_g2': 0.0, 'n_hidden_layers_h_net': 1, 'hidden_dims_h_net': 24, 'af_h_net': 'relu', 'drop_p_h_net': 0.0}. Best is trial 25 with value: 0.0002761348441708833.
