2025-07-29 05:58:55,709 - INFO - A new study created in Journal with name: model-population-llc-population_llc_70db_3
2025-07-29 06:09:25,515 - INFO - Trial 0 finished with value: 0.009114363230764866 and parameters: {'lr': 0.0028057582076672534, 'lamb': 0.009600000000000001, 'batch_size': 16, 'n_hidden_layers_g0': 1, 'hidden_dims_g0': 8, 'af_g0': 'relu', 'drop_p_g0': 0.0, 'n_hidden_layers_g1': 1, 'hidden_dims_g1': 64, 'af_g1': 'relu', 'drop_p_g1': 0.0, 'n_hidden_layers_g2': 1, 'hidden_dims_g2': 24, 'af_g2': 'relu', 'drop_p_g2': 0.0, 'n_hidden_layers_h_net': 2, 'hidden_dims_h_net': 16, 'af_h_net': 'tanh', 'drop_p_h_net': 0.0}. Best is trial 0 with value: 0.009114363230764866.
2025-07-29 06:15:56,967 - INFO - Trial 1 finished with value: 0.009117714129388332 and parameters: {'lr': 0.018591820902866044, 'lamb': 0.002, 'batch_size': 32, 'n_hidden_layers_g0': 2, 'hidden_dims_g0': 16, 'af_g0': 'tanh', 'drop_p_g0': 0.0, 'n_hidden_layers_g1': 2, 'hidden_dims_g1': 24, 'af_g1': 'softplus', 'drop_p_g1': 0.0, 'n_hidden_layers_g2': 1, 'hidden_dims_g2': 32, 'af_g2': 'softplus', 'drop_p_g2': 0.0, 'n_hidden_layers_h_net': 2, 'hidden_dims_h_net': 24, 'af_h_net': 'softplus', 'drop_p_h_net': 0.0}. Best is trial 0 with value: 0.009114363230764866.
2025-07-29 06:25:50,195 - INFO - Trial 2 finished with value: 0.009124647825956345 and parameters: {'lr': 0.04346495755569776, 'lamb': 0.0078000000000000005, 'batch_size': 16, 'n_hidden_layers_g0': 2, 'hidden_dims_g0': 8, 'af_g0': 'tanh', 'drop_p_g0': 0.0, 'n_hidden_layers_g1': 1, 'hidden_dims_g1': 24, 'af_g1': 'relu', 'drop_p_g1': 0.0, 'n_hidden_layers_g2': 2, 'hidden_dims_g2': 16, 'af_g2': 'tanh', 'drop_p_g2': 0.0, 'n_hidden_layers_h_net': 2, 'hidden_dims_h_net': 16, 'af_h_net': 'softplus', 'drop_p_h_net': 0.0}. Best is trial 0 with value: 0.009114363230764866.
2025-07-29 06:29:47,422 - INFO - Trial 3 finished with value: 0.009114830754697323 and parameters: {'lr': 0.014354376740977342, 'lamb': 0.0077, 'batch_size': 32, 'n_hidden_layers_g0': 2, 'hidden_dims_g0': 40, 'af_g0': 'relu', 'drop_p_g0': 0.0, 'n_hidden_layers_g1': 1, 'hidden_dims_g1': 48, 'af_g1': 'softplus', 'drop_p_g1': 0.0, 'n_hidden_layers_g2': 1, 'hidden_dims_g2': 48, 'af_g2': 'tanh', 'drop_p_g2': 0.0, 'n_hidden_layers_h_net': 1, 'hidden_dims_h_net': 40, 'af_h_net': 'relu', 'drop_p_h_net': 0.0}. Best is trial 0 with value: 0.009114363230764866.
2025-07-29 06:36:23,098 - INFO - Trial 4 finished with value: 0.009114643558859825 and parameters: {'lr': 0.0005778676408134936, 'lamb': 0.0064, 'batch_size': 64, 'n_hidden_layers_g0': 1, 'hidden_dims_g0': 32, 'af_g0': 'relu', 'drop_p_g0': 0.0, 'n_hidden_layers_g1': 1, 'hidden_dims_g1': 16, 'af_g1': 'relu', 'drop_p_g1': 0.0, 'n_hidden_layers_g2': 2, 'hidden_dims_g2': 56, 'af_g2': 'softplus', 'drop_p_g2': 0.0, 'n_hidden_layers_h_net': 2, 'hidden_dims_h_net': 64, 'af_h_net': 'relu', 'drop_p_h_net': 0.0}. Best is trial 0 with value: 0.009114363230764866.
2025-07-29 06:45:32,933 - INFO - Trial 5 finished with value: 0.009114999324083328 and parameters: {'lr': 0.0035742553967564933, 'lamb': 0.0082, 'batch_size': 16, 'n_hidden_layers_g0': 1, 'hidden_dims_g0': 16, 'af_g0': 'tanh', 'drop_p_g0': 0.0, 'n_hidden_layers_g1': 1, 'hidden_dims_g1': 40, 'af_g1': 'tanh', 'drop_p_g1': 0.0, 'n_hidden_layers_g2': 2, 'hidden_dims_g2': 24, 'af_g2': 'relu', 'drop_p_g2': 0.0, 'n_hidden_layers_h_net': 1, 'hidden_dims_h_net': 40, 'af_h_net': 'relu', 'drop_p_h_net': 0.0}. Best is trial 0 with value: 0.009114363230764866.
2025-07-29 06:47:46,398 - INFO - Trial 6 finished with value: 0.009128933772444725 and parameters: {'lr': 0.032771911717731424, 'lamb': 0.0024000000000000002, 'batch_size': 64, 'n_hidden_layers_g0': 1, 'hidden_dims_g0': 48, 'af_g0': 'relu', 'drop_p_g0': 0.0, 'n_hidden_layers_g1': 1, 'hidden_dims_g1': 48, 'af_g1': 'relu', 'drop_p_g1': 0.0, 'n_hidden_layers_g2': 2, 'hidden_dims_g2': 24, 'af_g2': 'tanh', 'drop_p_g2': 0.0, 'n_hidden_layers_h_net': 2, 'hidden_dims_h_net': 8, 'af_h_net': 'tanh', 'drop_p_h_net': 0.0}. Best is trial 0 with value: 0.009114363230764866.
2025-07-29 06:56:11,959 - INFO - Trial 7 finished with value: 0.009114060550928116 and parameters: {'lr': 0.0011160993683450788, 'lamb': 0.006900000000000001, 'batch_size': 32, 'n_hidden_layers_g0': 1, 'hidden_dims_g0': 8, 'af_g0': 'relu', 'drop_p_g0': 0.0, 'n_hidden_layers_g1': 2, 'hidden_dims_g1': 56, 'af_g1': 'relu', 'drop_p_g1': 0.0, 'n_hidden_layers_g2': 1, 'hidden_dims_g2': 64, 'af_g2': 'relu', 'drop_p_g2': 0.0, 'n_hidden_layers_h_net': 1, 'hidden_dims_h_net': 48, 'af_h_net': 'relu', 'drop_p_h_net': 0.0}. Best is trial 7 with value: 0.009114060550928116.
2025-07-29 07:09:04,436 - INFO - Trial 8 finished with value: 0.009114031679928303 and parameters: {'lr': 0.009616860064438593, 'lamb': 0.0008, 'batch_size': 32, 'n_hidden_layers_g0': 1, 'hidden_dims_g0': 8, 'af_g0': 'relu', 'drop_p_g0': 0.0, 'n_hidden_layers_g1': 2, 'hidden_dims_g1': 48, 'af_g1': 'tanh', 'drop_p_g1': 0.0, 'n_hidden_layers_g2': 1, 'hidden_dims_g2': 24, 'af_g2': 'tanh', 'drop_p_g2': 0.0, 'n_hidden_layers_h_net': 2, 'hidden_dims_h_net': 40, 'af_h_net': 'softplus', 'drop_p_h_net': 0.0}. Best is trial 8 with value: 0.009114031679928303.
2025-07-29 07:12:54,491 - INFO - Trial 9 finished with value: 0.009114171378314495 and parameters: {'lr': 0.0015379750534360189, 'lamb': 0.0098, 'batch_size': 32, 'n_hidden_layers_g0': 2, 'hidden_dims_g0': 40, 'af_g0': 'relu', 'drop_p_g0': 0.0, 'n_hidden_layers_g1': 2, 'hidden_dims_g1': 24, 'af_g1': 'softplus', 'drop_p_g1': 0.0, 'n_hidden_layers_g2': 2, 'hidden_dims_g2': 64, 'af_g2': 'relu', 'drop_p_g2': 0.0, 'n_hidden_layers_h_net': 2, 'hidden_dims_h_net': 32, 'af_h_net': 'relu', 'drop_p_h_net': 0.0}. Best is trial 8 with value: 0.009114031679928303.
2025-07-29 07:20:14,401 - INFO - Trial 10 finished with value: 0.009528962895274162 and parameters: {'lr': 0.008226730228304852, 'lamb': 0.0, 'batch_size': 32, 'n_hidden_layers_g0': 1, 'hidden_dims_g0': 64, 'af_g0': 'softplus', 'drop_p_g0': 0.0, 'n_hidden_layers_g1': 2, 'hidden_dims_g1': 8, 'af_g1': 'tanh', 'drop_p_g1': 0.0, 'n_hidden_layers_g2': 1, 'hidden_dims_g2': 8, 'af_g2': 'tanh', 'drop_p_g2': 0.0, 'n_hidden_layers_h_net': 1, 'hidden_dims_h_net': 56, 'af_h_net': 'softplus', 'drop_p_h_net': 0.0}. Best is trial 8 with value: 0.009114031679928303.
2025-07-29 07:22:49,564 - INFO - Trial 11 finished with value: 0.010092757642269135 and parameters: {'lr': 0.0006997763200963276, 'lamb': 0.0043, 'batch_size': 32, 'n_hidden_layers_g0': 1, 'hidden_dims_g0': 24, 'af_g0': 'softplus', 'drop_p_g0': 0.0, 'n_hidden_layers_g1': 2, 'hidden_dims_g1': 64, 'af_g1': 'tanh', 'drop_p_g1': 0.0, 'n_hidden_layers_g2': 1, 'hidden_dims_g2': 40, 'af_g2': 'relu', 'drop_p_g2': 0.0, 'n_hidden_layers_h_net': 1, 'hidden_dims_h_net': 48, 'af_h_net': 'softplus', 'drop_p_h_net': 0.0}. Best is trial 8 with value: 0.009114031679928303.
2025-07-29 07:28:32,143 - INFO - Trial 12 finished with value: 0.009118310175836086 and parameters: {'lr': 0.006744518344193019, 'lamb': 0.0047, 'batch_size': 32, 'n_hidden_layers_g0': 1, 'hidden_dims_g0': 8, 'af_g0': 'relu', 'drop_p_g0': 0.0, 'n_hidden_layers_g1': 2, 'hidden_dims_g1': 56, 'af_g1': 'tanh', 'drop_p_g1': 0.0, 'n_hidden_layers_g2': 1, 'hidden_dims_g2': 40, 'af_g2': 'tanh', 'drop_p_g2': 0.0, 'n_hidden_layers_h_net': 1, 'hidden_dims_h_net': 48, 'af_h_net': 'relu', 'drop_p_h_net': 0.0}. Best is trial 8 with value: 0.009114031679928303.
2025-07-29 07:35:31,034 - INFO - Trial 13 finished with value: 0.009114600718021393 and parameters: {'lr': 0.0016855528954227703, 'lamb': 0.0059, 'batch_size': 32, 'n_hidden_layers_g0': 1, 'hidden_dims_g0': 24, 'af_g0': 'relu', 'drop_p_g0': 0.0, 'n_hidden_layers_g1': 2, 'hidden_dims_g1': 40, 'af_g1': 'relu', 'drop_p_g1': 0.0, 'n_hidden_layers_g2': 1, 'hidden_dims_g2': 64, 'af_g2': 'relu', 'drop_p_g2': 0.0, 'n_hidden_layers_h_net': 1, 'hidden_dims_h_net': 56, 'af_h_net': 'softplus', 'drop_p_h_net': 0.0}. Best is trial 8 with value: 0.009114031679928303.
2025-07-29 07:38:06,123 - INFO - Trial 14 finished with value: 0.009114399552345276 and parameters: {'lr': 0.0013741789716094533, 'lamb': 0.0028, 'batch_size': 64, 'n_hidden_layers_g0': 1, 'hidden_dims_g0': 24, 'af_g0': 'relu', 'drop_p_g0': 0.0, 'n_hidden_layers_g1': 2, 'hidden_dims_g1': 56, 'af_g1': 'tanh', 'drop_p_g1': 0.0, 'n_hidden_layers_g2': 1, 'hidden_dims_g2': 48, 'af_g2': 'softplus', 'drop_p_g2': 0.0, 'n_hidden_layers_h_net': 2, 'hidden_dims_h_net': 32, 'af_h_net': 'tanh', 'drop_p_h_net': 0.0}. Best is trial 8 with value: 0.009114031679928303.
2025-07-29 07:44:42,332 - INFO - Trial 15 finished with value: 0.009116453118622303 and parameters: {'lr': 0.015279940856711315, 'lamb': 0.0001, 'batch_size': 32, 'n_hidden_layers_g0': 1, 'hidden_dims_g0': 56, 'af_g0': 'softplus', 'drop_p_g0': 0.0, 'n_hidden_layers_g1': 2, 'hidden_dims_g1': 48, 'af_g1': 'relu', 'drop_p_g1': 0.0, 'n_hidden_layers_g2': 1, 'hidden_dims_g2': 8, 'af_g2': 'tanh', 'drop_p_g2': 0.0, 'n_hidden_layers_h_net': 1, 'hidden_dims_h_net': 48, 'af_h_net': 'relu', 'drop_p_h_net': 0.0}. Best is trial 8 with value: 0.009114031679928303.
2025-07-29 07:49:40,352 - INFO - Trial 16 finished with value: 0.00911667663604021 and parameters: {'lr': 0.005078721669496845, 'lamb': 0.0034000000000000002, 'batch_size': 32, 'n_hidden_layers_g0': 1, 'hidden_dims_g0': 16, 'af_g0': 'relu', 'drop_p_g0': 0.0, 'n_hidden_layers_g1': 2, 'hidden_dims_g1': 56, 'af_g1': 'tanh', 'drop_p_g1': 0.0, 'n_hidden_layers_g2': 1, 'hidden_dims_g2': 32, 'af_g2': 'relu', 'drop_p_g2': 0.0, 'n_hidden_layers_h_net': 1, 'hidden_dims_h_net': 64, 'af_h_net': 'softplus', 'drop_p_h_net': 0.0}. Best is trial 8 with value: 0.009114031679928303.
2025-07-29 07:53:42,686 - INFO - Trial 17 finished with value: 0.009113847278058529 and parameters: {'lr': 0.009985646163574809, 'lamb': 0.006500000000000001, 'batch_size': 32, 'n_hidden_layers_g0': 2, 'hidden_dims_g0': 32, 'af_g0': 'relu', 'drop_p_g0': 0.0, 'n_hidden_layers_g1': 2, 'hidden_dims_g1': 32, 'af_g1': 'tanh', 'drop_p_g1': 0.0, 'n_hidden_layers_g2': 1, 'hidden_dims_g2': 56, 'af_g2': 'relu', 'drop_p_g2': 0.0, 'n_hidden_layers_h_net': 2, 'hidden_dims_h_net': 40, 'af_h_net': 'softplus', 'drop_p_h_net': 0.0}. Best is trial 17 with value: 0.009113847278058529.
2025-07-29 07:57:42,237 - INFO - Trial 18 finished with value: 0.009117147885262966 and parameters: {'lr': 0.009012476065960848, 'lamb': 0.0013000000000000002, 'batch_size': 64, 'n_hidden_layers_g0': 2, 'hidden_dims_g0': 32, 'af_g0': 'tanh', 'drop_p_g0': 0.0, 'n_hidden_layers_g1': 2, 'hidden_dims_g1': 32, 'af_g1': 'tanh', 'drop_p_g1': 0.0, 'n_hidden_layers_g2': 1, 'hidden_dims_g2': 48, 'af_g2': 'tanh', 'drop_p_g2': 0.0, 'n_hidden_layers_h_net': 2, 'hidden_dims_h_net': 24, 'af_h_net': 'softplus', 'drop_p_h_net': 0.0}. Best is trial 17 with value: 0.009113847278058529.
2025-07-29 08:04:03,048 - INFO - Trial 19 finished with value: 0.009117824956774712 and parameters: {'lr': 0.02435896956419889, 'lamb': 0.0056, 'batch_size': 16, 'n_hidden_layers_g0': 2, 'hidden_dims_g0': 48, 'af_g0': 'softplus', 'drop_p_g0': 0.0, 'n_hidden_layers_g1': 2, 'hidden_dims_g1': 32, 'af_g1': 'tanh', 'drop_p_g1': 0.0, 'n_hidden_layers_g2': 1, 'hidden_dims_g2': 16, 'af_g2': 'softplus', 'drop_p_g2': 0.0, 'n_hidden_layers_h_net': 2, 'hidden_dims_h_net': 32, 'af_h_net': 'softplus', 'drop_p_h_net': 0.0}. Best is trial 17 with value: 0.009113847278058529.
2025-07-29 08:09:51,469 - INFO - Trial 20 finished with value: 0.009116039611399174 and parameters: {'lr': 0.011730087197802377, 'lamb': 0.0041, 'batch_size': 32, 'n_hidden_layers_g0': 2, 'hidden_dims_g0': 48, 'af_g0': 'relu', 'drop_p_g0': 0.0, 'n_hidden_layers_g1': 2, 'hidden_dims_g1': 40, 'af_g1': 'tanh', 'drop_p_g1': 0.0, 'n_hidden_layers_g2': 2, 'hidden_dims_g2': 56, 'af_g2': 'tanh', 'drop_p_g2': 0.0, 'n_hidden_layers_h_net': 2, 'hidden_dims_h_net': 40, 'af_h_net': 'softplus', 'drop_p_h_net': 0.0}. Best is trial 17 with value: 0.009113847278058529.
2025-07-29 08:16:03,215 - INFO - Trial 21 finished with value: 0.00911445077508688 and parameters: {'lr': 0.003330732512632315, 'lamb': 0.0068000000000000005, 'batch_size': 32, 'n_hidden_layers_g0': 2, 'hidden_dims_g0': 16, 'af_g0': 'relu', 'drop_p_g0': 0.0, 'n_hidden_layers_g1': 2, 'hidden_dims_g1': 48, 'af_g1': 'tanh', 'drop_p_g1': 0.0, 'n_hidden_layers_g2': 1, 'hidden_dims_g2': 56, 'af_g2': 'relu', 'drop_p_g2': 0.0, 'n_hidden_layers_h_net': 2, 'hidden_dims_h_net': 48, 'af_h_net': 'softplus', 'drop_p_h_net': 0.0}. Best is trial 17 with value: 0.009113847278058529.
2025-07-29 08:20:43,803 - INFO - Trial 22 finished with value: 0.009113729931414127 and parameters: {'lr': 0.0052492532342389734, 'lamb': 0.007200000000000001, 'batch_size': 32, 'n_hidden_layers_g0': 1, 'hidden_dims_g0': 8, 'af_g0': 'relu', 'drop_p_g0': 0.0, 'n_hidden_layers_g1': 2, 'hidden_dims_g1': 56, 'af_g1': 'relu', 'drop_p_g1': 0.0, 'n_hidden_layers_g2': 1, 'hidden_dims_g2': 64, 'af_g2': 'relu', 'drop_p_g2': 0.0, 'n_hidden_layers_h_net': 2, 'hidden_dims_h_net': 56, 'af_h_net': 'relu', 'drop_p_h_net': 0.0}. Best is trial 22 with value: 0.009113729931414127.
2025-07-29 08:26:34,161 - INFO - Trial 23 finished with value: 0.00911545567214489 and parameters: {'lr': 0.005267429498124147, 'lamb': 0.0086, 'batch_size': 32, 'n_hidden_layers_g0': 1, 'hidden_dims_g0': 24, 'af_g0': 'relu', 'drop_p_g0': 0.0, 'n_hidden_layers_g1': 2, 'hidden_dims_g1': 32, 'af_g1': 'softplus', 'drop_p_g1': 0.0, 'n_hidden_layers_g2': 1, 'hidden_dims_g2': 56, 'af_g2': 'relu', 'drop_p_g2': 0.0, 'n_hidden_layers_h_net': 2, 'hidden_dims_h_net': 56, 'af_h_net': 'tanh', 'drop_p_h_net': 0.0}. Best is trial 22 with value: 0.009113729931414127.
2025-07-29 08:36:21,584 - INFO - Trial 24 finished with value: 0.00911375880241394 and parameters: {'lr': 0.009794558808488807, 'lamb': 0.005200000000000001, 'batch_size': 32, 'n_hidden_layers_g0': 2, 'hidden_dims_g0': 16, 'af_g0': 'relu', 'drop_p_g0': 0.0, 'n_hidden_layers_g1': 2, 'hidden_dims_g1': 64, 'af_g1': 'tanh', 'drop_p_g1': 0.0, 'n_hidden_layers_g2': 1, 'hidden_dims_g2': 64, 'af_g2': 'relu', 'drop_p_g2': 0.0, 'n_hidden_layers_h_net': 2, 'hidden_dims_h_net': 40, 'af_h_net': 'softplus', 'drop_p_h_net': 0.0}. Best is trial 22 with value: 0.009113729931414127.
2025-07-29 08:40:15,735 - INFO - Trial 25 finished with value: 0.009114133194088936 and parameters: {'lr': 0.002669426540648697, 'lamb': 0.0053, 'batch_size': 32, 'n_hidden_layers_g0': 2, 'hidden_dims_g0': 32, 'af_g0': 'relu', 'drop_p_g0': 0.0, 'n_hidden_layers_g1': 2, 'hidden_dims_g1': 64, 'af_g1': 'relu', 'drop_p_g1': 0.0, 'n_hidden_layers_g2': 1, 'hidden_dims_g2': 64, 'af_g2': 'relu', 'drop_p_g2': 0.0, 'n_hidden_layers_h_net': 2, 'hidden_dims_h_net': 56, 'af_h_net': 'relu', 'drop_p_h_net': 0.0}. Best is trial 22 with value: 0.009113729931414127.
2025-07-29 08:45:41,932 - INFO - Trial 26 finished with value: 0.009115752764046192 and parameters: {'lr': 0.020904041595632677, 'lamb': 0.007200000000000001, 'batch_size': 32, 'n_hidden_layers_g0': 2, 'hidden_dims_g0': 16, 'af_g0': 'relu', 'drop_p_g0': 0.0, 'n_hidden_layers_g1': 2, 'hidden_dims_g1': 64, 'af_g1': 'tanh', 'drop_p_g1': 0.0, 'n_hidden_layers_g2': 1, 'hidden_dims_g2': 64, 'af_g2': 'relu', 'drop_p_g2': 0.0, 'n_hidden_layers_h_net': 2, 'hidden_dims_h_net': 64, 'af_h_net': 'softplus', 'drop_p_h_net': 0.0}. Best is trial 22 with value: 0.009113729931414127.
2025-07-29 08:52:27,304 - INFO - Trial 27 finished with value: 0.009114514105021954 and parameters: {'lr': 0.006325263929408366, 'lamb': 0.0088, 'batch_size': 32, 'n_hidden_layers_g0': 2, 'hidden_dims_g0': 24, 'af_g0': 'relu', 'drop_p_g0': 0.0, 'n_hidden_layers_g1': 2, 'hidden_dims_g1': 16, 'af_g1': 'tanh', 'drop_p_g1': 0.0, 'n_hidden_layers_g2': 1, 'hidden_dims_g2': 56, 'af_g2': 'relu', 'drop_p_g2': 0.0, 'n_hidden_layers_h_net': 2, 'hidden_dims_h_net': 24, 'af_h_net': 'softplus', 'drop_p_h_net': 0.0}. Best is trial 22 with value: 0.009113729931414127.
2025-07-29 08:58:31,285 - INFO - Trial 28 finished with value: 0.00911595206707716 and parameters: {'lr': 0.011787991256675262, 'lamb': 0.0061, 'batch_size': 16, 'n_hidden_layers_g0': 2, 'hidden_dims_g0': 40, 'af_g0': 'tanh', 'drop_p_g0': 0.0, 'n_hidden_layers_g1': 2, 'hidden_dims_g1': 56, 'af_g1': 'relu', 'drop_p_g1': 0.0, 'n_hidden_layers_g2': 1, 'hidden_dims_g2': 48, 'af_g2': 'relu', 'drop_p_g2': 0.0, 'n_hidden_layers_h_net': 2, 'hidden_dims_h_net': 32, 'af_h_net': 'tanh', 'drop_p_h_net': 0.0}. Best is trial 22 with value: 0.009113729931414127.
2025-07-29 09:00:20,183 - INFO - Trial 29 finished with value: 0.010075016878545284 and parameters: {'lr': 0.0023567830456037325, 'lamb': 0.005, 'batch_size': 64, 'n_hidden_layers_g0': 2, 'hidden_dims_g0': 8, 'af_g0': 'softplus', 'drop_p_g0': 0.0, 'n_hidden_layers_g1': 1, 'hidden_dims_g1': 64, 'af_g1': 'softplus', 'drop_p_g1': 0.0, 'n_hidden_layers_g2': 1, 'hidden_dims_g2': 64, 'af_g2': 'relu', 'drop_p_g2': 0.0, 'n_hidden_layers_h_net': 2, 'hidden_dims_h_net': 40, 'af_h_net': 'relu', 'drop_p_h_net': 0.0}. Best is trial 22 with value: 0.009113729931414127.
2025-07-29 09:09:31,300 - INFO - Trial 30 finished with value: 0.009115785360336304 and parameters: {'lr': 0.029477598368564797, 'lamb': 0.0092, 'batch_size': 16, 'n_hidden_layers_g0': 2, 'hidden_dims_g0': 16, 'af_g0': 'relu', 'drop_p_g0': 0.0, 'n_hidden_layers_g1': 2, 'hidden_dims_g1': 40, 'af_g1': 'relu', 'drop_p_g1': 0.0, 'n_hidden_layers_g2': 1, 'hidden_dims_g2': 56, 'af_g2': 'relu', 'drop_p_g2': 0.0, 'n_hidden_layers_h_net': 2, 'hidden_dims_h_net': 16, 'af_h_net': 'tanh', 'drop_p_h_net': 0.0}. Best is trial 22 with value: 0.009113729931414127.
2025-07-29 09:15:22,314 - INFO - Trial 31 finished with value: 0.009115434251725674 and parameters: {'lr': 0.008916320068476527, 'lamb': 0.004, 'batch_size': 32, 'n_hidden_layers_g0': 1, 'hidden_dims_g0': 8, 'af_g0': 'relu', 'drop_p_g0': 0.0, 'n_hidden_layers_g1': 2, 'hidden_dims_g1': 56, 'af_g1': 'tanh', 'drop_p_g1': 0.0, 'n_hidden_layers_g2': 1, 'hidden_dims_g2': 32, 'af_g2': 'relu', 'drop_p_g2': 0.0, 'n_hidden_layers_h_net': 2, 'hidden_dims_h_net': 40, 'af_h_net': 'softplus', 'drop_p_h_net': 0.0}. Best is trial 22 with value: 0.009113729931414127.
2025-07-29 09:20:41,646 - INFO - Trial 32 finished with value: 0.009125251322984695 and parameters: {'lr': 0.0038401336526945598, 'lamb': 0.0011, 'batch_size': 32, 'n_hidden_layers_g0': 1, 'hidden_dims_g0': 8, 'af_g0': 'relu', 'drop_p_g0': 0.0, 'n_hidden_layers_g1': 2, 'hidden_dims_g1': 48, 'af_g1': 'tanh', 'drop_p_g1': 0.0, 'n_hidden_layers_g2': 1, 'hidden_dims_g2': 40, 'af_g2': 'softplus', 'drop_p_g2': 0.0, 'n_hidden_layers_h_net': 2, 'hidden_dims_h_net': 40, 'af_h_net': 'softplus', 'drop_p_h_net': 0.0}. Best is trial 22 with value: 0.009113729931414127.
2025-07-29 09:25:56,170 - INFO - Trial 33 finished with value: 0.009118778631091118 and parameters: {'lr': 0.01170177867915556, 'lamb': 0.007200000000000001, 'batch_size': 32, 'n_hidden_layers_g0': 2, 'hidden_dims_g0': 16, 'af_g0': 'relu', 'drop_p_g0': 0.0, 'n_hidden_layers_g1': 2, 'hidden_dims_g1': 64, 'af_g1': 'tanh', 'drop_p_g1': 0.0, 'n_hidden_layers_g2': 1, 'hidden_dims_g2': 16, 'af_g2': 'relu', 'drop_p_g2': 0.0, 'n_hidden_layers_h_net': 2, 'hidden_dims_h_net': 32, 'af_h_net': 'softplus', 'drop_p_h_net': 0.0}. Best is trial 22 with value: 0.009113729931414127.
2025-07-29 09:29:11,655 - INFO - Trial 34 finished with value: 0.009125951677560806 and parameters: {'lr': 0.017014305319813194, 'lamb': 0.0077, 'batch_size': 32, 'n_hidden_layers_g0': 2, 'hidden_dims_g0': 8, 'af_g0': 'relu', 'drop_p_g0': 0.0, 'n_hidden_layers_g1': 2, 'hidden_dims_g1': 56, 'af_g1': 'tanh', 'drop_p_g1': 0.0, 'n_hidden_layers_g2': 1, 'hidden_dims_g2': 24, 'af_g2': 'tanh', 'drop_p_g2': 0.0, 'n_hidden_layers_h_net': 2, 'hidden_dims_h_net': 48, 'af_h_net': 'softplus', 'drop_p_h_net': 0.0}. Best is trial 22 with value: 0.009113729931414127.
2025-07-29 09:37:13,637 - INFO - Trial 35 finished with value: 0.009115022607147694 and parameters: {'lr': 0.007844835222629175, 'lamb': 0.006500000000000001, 'batch_size': 32, 'n_hidden_layers_g0': 1, 'hidden_dims_g0': 16, 'af_g0': 'tanh', 'drop_p_g0': 0.0, 'n_hidden_layers_g1': 2, 'hidden_dims_g1': 32, 'af_g1': 'softplus', 'drop_p_g1': 0.0, 'n_hidden_layers_g2': 1, 'hidden_dims_g2': 64, 'af_g2': 'softplus', 'drop_p_g2': 0.0, 'n_hidden_layers_h_net': 2, 'hidden_dims_h_net': 56, 'af_h_net': 'softplus', 'drop_p_h_net': 0.0}. Best is trial 22 with value: 0.009113729931414127.
2025-07-29 09:43:30,657 - INFO - Trial 36 finished with value: 0.009117720648646355 and parameters: {'lr': 0.004567125533299635, 'lamb': 0.0055000000000000005, 'batch_size': 32, 'n_hidden_layers_g0': 2, 'hidden_dims_g0': 8, 'af_g0': 'relu', 'drop_p_g0': 0.0, 'n_hidden_layers_g1': 1, 'hidden_dims_g1': 48, 'af_g1': 'tanh', 'drop_p_g1': 0.0, 'n_hidden_layers_g2': 1, 'hidden_dims_g2': 56, 'af_g2': 'tanh', 'drop_p_g2': 0.0, 'n_hidden_layers_h_net': 2, 'hidden_dims_h_net': 24, 'af_h_net': 'softplus', 'drop_p_h_net': 0.0}. Best is trial 22 with value: 0.009113729931414127.
2025-07-29 09:51:50,849 - INFO - Trial 37 finished with value: 0.00985459890216589 and parameters: {'lr': 0.04711431112555631, 'lamb': 0.0034000000000000002, 'batch_size': 16, 'n_hidden_layers_g0': 1, 'hidden_dims_g0': 32, 'af_g0': 'relu', 'drop_p_g0': 0.0, 'n_hidden_layers_g1': 2, 'hidden_dims_g1': 40, 'af_g1': 'relu', 'drop_p_g1': 0.0, 'n_hidden_layers_g2': 2, 'hidden_dims_g2': 32, 'af_g2': 'relu', 'drop_p_g2': 0.0, 'n_hidden_layers_h_net': 2, 'hidden_dims_h_net': 40, 'af_h_net': 'relu', 'drop_p_h_net': 0.0}. Best is trial 22 with value: 0.009113729931414127.
