2025-07-29 10:01:51,890 - INFO - Trial 38 finished with value: 0.009114536456763744 and parameters: {'lr': 0.010683562893669833, 'lamb': 0.008, 'batch_size': 32, 'n_hidden_layers_g0': 1, 'hidden_dims_g0': 16, 'af_g0': 'tanh', 'drop_p_g0': 0.0, 'n_hidden_layers_g1': 1, 'hidden_dims_g1': 48, 'af_g1': 'tanh', 'drop_p_g1': 0.0, 'n_hidden_layers_g2': 1, 'hidden_dims_g2': 48, 'af_g2': 'relu', 'drop_p_g2': 0.0, 'n_hidden_layers_h_net': 2, 'hidden_dims_h_net': 24, 'af_h_net': 'softplus', 'drop_p_h_net': 0.0}. Best is trial 22 with value: 0.009113729931414127.
2025-07-29 10:07:48,026 - INFO - Trial 39 finished with value: 0.009114216081798077 and parameters: {'lr': 0.005701313692775747, 'lamb': 0.0061, 'batch_size': 64, 'n_hidden_layers_g0': 2, 'hidden_dims_g0': 8, 'af_g0': 'relu', 'drop_p_g0': 0.0, 'n_hidden_layers_g1': 2, 'hidden_dims_g1': 24, 'af_g1': 'relu', 'drop_p_g1': 0.0, 'n_hidden_layers_g2': 2, 'hidden_dims_g2': 64, 'af_g2': 'tanh', 'drop_p_g2': 0.0, 'n_hidden_layers_h_net': 2, 'hidden_dims_h_net': 8, 'af_h_net': 'relu', 'drop_p_h_net': 0.0}. Best is trial 22 with value: 0.009113729931414127.
2025-07-29 10:18:19,968 - INFO - Trial 40 finished with value: 0.009113640524446964 and parameters: {'lr': 0.01402027020261383, 'lamb': 0.0073, 'batch_size': 32, 'n_hidden_layers_g0': 1, 'hidden_dims_g0': 24, 'af_g0': 'relu', 'drop_p_g0': 0.0, 'n_hidden_layers_g1': 1, 'hidden_dims_g1': 64, 'af_g1': 'softplus', 'drop_p_g1': 0.0, 'n_hidden_layers_g2': 1, 'hidden_dims_g2': 56, 'af_g2': 'relu', 'drop_p_g2': 0.0, 'n_hidden_layers_h_net': 2, 'hidden_dims_h_net': 48, 'af_h_net': 'softplus', 'drop_p_h_net': 0.0}. Best is trial 40 with value: 0.009113640524446964.
2025-07-29 10:23:52,291 - INFO - Trial 41 finished with value: 0.00911636184900999 and parameters: {'lr': 0.015570236906639317, 'lamb': 0.007, 'batch_size': 32, 'n_hidden_layers_g0': 1, 'hidden_dims_g0': 24, 'af_g0': 'relu', 'drop_p_g0': 0.0, 'n_hidden_layers_g1': 1, 'hidden_dims_g1': 64, 'af_g1': 'softplus', 'drop_p_g1': 0.0, 'n_hidden_layers_g2': 1, 'hidden_dims_g2': 56, 'af_g2': 'relu', 'drop_p_g2': 0.0, 'n_hidden_layers_h_net': 2, 'hidden_dims_h_net': 48, 'af_h_net': 'softplus', 'drop_p_h_net': 0.0}. Best is trial 40 with value: 0.009113640524446964.
2025-07-29 10:30:01,977 - INFO - Trial 42 finished with value: 0.009116492234170437 and parameters: {'lr': 0.020882361710680503, 'lamb': 0.0076, 'batch_size': 32, 'n_hidden_layers_g0': 1, 'hidden_dims_g0': 32, 'af_g0': 'relu', 'drop_p_g0': 0.0, 'n_hidden_layers_g1': 1, 'hidden_dims_g1': 64, 'af_g1': 'softplus', 'drop_p_g1': 0.0, 'n_hidden_layers_g2': 1, 'hidden_dims_g2': 24, 'af_g2': 'relu', 'drop_p_g2': 0.0, 'n_hidden_layers_h_net': 2, 'hidden_dims_h_net': 40, 'af_h_net': 'softplus', 'drop_p_h_net': 0.0}. Best is trial 40 with value: 0.009113640524446964.
2025-07-29 10:33:06,931 - INFO - Trial 43 finished with value: 0.009117226116359234 and parameters: {'lr': 0.007116845104188403, 'lamb': 0.006500000000000001, 'batch_size': 32, 'n_hidden_layers_g0': 1, 'hidden_dims_g0': 24, 'af_g0': 'relu', 'drop_p_g0': 0.0, 'n_hidden_layers_g1': 1, 'hidden_dims_g1': 56, 'af_g1': 'softplus', 'drop_p_g1': 0.0, 'n_hidden_layers_g2': 1, 'hidden_dims_g2': 48, 'af_g2': 'relu', 'drop_p_g2': 0.0, 'n_hidden_layers_h_net': 2, 'hidden_dims_h_net': 48, 'af_h_net': 'softplus', 'drop_p_h_net': 0.0}. Best is trial 40 with value: 0.009113640524446964.
2025-07-29 10:37:39,581 - INFO - Trial 44 finished with value: 0.00911552645266056 and parameters: {'lr': 0.0098407750755715, 'lamb': 0.0049, 'batch_size': 32, 'n_hidden_layers_g0': 1, 'hidden_dims_g0': 16, 'af_g0': 'relu', 'drop_p_g0': 0.0, 'n_hidden_layers_g1': 1, 'hidden_dims_g1': 64, 'af_g1': 'softplus', 'drop_p_g1': 0.0, 'n_hidden_layers_g2': 1, 'hidden_dims_g2': 64, 'af_g2': 'relu', 'drop_p_g2': 0.0, 'n_hidden_layers_h_net': 2, 'hidden_dims_h_net': 56, 'af_h_net': 'softplus', 'drop_p_h_net': 0.0}. Best is trial 40 with value: 0.009113640524446964.
2025-07-29 10:43:48,523 - INFO - Trial 45 finished with value: 0.009114345535635948 and parameters: {'lr': 0.013889334406743857, 'lamb': 0.0074, 'batch_size': 32, 'n_hidden_layers_g0': 1, 'hidden_dims_g0': 32, 'af_g0': 'relu', 'drop_p_g0': 0.0, 'n_hidden_layers_g1': 1, 'hidden_dims_g1': 56, 'af_g1': 'softplus', 'drop_p_g1': 0.0, 'n_hidden_layers_g2': 1, 'hidden_dims_g2': 56, 'af_g2': 'relu', 'drop_p_g2': 0.0, 'n_hidden_layers_h_net': 2, 'hidden_dims_h_net': 48, 'af_h_net': 'relu', 'drop_p_h_net': 0.0}. Best is trial 40 with value: 0.009113640524446964.
2025-07-29 10:52:46,929 - INFO - Trial 46 finished with value: 0.009114573709666729 and parameters: {'lr': 0.029075419770283235, 'lamb': 0.0083, 'batch_size': 32, 'n_hidden_layers_g0': 1, 'hidden_dims_g0': 40, 'af_g0': 'softplus', 'drop_p_g0': 0.0, 'n_hidden_layers_g1': 2, 'hidden_dims_g1': 24, 'af_g1': 'relu', 'drop_p_g1': 0.0, 'n_hidden_layers_g2': 1, 'hidden_dims_g2': 40, 'af_g2': 'tanh', 'drop_p_g2': 0.0, 'n_hidden_layers_h_net': 2, 'hidden_dims_h_net': 32, 'af_h_net': 'softplus', 'drop_p_h_net': 0.0}. Best is trial 40 with value: 0.009113640524446964.
2025-07-29 10:57:29,968 - INFO - Trial 47 finished with value: 0.009114199317991734 and parameters: {'lr': 0.013467752916125425, 'lamb': 0.0095, 'batch_size': 32, 'n_hidden_layers_g0': 1, 'hidden_dims_g0': 8, 'af_g0': 'relu', 'drop_p_g0': 0.0, 'n_hidden_layers_g1': 2, 'hidden_dims_g1': 64, 'af_g1': 'tanh', 'drop_p_g1': 0.0, 'n_hidden_layers_g2': 1, 'hidden_dims_g2': 64, 'af_g2': 'softplus', 'drop_p_g2': 0.0, 'n_hidden_layers_h_net': 2, 'hidden_dims_h_net': 40, 'af_h_net': 'tanh', 'drop_p_h_net': 0.0}. Best is trial 40 with value: 0.009113640524446964.
2025-07-29 11:00:22,762 - INFO - Trial 48 finished with value: 0.009116554632782936 and parameters: {'lr': 0.007165947141514814, 'lamb': 0.0045000000000000005, 'batch_size': 64, 'n_hidden_layers_g0': 1, 'hidden_dims_g0': 24, 'af_g0': 'relu', 'drop_p_g0': 0.0, 'n_hidden_layers_g1': 2, 'hidden_dims_g1': 56, 'af_g1': 'tanh', 'drop_p_g1': 0.0, 'n_hidden_layers_g2': 1, 'hidden_dims_g2': 48, 'af_g2': 'relu', 'drop_p_g2': 0.0, 'n_hidden_layers_h_net': 2, 'hidden_dims_h_net': 64, 'af_h_net': 'relu', 'drop_p_h_net': 0.0}. Best is trial 40 with value: 0.009113640524446964.
2025-07-29 11:06:48,452 - INFO - Trial 49 finished with value: 0.009114556014537811 and parameters: {'lr': 0.0043299689434250985, 'lamb': 0.0017000000000000001, 'batch_size': 16, 'n_hidden_layers_g0': 1, 'hidden_dims_g0': 16, 'af_g0': 'tanh', 'drop_p_g0': 0.0, 'n_hidden_layers_g1': 1, 'hidden_dims_g1': 48, 'af_g1': 'relu', 'drop_p_g1': 0.0, 'n_hidden_layers_g2': 2, 'hidden_dims_g2': 16, 'af_g2': 'tanh', 'drop_p_g2': 0.0, 'n_hidden_layers_h_net': 2, 'hidden_dims_h_net': 48, 'af_h_net': 'softplus', 'drop_p_h_net': 0.0}. Best is trial 40 with value: 0.009113640524446964.
2025-07-29 11:12:19,004 - INFO - Trial 50 finished with value: 0.009114261716604233 and parameters: {'lr': 0.017586981559857343, 'lamb': 0.0036000000000000003, 'batch_size': 32, 'n_hidden_layers_g0': 2, 'hidden_dims_g0': 8, 'af_g0': 'relu', 'drop_p_g0': 0.0, 'n_hidden_layers_g1': 2, 'hidden_dims_g1': 16, 'af_g1': 'tanh', 'drop_p_g1': 0.0, 'n_hidden_layers_g2': 1, 'hidden_dims_g2': 64, 'af_g2': 'relu', 'drop_p_g2': 0.0, 'n_hidden_layers_h_net': 1, 'hidden_dims_h_net': 56, 'af_h_net': 'softplus', 'drop_p_h_net': 0.0}. Best is trial 40 with value: 0.009113640524446964.
2025-07-29 11:17:54,633 - INFO - Trial 51 finished with value: 0.009114054962992668 and parameters: {'lr': 0.0009180004010004354, 'lamb': 0.0067, 'batch_size': 32, 'n_hidden_layers_g0': 1, 'hidden_dims_g0': 8, 'af_g0': 'relu', 'drop_p_g0': 0.0, 'n_hidden_layers_g1': 2, 'hidden_dims_g1': 56, 'af_g1': 'relu', 'drop_p_g1': 0.0, 'n_hidden_layers_g2': 1, 'hidden_dims_g2': 64, 'af_g2': 'relu', 'drop_p_g2': 0.0, 'n_hidden_layers_h_net': 1, 'hidden_dims_h_net': 48, 'af_h_net': 'relu', 'drop_p_h_net': 0.0}. Best is trial 40 with value: 0.009113640524446964.
2025-07-29 11:21:50,606 - INFO - Trial 52 finished with value: 0.009114764630794525 and parameters: {'lr': 0.0019044051623304556, 'lamb': 0.0059, 'batch_size': 32, 'n_hidden_layers_g0': 1, 'hidden_dims_g0': 8, 'af_g0': 'relu', 'drop_p_g0': 0.0, 'n_hidden_layers_g1': 2, 'hidden_dims_g1': 56, 'af_g1': 'relu', 'drop_p_g1': 0.0, 'n_hidden_layers_g2': 1, 'hidden_dims_g2': 64, 'af_g2': 'relu', 'drop_p_g2': 0.0, 'n_hidden_layers_h_net': 1, 'hidden_dims_h_net': 40, 'af_h_net': 'relu', 'drop_p_h_net': 0.0}. Best is trial 40 with value: 0.009113640524446964.
2025-07-29 11:26:42,796 - INFO - Trial 53 finished with value: 0.009113992564380169 and parameters: {'lr': 0.0007247752249943442, 'lamb': 0.006500000000000001, 'batch_size': 32, 'n_hidden_layers_g0': 1, 'hidden_dims_g0': 16, 'af_g0': 'relu', 'drop_p_g0': 0.0, 'n_hidden_layers_g1': 2, 'hidden_dims_g1': 56, 'af_g1': 'relu', 'drop_p_g1': 0.0, 'n_hidden_layers_g2': 1, 'hidden_dims_g2': 56, 'af_g2': 'relu', 'drop_p_g2': 0.0, 'n_hidden_layers_h_net': 1, 'hidden_dims_h_net': 48, 'af_h_net': 'relu', 'drop_p_h_net': 0.0}. Best is trial 40 with value: 0.009113640524446964.
2025-07-29 11:35:11,192 - INFO - Trial 54 finished with value: 0.00911396462470293 and parameters: {'lr': 0.0005496825614337343, 'lamb': 0.005200000000000001, 'batch_size': 32, 'n_hidden_layers_g0': 1, 'hidden_dims_g0': 16, 'af_g0': 'relu', 'drop_p_g0': 0.0, 'n_hidden_layers_g1': 2, 'hidden_dims_g1': 64, 'af_g1': 'relu', 'drop_p_g1': 0.0, 'n_hidden_layers_g2': 1, 'hidden_dims_g2': 56, 'af_g2': 'relu', 'drop_p_g2': 0.0, 'n_hidden_layers_h_net': 1, 'hidden_dims_h_net': 48, 'af_h_net': 'relu', 'drop_p_h_net': 0.0}. Best is trial 40 with value: 0.009113640524446964.
2025-07-29 11:40:01,458 - INFO - Trial 55 finished with value: 0.009114079177379608 and parameters: {'lr': 0.0005150758849108477, 'lamb': 0.0051, 'batch_size': 32, 'n_hidden_layers_g0': 1, 'hidden_dims_g0': 24, 'af_g0': 'relu', 'drop_p_g0': 0.0, 'n_hidden_layers_g1': 2, 'hidden_dims_g1': 64, 'af_g1': 'relu', 'drop_p_g1': 0.0, 'n_hidden_layers_g2': 1, 'hidden_dims_g2': 56, 'af_g2': 'relu', 'drop_p_g2': 0.0, 'n_hidden_layers_h_net': 1, 'hidden_dims_h_net': 56, 'af_h_net': 'relu', 'drop_p_h_net': 0.0}. Best is trial 40 with value: 0.009113640524446964.
2025-07-29 11:45:55,930 - INFO - Trial 56 finished with value: 0.009113626554608345 and parameters: {'lr': 0.0007022124562398584, 'lamb': 0.0057, 'batch_size': 32, 'n_hidden_layers_g0': 1, 'hidden_dims_g0': 16, 'af_g0': 'relu', 'drop_p_g0': 0.0, 'n_hidden_layers_g1': 2, 'hidden_dims_g1': 64, 'af_g1': 'relu', 'drop_p_g1': 0.0, 'n_hidden_layers_g2': 1, 'hidden_dims_g2': 56, 'af_g2': 'relu', 'drop_p_g2': 0.0, 'n_hidden_layers_h_net': 1, 'hidden_dims_h_net': 48, 'af_h_net': 'relu', 'drop_p_h_net': 0.0}. Best is trial 56 with value: 0.009113626554608345.
2025-07-29 11:51:57,823 - INFO - Trial 57 finished with value: 0.009113924577832222 and parameters: {'lr': 0.0006261226471548023, 'lamb': 0.0057, 'batch_size': 32, 'n_hidden_layers_g0': 1, 'hidden_dims_g0': 24, 'af_g0': 'softplus', 'drop_p_g0': 0.0, 'n_hidden_layers_g1': 2, 'hidden_dims_g1': 64, 'af_g1': 'relu', 'drop_p_g1': 0.0, 'n_hidden_layers_g2': 1, 'hidden_dims_g2': 48, 'af_g2': 'relu', 'drop_p_g2': 0.0, 'n_hidden_layers_h_net': 1, 'hidden_dims_h_net': 56, 'af_h_net': 'relu', 'drop_p_h_net': 0.0}. Best is trial 56 with value: 0.009113626554608345.
2025-07-29 11:55:24,341 - INFO - Trial 58 finished with value: 0.00911673903465271 and parameters: {'lr': 0.000998565915932353, 'lamb': 0.0058000000000000005, 'batch_size': 32, 'n_hidden_layers_g0': 1, 'hidden_dims_g0': 24, 'af_g0': 'softplus', 'drop_p_g0': 0.0, 'n_hidden_layers_g1': 2, 'hidden_dims_g1': 64, 'af_g1': 'relu', 'drop_p_g1': 0.0, 'n_hidden_layers_g2': 1, 'hidden_dims_g2': 48, 'af_g2': 'relu', 'drop_p_g2': 0.0, 'n_hidden_layers_h_net': 1, 'hidden_dims_h_net': 56, 'af_h_net': 'relu', 'drop_p_h_net': 0.0}. Best is trial 56 with value: 0.009113626554608345.
2025-07-29 12:01:15,262 - INFO - Trial 59 finished with value: 0.009263833984732628 and parameters: {'lr': 0.0007014158761822296, 'lamb': 0.0061, 'batch_size': 64, 'n_hidden_layers_g0': 2, 'hidden_dims_g0': 32, 'af_g0': 'softplus', 'drop_p_g0': 0.0, 'n_hidden_layers_g1': 2, 'hidden_dims_g1': 64, 'af_g1': 'relu', 'drop_p_g1': 0.0, 'n_hidden_layers_g2': 1, 'hidden_dims_g2': 56, 'af_g2': 'relu', 'drop_p_g2': 0.0, 'n_hidden_layers_h_net': 1, 'hidden_dims_h_net': 64, 'af_h_net': 'relu', 'drop_p_h_net': 0.0}. Best is trial 56 with value: 0.009113626554608345.
2025-07-29 12:03:46,407 - INFO - Trial 60 finished with value: 0.00915558822453022 and parameters: {'lr': 0.0008704994562826436, 'lamb': 0.0046, 'batch_size': 32, 'n_hidden_layers_g0': 1, 'hidden_dims_g0': 64, 'af_g0': 'softplus', 'drop_p_g0': 0.0, 'n_hidden_layers_g1': 2, 'hidden_dims_g1': 64, 'af_g1': 'relu', 'drop_p_g1': 0.0, 'n_hidden_layers_g2': 1, 'hidden_dims_g2': 48, 'af_g2': 'relu', 'drop_p_g2': 0.0, 'n_hidden_layers_h_net': 1, 'hidden_dims_h_net': 56, 'af_h_net': 'relu', 'drop_p_h_net': 0.0}. Best is trial 56 with value: 0.009113626554608345.
2025-07-29 12:10:13,709 - INFO - Trial 61 finished with value: 0.00911515112966299 and parameters: {'lr': 0.0006176247496849374, 'lamb': 0.0053, 'batch_size': 32, 'n_hidden_layers_g0': 1, 'hidden_dims_g0': 16, 'af_g0': 'softplus', 'drop_p_g0': 0.0, 'n_hidden_layers_g1': 2, 'hidden_dims_g1': 64, 'af_g1': 'relu', 'drop_p_g1': 0.0, 'n_hidden_layers_g2': 1, 'hidden_dims_g2': 56, 'af_g2': 'relu', 'drop_p_g2': 0.0, 'n_hidden_layers_h_net': 1, 'hidden_dims_h_net': 48, 'af_h_net': 'relu', 'drop_p_h_net': 0.0}. Best is trial 56 with value: 0.009113626554608345.
2025-07-29 12:14:10,461 - INFO - Trial 62 finished with value: 0.0091142188757658 and parameters: {'lr': 0.0011735920497761003, 'lamb': 0.0056, 'batch_size': 32, 'n_hidden_layers_g0': 1, 'hidden_dims_g0': 24, 'af_g0': 'softplus', 'drop_p_g0': 0.0, 'n_hidden_layers_g1': 2, 'hidden_dims_g1': 64, 'af_g1': 'relu', 'drop_p_g1': 0.0, 'n_hidden_layers_g2': 1, 'hidden_dims_g2': 56, 'af_g2': 'relu', 'drop_p_g2': 0.0, 'n_hidden_layers_h_net': 1, 'hidden_dims_h_net': 56, 'af_h_net': 'relu', 'drop_p_h_net': 0.0}. Best is trial 56 with value: 0.009113626554608345.
2025-07-29 12:21:30,714 - INFO - Trial 63 finished with value: 0.009114145301282406 and parameters: {'lr': 0.0005546018729659919, 'lamb': 0.007, 'batch_size': 32, 'n_hidden_layers_g0': 1, 'hidden_dims_g0': 16, 'af_g0': 'relu', 'drop_p_g0': 0.0, 'n_hidden_layers_g1': 2, 'hidden_dims_g1': 64, 'af_g1': 'relu', 'drop_p_g1': 0.0, 'n_hidden_layers_g2': 1, 'hidden_dims_g2': 56, 'af_g2': 'relu', 'drop_p_g2': 0.0, 'n_hidden_layers_h_net': 1, 'hidden_dims_h_net': 48, 'af_h_net': 'relu', 'drop_p_h_net': 0.0}. Best is trial 56 with value: 0.009113626554608345.
2025-07-29 12:30:14,172 - INFO - Trial 64 finished with value: 0.009114162065088749 and parameters: {'lr': 0.0006418638928011313, 'lamb': 0.0063, 'batch_size': 32, 'n_hidden_layers_g0': 1, 'hidden_dims_g0': 24, 'af_g0': 'relu', 'drop_p_g0': 0.0, 'n_hidden_layers_g1': 2, 'hidden_dims_g1': 64, 'af_g1': 'relu', 'drop_p_g1': 0.0, 'n_hidden_layers_g2': 1, 'hidden_dims_g2': 48, 'af_g2': 'relu', 'drop_p_g2': 0.0, 'n_hidden_layers_h_net': 1, 'hidden_dims_h_net': 40, 'af_h_net': 'relu', 'drop_p_h_net': 0.0}. Best is trial 56 with value: 0.009113626554608345.
2025-07-29 12:33:19,611 - INFO - Trial 65 finished with value: 0.009113669395446777 and parameters: {'lr': 0.0008543995621556846, 'lamb': 0.0054, 'batch_size': 32, 'n_hidden_layers_g0': 1, 'hidden_dims_g0': 32, 'af_g0': 'relu', 'drop_p_g0': 0.0, 'n_hidden_layers_g1': 2, 'hidden_dims_g1': 32, 'af_g1': 'relu', 'drop_p_g1': 0.0, 'n_hidden_layers_g2': 1, 'hidden_dims_g2': 64, 'af_g2': 'relu', 'drop_p_g2': 0.0, 'n_hidden_layers_h_net': 1, 'hidden_dims_h_net': 56, 'af_h_net': 'relu', 'drop_p_h_net': 0.0}. Best is trial 56 with value: 0.009113626554608345.
2025-07-29 12:41:13,998 - INFO - Trial 66 finished with value: 0.009114554151892662 and parameters: {'lr': 0.03767540170308656, 'lamb': 0.0074, 'batch_size': 32, 'n_hidden_layers_g0': 2, 'hidden_dims_g0': 40, 'af_g0': 'softplus', 'drop_p_g0': 0.0, 'n_hidden_layers_g1': 2, 'hidden_dims_g1': 32, 'af_g1': 'softplus', 'drop_p_g1': 0.0, 'n_hidden_layers_g2': 1, 'hidden_dims_g2': 64, 'af_g2': 'relu', 'drop_p_g2': 0.0, 'n_hidden_layers_h_net': 1, 'hidden_dims_h_net': 64, 'af_h_net': 'tanh', 'drop_p_h_net': 0.0}. Best is trial 56 with value: 0.009113626554608345.
2025-07-29 12:48:41,477 - INFO - Trial 67 finished with value: 0.009115505963563919 and parameters: {'lr': 0.001295657575807376, 'lamb': 0.004200000000000001, 'batch_size': 16, 'n_hidden_layers_g0': 1, 'hidden_dims_g0': 32, 'af_g0': 'relu', 'drop_p_g0': 0.0, 'n_hidden_layers_g1': 2, 'hidden_dims_g1': 24, 'af_g1': 'relu', 'drop_p_g1': 0.0, 'n_hidden_layers_g2': 1, 'hidden_dims_g2': 64, 'af_g2': 'softplus', 'drop_p_g2': 0.0, 'n_hidden_layers_h_net': 1, 'hidden_dims_h_net': 56, 'af_h_net': 'relu', 'drop_p_h_net': 0.0}. Best is trial 56 with value: 0.009113626554608345.
2025-07-29 12:57:28,182 - INFO - Trial 68 finished with value: 0.009113523177802563 and parameters: {'lr': 0.0008038213121539933, 'lamb': 0.0057, 'batch_size': 32, 'n_hidden_layers_g0': 1, 'hidden_dims_g0': 32, 'af_g0': 'tanh', 'drop_p_g0': 0.0, 'n_hidden_layers_g1': 2, 'hidden_dims_g1': 32, 'af_g1': 'relu', 'drop_p_g1': 0.0, 'n_hidden_layers_g2': 1, 'hidden_dims_g2': 64, 'af_g2': 'relu', 'drop_p_g2': 0.0, 'n_hidden_layers_h_net': 1, 'hidden_dims_h_net': 64, 'af_h_net': 'relu', 'drop_p_h_net': 0.0}. Best is trial 68 with value: 0.009113523177802563.
2025-07-29 13:02:50,632 - INFO - Trial 69 finished with value: 0.00911465473473072 and parameters: {'lr': 0.0008066028034372589, 'lamb': 0.0079, 'batch_size': 32, 'n_hidden_layers_g0': 2, 'hidden_dims_g0': 40, 'af_g0': 'tanh', 'drop_p_g0': 0.0, 'n_hidden_layers_g1': 2, 'hidden_dims_g1': 32, 'af_g1': 'softplus', 'drop_p_g1': 0.0, 'n_hidden_layers_g2': 1, 'hidden_dims_g2': 64, 'af_g2': 'relu', 'drop_p_g2': 0.0, 'n_hidden_layers_h_net': 1, 'hidden_dims_h_net': 64, 'af_h_net': 'relu', 'drop_p_h_net': 0.0}. Best is trial 68 with value: 0.009113523177802563.
