2025-07-29 12:48:23,692 - INFO - Trial 39 finished with value: 2.2266268730163574 and parameters: {'lr': 0.0013909364390647572, 'lamb': 0.0082, 'batch_size': 16, 'n_hidden_layers_g0': 2, 'hidden_dims_g0': 8, 'af_g0': 'relu', 'drop_p_g0': 0.0, 'n_hidden_layers_g1': 2, 'hidden_dims_g1': 56, 'af_g1': 'softplus', 'drop_p_g1': 0.0, 'n_hidden_layers_g2': 1, 'hidden_dims_g2': 64, 'af_g2': 'relu', 'drop_p_g2': 0.0, 'n_hidden_layers_h_net': 1, 'hidden_dims_h_net': 24, 'af_h_net': 'softplus', 'drop_p_h_net': 0.0}. Best is trial 30 with value: 2.2262420654296875.
2025-07-29 13:07:39,296 - INFO - Trial 40 finished with value: 2.226652145385742 and parameters: {'lr': 0.0007159505676357931, 'lamb': 0.009300000000000001, 'batch_size': 16, 'n_hidden_layers_g0': 2, 'hidden_dims_g0': 24, 'af_g0': 'relu', 'drop_p_g0': 0.0, 'n_hidden_layers_g1': 2, 'hidden_dims_g1': 48, 'af_g1': 'tanh', 'drop_p_g1': 0.0, 'n_hidden_layers_g2': 1, 'hidden_dims_g2': 56, 'af_g2': 'relu', 'drop_p_g2': 0.0, 'n_hidden_layers_h_net': 1, 'hidden_dims_h_net': 16, 'af_h_net': 'tanh', 'drop_p_h_net': 0.0}. Best is trial 30 with value: 2.2262420654296875.
2025-07-29 13:26:15,946 - INFO - Trial 41 finished with value: 2.2264645099639893 and parameters: {'lr': 0.0010975168602003255, 'lamb': 0.008400000000000001, 'batch_size': 16, 'n_hidden_layers_g0': 2, 'hidden_dims_g0': 32, 'af_g0': 'relu', 'drop_p_g0': 0.0, 'n_hidden_layers_g1': 2, 'hidden_dims_g1': 40, 'af_g1': 'softplus', 'drop_p_g1': 0.0, 'n_hidden_layers_g2': 1, 'hidden_dims_g2': 40, 'af_g2': 'relu', 'drop_p_g2': 0.0, 'n_hidden_layers_h_net': 1, 'hidden_dims_h_net': 40, 'af_h_net': 'tanh', 'drop_p_h_net': 0.0}. Best is trial 30 with value: 2.2262420654296875.
2025-07-29 13:43:06,242 - INFO - Trial 42 finished with value: 2.2264020442962646 and parameters: {'lr': 0.0010924978750872108, 'lamb': 0.0073, 'batch_size': 16, 'n_hidden_layers_g0': 2, 'hidden_dims_g0': 32, 'af_g0': 'relu', 'drop_p_g0': 0.0, 'n_hidden_layers_g1': 2, 'hidden_dims_g1': 48, 'af_g1': 'softplus', 'drop_p_g1': 0.0, 'n_hidden_layers_g2': 1, 'hidden_dims_g2': 40, 'af_g2': 'relu', 'drop_p_g2': 0.0, 'n_hidden_layers_h_net': 1, 'hidden_dims_h_net': 40, 'af_h_net': 'tanh', 'drop_p_h_net': 0.0}. Best is trial 30 with value: 2.2262420654296875.
2025-07-29 14:02:41,151 - INFO - Trial 43 finished with value: 2.2266218662261963 and parameters: {'lr': 0.001243830142430404, 'lamb': 0.007200000000000001, 'batch_size': 16, 'n_hidden_layers_g0': 2, 'hidden_dims_g0': 40, 'af_g0': 'relu', 'drop_p_g0': 0.0, 'n_hidden_layers_g1': 2, 'hidden_dims_g1': 48, 'af_g1': 'softplus', 'drop_p_g1': 0.0, 'n_hidden_layers_g2': 1, 'hidden_dims_g2': 48, 'af_g2': 'relu', 'drop_p_g2': 0.0, 'n_hidden_layers_h_net': 1, 'hidden_dims_h_net': 40, 'af_h_net': 'tanh', 'drop_p_h_net': 0.0}. Best is trial 30 with value: 2.2262420654296875.
2025-07-29 14:18:22,303 - INFO - Trial 44 finished with value: 2.2265634536743164 and parameters: {'lr': 0.001681052655127393, 'lamb': 0.0078000000000000005, 'batch_size': 16, 'n_hidden_layers_g0': 2, 'hidden_dims_g0': 32, 'af_g0': 'relu', 'drop_p_g0': 0.0, 'n_hidden_layers_g1': 2, 'hidden_dims_g1': 48, 'af_g1': 'softplus', 'drop_p_g1': 0.0, 'n_hidden_layers_g2': 1, 'hidden_dims_g2': 40, 'af_g2': 'relu', 'drop_p_g2': 0.0, 'n_hidden_layers_h_net': 1, 'hidden_dims_h_net': 32, 'af_h_net': 'tanh', 'drop_p_h_net': 0.0}. Best is trial 30 with value: 2.2262420654296875.
2025-07-29 14:34:31,362 - INFO - Trial 45 finished with value: 2.2315006256103516 and parameters: {'lr': 0.0007461638172083794, 'lamb': 0.0068000000000000005, 'batch_size': 16, 'n_hidden_layers_g0': 2, 'hidden_dims_g0': 8, 'af_g0': 'relu', 'drop_p_g0': 0.0, 'n_hidden_layers_g1': 2, 'hidden_dims_g1': 56, 'af_g1': 'softplus', 'drop_p_g1': 0.0, 'n_hidden_layers_g2': 1, 'hidden_dims_g2': 48, 'af_g2': 'relu', 'drop_p_g2': 0.0, 'n_hidden_layers_h_net': 1, 'hidden_dims_h_net': 48, 'af_h_net': 'tanh', 'drop_p_h_net': 0.0}. Best is trial 30 with value: 2.2262420654296875.
2025-07-29 14:54:26,531 - INFO - Trial 46 finished with value: 2.229417085647583 and parameters: {'lr': 0.0009655731918184712, 'lamb': 0.009000000000000001, 'batch_size': 16, 'n_hidden_layers_g0': 2, 'hidden_dims_g0': 16, 'af_g0': 'softplus', 'drop_p_g0': 0.0, 'n_hidden_layers_g1': 2, 'hidden_dims_g1': 48, 'af_g1': 'relu', 'drop_p_g1': 0.0, 'n_hidden_layers_g2': 1, 'hidden_dims_g2': 56, 'af_g2': 'relu', 'drop_p_g2': 0.0, 'n_hidden_layers_h_net': 2, 'hidden_dims_h_net': 32, 'af_h_net': 'relu', 'drop_p_h_net': 0.0}. Best is trial 30 with value: 2.2262420654296875.
2025-07-29 15:02:33,911 - INFO - Trial 47 finished with value: 2.227797031402588 and parameters: {'lr': 0.0022476372948503705, 'lamb': 0.009600000000000001, 'batch_size': 32, 'n_hidden_layers_g0': 2, 'hidden_dims_g0': 40, 'af_g0': 'relu', 'drop_p_g0': 0.0, 'n_hidden_layers_g1': 2, 'hidden_dims_g1': 56, 'af_g1': 'softplus', 'drop_p_g1': 0.0, 'n_hidden_layers_g2': 1, 'hidden_dims_g2': 48, 'af_g2': 'relu', 'drop_p_g2': 0.0, 'n_hidden_layers_h_net': 1, 'hidden_dims_h_net': 40, 'af_h_net': 'tanh', 'drop_p_h_net': 0.0}. Best is trial 30 with value: 2.2262420654296875.
2025-07-29 15:11:50,265 - INFO - Trial 48 finished with value: 2.2279391288757324 and parameters: {'lr': 0.0015647533539025005, 'lamb': 0.0077, 'batch_size': 16, 'n_hidden_layers_g0': 2, 'hidden_dims_g0': 32, 'af_g0': 'relu', 'drop_p_g0': 0.0, 'n_hidden_layers_g1': 2, 'hidden_dims_g1': 32, 'af_g1': 'softplus', 'drop_p_g1': 0.0, 'n_hidden_layers_g2': 1, 'hidden_dims_g2': 64, 'af_g2': 'softplus', 'drop_p_g2': 0.0, 'n_hidden_layers_h_net': 2, 'hidden_dims_h_net': 24, 'af_h_net': 'relu', 'drop_p_h_net': 0.0}. Best is trial 30 with value: 2.2262420654296875.
2025-07-29 15:19:13,930 - INFO - Trial 49 finished with value: 2.2287509441375732 and parameters: {'lr': 0.003079454910208333, 'lamb': 0.0064, 'batch_size': 32, 'n_hidden_layers_g0': 2, 'hidden_dims_g0': 48, 'af_g0': 'tanh', 'drop_p_g0': 0.0, 'n_hidden_layers_g1': 2, 'hidden_dims_g1': 48, 'af_g1': 'tanh', 'drop_p_g1': 0.0, 'n_hidden_layers_g2': 2, 'hidden_dims_g2': 40, 'af_g2': 'relu', 'drop_p_g2': 0.0, 'n_hidden_layers_h_net': 1, 'hidden_dims_h_net': 48, 'af_h_net': 'tanh', 'drop_p_h_net': 0.0}. Best is trial 30 with value: 2.2262420654296875.
2025-07-29 15:37:02,371 - INFO - Trial 50 finished with value: 2.227555751800537 and parameters: {'lr': 0.0006280091427102957, 'lamb': 0.008700000000000001, 'batch_size': 16, 'n_hidden_layers_g0': 2, 'hidden_dims_g0': 24, 'af_g0': 'relu', 'drop_p_g0': 0.0, 'n_hidden_layers_g1': 2, 'hidden_dims_g1': 24, 'af_g1': 'relu', 'drop_p_g1': 0.0, 'n_hidden_layers_g2': 2, 'hidden_dims_g2': 48, 'af_g2': 'relu', 'drop_p_g2': 0.0, 'n_hidden_layers_h_net': 2, 'hidden_dims_h_net': 40, 'af_h_net': 'tanh', 'drop_p_h_net': 0.0}. Best is trial 30 with value: 2.2262420654296875.
2025-07-29 15:52:35,236 - INFO - Trial 51 finished with value: 2.2264201641082764 and parameters: {'lr': 0.0010998718258028023, 'lamb': 0.0082, 'batch_size': 16, 'n_hidden_layers_g0': 2, 'hidden_dims_g0': 32, 'af_g0': 'relu', 'drop_p_g0': 0.0, 'n_hidden_layers_g1': 2, 'hidden_dims_g1': 40, 'af_g1': 'softplus', 'drop_p_g1': 0.0, 'n_hidden_layers_g2': 1, 'hidden_dims_g2': 40, 'af_g2': 'relu', 'drop_p_g2': 0.0, 'n_hidden_layers_h_net': 1, 'hidden_dims_h_net': 40, 'af_h_net': 'tanh', 'drop_p_h_net': 0.0}. Best is trial 30 with value: 2.2262420654296875.
2025-07-29 16:05:31,600 - INFO - Trial 52 finished with value: 2.227315664291382 and parameters: {'lr': 0.0011956644650178753, 'lamb': 0.009600000000000001, 'batch_size': 16, 'n_hidden_layers_g0': 2, 'hidden_dims_g0': 40, 'af_g0': 'relu', 'drop_p_g0': 0.0, 'n_hidden_layers_g1': 2, 'hidden_dims_g1': 40, 'af_g1': 'softplus', 'drop_p_g1': 0.0, 'n_hidden_layers_g2': 1, 'hidden_dims_g2': 40, 'af_g2': 'relu', 'drop_p_g2': 0.0, 'n_hidden_layers_h_net': 1, 'hidden_dims_h_net': 32, 'af_h_net': 'tanh', 'drop_p_h_net': 0.0}. Best is trial 30 with value: 2.2262420654296875.
2025-07-29 16:21:30,325 - INFO - Trial 53 finished with value: 2.226287841796875 and parameters: {'lr': 0.0009254901947492651, 'lamb': 0.0079, 'batch_size': 16, 'n_hidden_layers_g0': 2, 'hidden_dims_g0': 32, 'af_g0': 'relu', 'drop_p_g0': 0.0, 'n_hidden_layers_g1': 2, 'hidden_dims_g1': 40, 'af_g1': 'softplus', 'drop_p_g1': 0.0, 'n_hidden_layers_g2': 1, 'hidden_dims_g2': 48, 'af_g2': 'relu', 'drop_p_g2': 0.0, 'n_hidden_layers_h_net': 1, 'hidden_dims_h_net': 40, 'af_h_net': 'tanh', 'drop_p_h_net': 0.0}. Best is trial 30 with value: 2.2262420654296875.
2025-07-29 16:37:28,829 - INFO - Trial 54 finished with value: 2.226553201675415 and parameters: {'lr': 0.0008607795356359384, 'lamb': 0.007200000000000001, 'batch_size': 16, 'n_hidden_layers_g0': 2, 'hidden_dims_g0': 24, 'af_g0': 'relu', 'drop_p_g0': 0.0, 'n_hidden_layers_g1': 2, 'hidden_dims_g1': 48, 'af_g1': 'softplus', 'drop_p_g1': 0.0, 'n_hidden_layers_g2': 1, 'hidden_dims_g2': 48, 'af_g2': 'relu', 'drop_p_g2': 0.0, 'n_hidden_layers_h_net': 1, 'hidden_dims_h_net': 48, 'af_h_net': 'tanh', 'drop_p_h_net': 0.0}. Best is trial 30 with value: 2.2262420654296875.
2025-07-29 16:46:46,133 - INFO - Trial 55 finished with value: 2.2273318767547607 and parameters: {'lr': 0.000538387380776393, 'lamb': 0.006, 'batch_size': 32, 'n_hidden_layers_g0': 2, 'hidden_dims_g0': 48, 'af_g0': 'relu', 'drop_p_g0': 0.0, 'n_hidden_layers_g1': 2, 'hidden_dims_g1': 32, 'af_g1': 'softplus', 'drop_p_g1': 0.0, 'n_hidden_layers_g2': 1, 'hidden_dims_g2': 56, 'af_g2': 'relu', 'drop_p_g2': 0.0, 'n_hidden_layers_h_net': 1, 'hidden_dims_h_net': 40, 'af_h_net': 'tanh', 'drop_p_h_net': 0.0}. Best is trial 30 with value: 2.2262420654296875.
2025-07-29 16:57:38,733 - INFO - Trial 56 finished with value: 2.2316534519195557 and parameters: {'lr': 0.0009232621725077414, 'lamb': 0.01, 'batch_size': 16, 'n_hidden_layers_g0': 2, 'hidden_dims_g0': 32, 'af_g0': 'softplus', 'drop_p_g0': 0.0, 'n_hidden_layers_g1': 2, 'hidden_dims_g1': 40, 'af_g1': 'softplus', 'drop_p_g1': 0.0, 'n_hidden_layers_g2': 1, 'hidden_dims_g2': 48, 'af_g2': 'softplus', 'drop_p_g2': 0.0, 'n_hidden_layers_h_net': 1, 'hidden_dims_h_net': 32, 'af_h_net': 'softplus', 'drop_p_h_net': 0.0}. Best is trial 30 with value: 2.2262420654296875.
2025-07-29 17:08:31,490 - INFO - Trial 57 finished with value: 2.2262840270996094 and parameters: {'lr': 0.0018617389469866615, 'lamb': 0.0056, 'batch_size': 16, 'n_hidden_layers_g0': 2, 'hidden_dims_g0': 32, 'af_g0': 'relu', 'drop_p_g0': 0.0, 'n_hidden_layers_g1': 2, 'hidden_dims_g1': 16, 'af_g1': 'softplus', 'drop_p_g1': 0.0, 'n_hidden_layers_g2': 2, 'hidden_dims_g2': 56, 'af_g2': 'relu', 'drop_p_g2': 0.0, 'n_hidden_layers_h_net': 1, 'hidden_dims_h_net': 40, 'af_h_net': 'relu', 'drop_p_h_net': 0.0}. Best is trial 30 with value: 2.2262420654296875.
2025-07-29 17:18:47,417 - INFO - Trial 58 finished with value: 2.2261829376220703 and parameters: {'lr': 0.0013529016322133959, 'lamb': 0.0057, 'batch_size': 32, 'n_hidden_layers_g0': 2, 'hidden_dims_g0': 40, 'af_g0': 'relu', 'drop_p_g0': 0.0, 'n_hidden_layers_g1': 2, 'hidden_dims_g1': 24, 'af_g1': 'softplus', 'drop_p_g1': 0.0, 'n_hidden_layers_g2': 2, 'hidden_dims_g2': 64, 'af_g2': 'relu', 'drop_p_g2': 0.0, 'n_hidden_layers_h_net': 2, 'hidden_dims_h_net': 24, 'af_h_net': 'relu', 'drop_p_h_net': 0.0}. Best is trial 58 with value: 2.2261829376220703.
2025-07-29 17:35:31,642 - INFO - Trial 59 finished with value: 2.2265381813049316 and parameters: {'lr': 0.000636707388069411, 'lamb': 0.0046, 'batch_size': 16, 'n_hidden_layers_g0': 2, 'hidden_dims_g0': 40, 'af_g0': 'relu', 'drop_p_g0': 0.0, 'n_hidden_layers_g1': 2, 'hidden_dims_g1': 16, 'af_g1': 'relu', 'drop_p_g1': 0.0, 'n_hidden_layers_g2': 2, 'hidden_dims_g2': 64, 'af_g2': 'relu', 'drop_p_g2': 0.0, 'n_hidden_layers_h_net': 1, 'hidden_dims_h_net': 24, 'af_h_net': 'relu', 'drop_p_h_net': 0.0}. Best is trial 58 with value: 2.2261829376220703.
2025-07-29 17:44:38,253 - INFO - Trial 60 finished with value: 2.2266342639923096 and parameters: {'lr': 0.0018994539696006983, 'lamb': 0.0039000000000000003, 'batch_size': 32, 'n_hidden_layers_g0': 2, 'hidden_dims_g0': 24, 'af_g0': 'relu', 'drop_p_g0': 0.0, 'n_hidden_layers_g1': 2, 'hidden_dims_g1': 8, 'af_g1': 'softplus', 'drop_p_g1': 0.0, 'n_hidden_layers_g2': 2, 'hidden_dims_g2': 56, 'af_g2': 'relu', 'drop_p_g2': 0.0, 'n_hidden_layers_h_net': 2, 'hidden_dims_h_net': 16, 'af_h_net': 'relu', 'drop_p_h_net': 0.0}. Best is trial 58 with value: 2.2261829376220703.
2025-07-29 17:54:57,662 - INFO - Trial 61 finished with value: 2.226592540740967 and parameters: {'lr': 0.001426509136737967, 'lamb': 0.0047, 'batch_size': 32, 'n_hidden_layers_g0': 2, 'hidden_dims_g0': 40, 'af_g0': 'relu', 'drop_p_g0': 0.0, 'n_hidden_layers_g1': 2, 'hidden_dims_g1': 16, 'af_g1': 'softplus', 'drop_p_g1': 0.0, 'n_hidden_layers_g2': 2, 'hidden_dims_g2': 64, 'af_g2': 'relu', 'drop_p_g2': 0.0, 'n_hidden_layers_h_net': 2, 'hidden_dims_h_net': 32, 'af_h_net': 'relu', 'drop_p_h_net': 0.0}. Best is trial 58 with value: 2.2261829376220703.
2025-07-29 18:03:10,165 - INFO - Trial 62 finished with value: 2.229052782058716 and parameters: {'lr': 0.002149534593201665, 'lamb': 0.0056, 'batch_size': 32, 'n_hidden_layers_g0': 2, 'hidden_dims_g0': 40, 'af_g0': 'relu', 'drop_p_g0': 0.0, 'n_hidden_layers_g1': 2, 'hidden_dims_g1': 8, 'af_g1': 'softplus', 'drop_p_g1': 0.0, 'n_hidden_layers_g2': 2, 'hidden_dims_g2': 64, 'af_g2': 'relu', 'drop_p_g2': 0.0, 'n_hidden_layers_h_net': 2, 'hidden_dims_h_net': 32, 'af_h_net': 'relu', 'drop_p_h_net': 0.0}. Best is trial 58 with value: 2.2261829376220703.
2025-07-29 18:13:31,420 - INFO - Trial 63 finished with value: 2.2263073921203613 and parameters: {'lr': 0.0013178932776466827, 'lamb': 0.006500000000000001, 'batch_size': 32, 'n_hidden_layers_g0': 2, 'hidden_dims_g0': 32, 'af_g0': 'relu', 'drop_p_g0': 0.0, 'n_hidden_layers_g1': 2, 'hidden_dims_g1': 16, 'af_g1': 'softplus', 'drop_p_g1': 0.0, 'n_hidden_layers_g2': 2, 'hidden_dims_g2': 56, 'af_g2': 'relu', 'drop_p_g2': 0.0, 'n_hidden_layers_h_net': 2, 'hidden_dims_h_net': 48, 'af_h_net': 'relu', 'drop_p_h_net': 0.0}. Best is trial 58 with value: 2.2261829376220703.
2025-07-29 18:19:40,090 - INFO - Trial 64 finished with value: 2.227216958999634 and parameters: {'lr': 0.0017368266363636162, 'lamb': 0.0054, 'batch_size': 32, 'n_hidden_layers_g0': 2, 'hidden_dims_g0': 32, 'af_g0': 'relu', 'drop_p_g0': 0.0, 'n_hidden_layers_g1': 2, 'hidden_dims_g1': 16, 'af_g1': 'softplus', 'drop_p_g1': 0.0, 'n_hidden_layers_g2': 2, 'hidden_dims_g2': 56, 'af_g2': 'relu', 'drop_p_g2': 0.0, 'n_hidden_layers_h_net': 2, 'hidden_dims_h_net': 48, 'af_h_net': 'relu', 'drop_p_h_net': 0.0}. Best is trial 58 with value: 2.2261829376220703.
2025-07-29 18:30:02,243 - INFO - Trial 65 finished with value: 2.226468563079834 and parameters: {'lr': 0.0007936274392346956, 'lamb': 0.0064, 'batch_size': 32, 'n_hidden_layers_g0': 2, 'hidden_dims_g0': 32, 'af_g0': 'relu', 'drop_p_g0': 0.0, 'n_hidden_layers_g1': 2, 'hidden_dims_g1': 24, 'af_g1': 'softplus', 'drop_p_g1': 0.0, 'n_hidden_layers_g2': 2, 'hidden_dims_g2': 56, 'af_g2': 'relu', 'drop_p_g2': 0.0, 'n_hidden_layers_h_net': 2, 'hidden_dims_h_net': 48, 'af_h_net': 'relu', 'drop_p_h_net': 0.0}. Best is trial 58 with value: 2.2261829376220703.
2025-07-29 18:34:26,683 - INFO - Trial 66 finished with value: 2.2827882766723633 and parameters: {'lr': 0.04892983590891666, 'lamb': 0.0059, 'batch_size': 16, 'n_hidden_layers_g0': 2, 'hidden_dims_g0': 24, 'af_g0': 'relu', 'drop_p_g0': 0.0, 'n_hidden_layers_g1': 2, 'hidden_dims_g1': 16, 'af_g1': 'softplus', 'drop_p_g1': 0.0, 'n_hidden_layers_g2': 2, 'hidden_dims_g2': 56, 'af_g2': 'relu', 'drop_p_g2': 0.0, 'n_hidden_layers_h_net': 2, 'hidden_dims_h_net': 56, 'af_h_net': 'relu', 'drop_p_h_net': 0.0}. Best is trial 58 with value: 2.2261829376220703.
2025-07-29 18:43:51,679 - INFO - Trial 67 finished with value: 2.226199150085449 and parameters: {'lr': 0.0028495018836696916, 'lamb': 0.0057, 'batch_size': 32, 'n_hidden_layers_g0': 2, 'hidden_dims_g0': 32, 'af_g0': 'relu', 'drop_p_g0': 0.0, 'n_hidden_layers_g1': 2, 'hidden_dims_g1': 8, 'af_g1': 'tanh', 'drop_p_g1': 0.0, 'n_hidden_layers_g2': 2, 'hidden_dims_g2': 48, 'af_g2': 'softplus', 'drop_p_g2': 0.0, 'n_hidden_layers_h_net': 1, 'hidden_dims_h_net': 48, 'af_h_net': 'relu', 'drop_p_h_net': 0.0}. Best is trial 58 with value: 2.2261829376220703.
2025-07-29 18:48:22,118 - INFO - Trial 68 finished with value: 2.227105140686035 and parameters: {'lr': 0.0028946707668938425, 'lamb': 0.0057, 'batch_size': 32, 'n_hidden_layers_g0': 2, 'hidden_dims_g0': 32, 'af_g0': 'softplus', 'drop_p_g0': 0.0, 'n_hidden_layers_g1': 2, 'hidden_dims_g1': 8, 'af_g1': 'tanh', 'drop_p_g1': 0.0, 'n_hidden_layers_g2': 2, 'hidden_dims_g2': 56, 'af_g2': 'softplus', 'drop_p_g2': 0.0, 'n_hidden_layers_h_net': 1, 'hidden_dims_h_net': 48, 'af_h_net': 'relu', 'drop_p_h_net': 0.0}. Best is trial 58 with value: 2.2261829376220703.
2025-07-29 18:53:51,424 - INFO - Trial 69 finished with value: 2.2276103496551514 and parameters: {'lr': 0.004762024721456628, 'lamb': 0.0049, 'batch_size': 32, 'n_hidden_layers_g0': 2, 'hidden_dims_g0': 32, 'af_g0': 'tanh', 'drop_p_g0': 0.0, 'n_hidden_layers_g1': 2, 'hidden_dims_g1': 8, 'af_g1': 'tanh', 'drop_p_g1': 0.0, 'n_hidden_layers_g2': 2, 'hidden_dims_g2': 48, 'af_g2': 'softplus', 'drop_p_g2': 0.0, 'n_hidden_layers_h_net': 2, 'hidden_dims_h_net': 48, 'af_h_net': 'relu', 'drop_p_h_net': 0.0}. Best is trial 58 with value: 2.2261829376220703.
