2025-07-08 05:38:22,449 - INFO - A new study created in Journal with name: model-biochemical-mpnn-biochemical_mpnn_ic1_s5_pd_mult_noise_20db_2
2025-07-08 05:41:34,211 - INFO - Trial 0 finished with value: 93.0451889038086 and parameters: {'lr': 0.0028057582076672534, 'lamb': 0.0, 'batch_size': 16, 'n_hidden_layers_g_net': 1, 'hidden_dims_g_net': 16, 'af_g_net': 'softplus', 'drop_p_g_net': 0.04160439645256607, 'n_hidden_layers_h_net': 1, 'hidden_dims_h_net': 64, 'af_h_net': 'relu', 'drop_p_h_net': 0.00047687854154826123}. Best is trial 0 with value: 93.0451889038086.
2025-07-08 05:45:06,538 - INFO - Trial 1 finished with value: 93.04535675048828 and parameters: {'lr': 0.0020298058052421537, 'lamb': 0.0, 'batch_size': 16, 'n_hidden_layers_g_net': 2, 'hidden_dims_g_net': 16, 'af_g_net': 'tanh', 'drop_p_g_net': 0.08023102291340051, 'n_hidden_layers_h_net': 1, 'hidden_dims_h_net': 40, 'af_h_net': 'tanh', 'drop_p_h_net': 0.00042733023193754026}. Best is trial 0 with value: 93.0451889038086.
2025-07-08 05:47:41,475 - INFO - Trial 2 finished with value: 93.04536437988281 and parameters: {'lr': 0.0006746417134006625, 'lamb': 0.0, 'batch_size': 32, 'n_hidden_layers_g_net': 1, 'hidden_dims_g_net': 8, 'af_g_net': 'relu', 'drop_p_g_net': 0.006786479434196538, 'n_hidden_layers_h_net': 1, 'hidden_dims_h_net': 64, 'af_h_net': 'softplus', 'drop_p_h_net': 0.008389112347840602}. Best is trial 0 with value: 93.0451889038086.
2025-07-08 05:51:05,707 - INFO - Trial 3 finished with value: 93.0452651977539 and parameters: {'lr': 0.00619998391842305, 'lamb': 0.0, 'batch_size': 32, 'n_hidden_layers_g_net': 2, 'hidden_dims_g_net': 64, 'af_g_net': 'softplus', 'drop_p_g_net': 0.0005308046630775948, 'n_hidden_layers_h_net': 1, 'hidden_dims_h_net': 24, 'af_h_net': 'tanh', 'drop_p_h_net': 0.0020874681332882297}. Best is trial 0 with value: 93.0451889038086.
2025-07-08 05:52:53,668 - INFO - Trial 4 finished with value: 93.04542541503906 and parameters: {'lr': 0.00182321977949036, 'lamb': 0.0, 'batch_size': 64, 'n_hidden_layers_g_net': 1, 'hidden_dims_g_net': 64, 'af_g_net': 'relu', 'drop_p_g_net': 0.10384064176934515, 'n_hidden_layers_h_net': 2, 'hidden_dims_h_net': 48, 'af_h_net': 'relu', 'drop_p_h_net': 0.0002682848665467024}. Best is trial 0 with value: 93.0451889038086.
2025-07-08 05:56:00,142 - INFO - Trial 5 finished with value: 93.04437255859375 and parameters: {'lr': 0.0266180879737575, 'lamb': 0.0, 'batch_size': 16, 'n_hidden_layers_g_net': 1, 'hidden_dims_g_net': 24, 'af_g_net': 'tanh', 'drop_p_g_net': 0.005580959150991872, 'n_hidden_layers_h_net': 1, 'hidden_dims_h_net': 48, 'af_h_net': 'tanh', 'drop_p_h_net': 0.006707104906311699}. Best is trial 5 with value: 93.04437255859375.
2025-07-08 06:00:24,690 - INFO - Trial 6 finished with value: 93.0449447631836 and parameters: {'lr': 0.005551823656527309, 'lamb': 0.0, 'batch_size': 16, 'n_hidden_layers_g_net': 1, 'hidden_dims_g_net': 48, 'af_g_net': 'tanh', 'drop_p_g_net': 0.000835842553963096, 'n_hidden_layers_h_net': 1, 'hidden_dims_h_net': 56, 'af_h_net': 'tanh', 'drop_p_h_net': 0.0003947777846526165}. Best is trial 5 with value: 93.04437255859375.
2025-07-08 06:06:15,415 - INFO - Trial 7 finished with value: 93.04457092285156 and parameters: {'lr': 0.03617139922832709, 'lamb': 0.0, 'batch_size': 64, 'n_hidden_layers_g_net': 2, 'hidden_dims_g_net': 16, 'af_g_net': 'relu', 'drop_p_g_net': 0.2063549255101069, 'n_hidden_layers_h_net': 1, 'hidden_dims_h_net': 8, 'af_h_net': 'tanh', 'drop_p_h_net': 0.15269211449098366}. Best is trial 5 with value: 93.04437255859375.
2025-07-08 06:10:46,723 - INFO - Trial 8 finished with value: 93.04558563232422 and parameters: {'lr': 0.000516266880824102, 'lamb': 0.0, 'batch_size': 16, 'n_hidden_layers_g_net': 1, 'hidden_dims_g_net': 24, 'af_g_net': 'relu', 'drop_p_g_net': 0.039851625590699845, 'n_hidden_layers_h_net': 1, 'hidden_dims_h_net': 64, 'af_h_net': 'relu', 'drop_p_h_net': 0.0012969996024538206}. Best is trial 5 with value: 93.04437255859375.
2025-07-08 06:13:08,250 - INFO - Trial 9 finished with value: 93.04537963867188 and parameters: {'lr': 0.0018563120895202664, 'lamb': 0.0, 'batch_size': 32, 'n_hidden_layers_g_net': 1, 'hidden_dims_g_net': 24, 'af_g_net': 'relu', 'drop_p_g_net': 0.006463549495216589, 'n_hidden_layers_h_net': 2, 'hidden_dims_h_net': 16, 'af_h_net': 'softplus', 'drop_p_h_net': 0.04939129693562082}. Best is trial 5 with value: 93.04437255859375.
2025-07-08 06:18:49,548 - INFO - Trial 10 finished with value: 93.0427017211914 and parameters: {'lr': 0.04534706074852345, 'lamb': 0.0, 'batch_size': 16, 'n_hidden_layers_g_net': 2, 'hidden_dims_g_net': 40, 'af_g_net': 'tanh', 'drop_p_g_net': 0.00013907316971166145, 'n_hidden_layers_h_net': 2, 'hidden_dims_h_net': 32, 'af_h_net': 'tanh', 'drop_p_h_net': 0.011443720802363319}. Best is trial 10 with value: 93.0427017211914.
2025-07-08 06:25:03,197 - INFO - Trial 11 finished with value: 93.04096221923828 and parameters: {'lr': 0.049026759779091815, 'lamb': 0.0, 'batch_size': 16, 'n_hidden_layers_g_net': 2, 'hidden_dims_g_net': 40, 'af_g_net': 'tanh', 'drop_p_g_net': 0.00011764107629041922, 'n_hidden_layers_h_net': 2, 'hidden_dims_h_net': 32, 'af_h_net': 'tanh', 'drop_p_h_net': 0.015790383493737795}. Best is trial 11 with value: 93.04096221923828.
2025-07-08 06:33:35,671 - INFO - Trial 12 finished with value: 93.04306030273438 and parameters: {'lr': 0.017313141603997703, 'lamb': 0.0, 'batch_size': 16, 'n_hidden_layers_g_net': 2, 'hidden_dims_g_net': 40, 'af_g_net': 'tanh', 'drop_p_g_net': 0.00013311689559882708, 'n_hidden_layers_h_net': 2, 'hidden_dims_h_net': 32, 'af_h_net': 'tanh', 'drop_p_h_net': 0.027828224932197054}. Best is trial 11 with value: 93.04096221923828.
2025-07-08 06:39:57,357 - INFO - Trial 13 finished with value: 93.03968811035156 and parameters: {'lr': 0.04985341137518216, 'lamb': 0.0, 'batch_size': 16, 'n_hidden_layers_g_net': 2, 'hidden_dims_g_net': 48, 'af_g_net': 'tanh', 'drop_p_g_net': 0.00011778847733439695, 'n_hidden_layers_h_net': 2, 'hidden_dims_h_net': 32, 'af_h_net': 'tanh', 'drop_p_h_net': 0.48332244907036037}. Best is trial 13 with value: 93.03968811035156.
2025-07-08 06:43:27,575 - INFO - Trial 14 finished with value: 93.04463195800781 and parameters: {'lr': 0.01456143662271794, 'lamb': 0.0, 'batch_size': 64, 'n_hidden_layers_g_net': 2, 'hidden_dims_g_net': 48, 'af_g_net': 'tanh', 'drop_p_g_net': 0.0005548570903186639, 'n_hidden_layers_h_net': 2, 'hidden_dims_h_net': 24, 'af_h_net': 'tanh', 'drop_p_h_net': 0.3502135522507797}. Best is trial 13 with value: 93.03968811035156.
2025-07-08 06:55:11,252 - INFO - Trial 15 finished with value: 93.04227447509766 and parameters: {'lr': 0.011215899062802378, 'lamb': 0.0, 'batch_size': 16, 'n_hidden_layers_g_net': 2, 'hidden_dims_g_net': 56, 'af_g_net': 'tanh', 'drop_p_g_net': 0.0016320080828378088, 'n_hidden_layers_h_net': 2, 'hidden_dims_h_net': 24, 'af_h_net': 'softplus', 'drop_p_h_net': 0.07714844818127882}. Best is trial 13 with value: 93.03968811035156.
2025-07-08 07:03:52,168 - INFO - Trial 16 finished with value: 93.04450988769531 and parameters: {'lr': 0.048917284700411706, 'lamb': 0.0, 'batch_size': 16, 'n_hidden_layers_g_net': 2, 'hidden_dims_g_net': 32, 'af_g_net': 'softplus', 'drop_p_g_net': 0.0001223625774488578, 'n_hidden_layers_h_net': 2, 'hidden_dims_h_net': 40, 'af_h_net': 'tanh', 'drop_p_h_net': 0.31121236560469423}. Best is trial 13 with value: 93.03968811035156.
2025-07-08 07:10:43,350 - INFO - Trial 17 finished with value: 93.04130554199219 and parameters: {'lr': 0.030437054970906537, 'lamb': 0.0, 'batch_size': 16, 'n_hidden_layers_g_net': 2, 'hidden_dims_g_net': 48, 'af_g_net': 'tanh', 'drop_p_g_net': 0.0020865907816363747, 'n_hidden_layers_h_net': 2, 'hidden_dims_h_net': 8, 'af_h_net': 'tanh', 'drop_p_h_net': 0.022571075235079566}. Best is trial 13 with value: 93.03968811035156.
2025-07-08 07:12:52,963 - INFO - Trial 18 finished with value: 93.04444885253906 and parameters: {'lr': 0.008671250358417912, 'lamb': 0.0, 'batch_size': 64, 'n_hidden_layers_g_net': 2, 'hidden_dims_g_net': 56, 'af_g_net': 'tanh', 'drop_p_g_net': 0.00023208345816759003, 'n_hidden_layers_h_net': 2, 'hidden_dims_h_net': 32, 'af_h_net': 'relu', 'drop_p_h_net': 0.002977487518052043}. Best is trial 13 with value: 93.03968811035156.
2025-07-08 07:18:38,940 - INFO - Trial 19 finished with value: 93.04399871826172 and parameters: {'lr': 0.02163884393685489, 'lamb': 0.0, 'batch_size': 32, 'n_hidden_layers_g_net': 2, 'hidden_dims_g_net': 32, 'af_g_net': 'tanh', 'drop_p_g_net': 0.0002761910338392352, 'n_hidden_layers_h_net': 2, 'hidden_dims_h_net': 16, 'af_h_net': 'softplus', 'drop_p_h_net': 0.00010055536209946451}. Best is trial 13 with value: 93.03968811035156.
2025-07-08 07:27:39,973 - INFO - Trial 20 finished with value: 93.04456329345703 and parameters: {'lr': 0.023115559991606187, 'lamb': 0.0, 'batch_size': 16, 'n_hidden_layers_g_net': 2, 'hidden_dims_g_net': 40, 'af_g_net': 'softplus', 'drop_p_g_net': 0.0020648542842409004, 'n_hidden_layers_h_net': 2, 'hidden_dims_h_net': 48, 'af_h_net': 'tanh', 'drop_p_h_net': 0.13999613755353993}. Best is trial 13 with value: 93.03968811035156.
2025-07-08 07:35:03,850 - INFO - Trial 21 finished with value: 93.03964233398438 and parameters: {'lr': 0.03127730143997504, 'lamb': 0.0, 'batch_size': 16, 'n_hidden_layers_g_net': 2, 'hidden_dims_g_net': 48, 'af_g_net': 'tanh', 'drop_p_g_net': 0.0024522551965075003, 'n_hidden_layers_h_net': 2, 'hidden_dims_h_net': 8, 'af_h_net': 'tanh', 'drop_p_h_net': 0.029595264078046146}. Best is trial 21 with value: 93.03964233398438.
2025-07-08 07:43:02,914 - INFO - Trial 22 finished with value: 93.0408935546875 and parameters: {'lr': 0.04983758145702551, 'lamb': 0.0, 'batch_size': 16, 'n_hidden_layers_g_net': 2, 'hidden_dims_g_net': 56, 'af_g_net': 'tanh', 'drop_p_g_net': 0.022140888348653284, 'n_hidden_layers_h_net': 2, 'hidden_dims_h_net': 16, 'af_h_net': 'tanh', 'drop_p_h_net': 0.0389188910507898}. Best is trial 21 with value: 93.03964233398438.
2025-07-08 07:49:06,120 - INFO - Trial 23 finished with value: 93.03630065917969 and parameters: {'lr': 0.03239594107949997, 'lamb': 0.0, 'batch_size': 16, 'n_hidden_layers_g_net': 2, 'hidden_dims_g_net': 56, 'af_g_net': 'tanh', 'drop_p_g_net': 0.019032716547416312, 'n_hidden_layers_h_net': 2, 'hidden_dims_h_net': 16, 'af_h_net': 'tanh', 'drop_p_h_net': 0.0481305728376489}. Best is trial 23 with value: 93.03630065917969.
2025-07-08 07:57:25,374 - INFO - Trial 24 finished with value: 93.04004669189453 and parameters: {'lr': 0.01469763909843575, 'lamb': 0.0, 'batch_size': 16, 'n_hidden_layers_g_net': 2, 'hidden_dims_g_net': 56, 'af_g_net': 'tanh', 'drop_p_g_net': 0.015923434187178374, 'n_hidden_layers_h_net': 2, 'hidden_dims_h_net': 8, 'af_h_net': 'tanh', 'drop_p_h_net': 0.10619903014557297}. Best is trial 23 with value: 93.03630065917969.
2025-07-08 08:02:48,726 - INFO - Trial 25 finished with value: 93.04296875 and parameters: {'lr': 0.033397003048839385, 'lamb': 0.0, 'batch_size': 16, 'n_hidden_layers_g_net': 2, 'hidden_dims_g_net': 48, 'af_g_net': 'tanh', 'drop_p_g_net': 0.011889604544590293, 'n_hidden_layers_h_net': 2, 'hidden_dims_h_net': 16, 'af_h_net': 'tanh', 'drop_p_h_net': 0.23756829004372512}. Best is trial 23 with value: 93.03630065917969.
2025-07-08 08:06:26,916 - INFO - Trial 26 finished with value: 93.04466247558594 and parameters: {'lr': 0.009538104745487667, 'lamb': 0.0, 'batch_size': 16, 'n_hidden_layers_g_net': 2, 'hidden_dims_g_net': 64, 'af_g_net': 'tanh', 'drop_p_g_net': 0.0030199314454934754, 'n_hidden_layers_h_net': 2, 'hidden_dims_h_net': 8, 'af_h_net': 'tanh', 'drop_p_h_net': 0.42322607279456353}. Best is trial 23 with value: 93.03630065917969.
2025-07-08 08:18:22,766 - INFO - Trial 27 finished with value: 93.0411605834961 and parameters: {'lr': 0.020698779223769174, 'lamb': 0.0, 'batch_size': 16, 'n_hidden_layers_g_net': 2, 'hidden_dims_g_net': 48, 'af_g_net': 'tanh', 'drop_p_g_net': 0.36650225577329415, 'n_hidden_layers_h_net': 2, 'hidden_dims_h_net': 24, 'af_h_net': 'tanh', 'drop_p_h_net': 0.058001964427485196}. Best is trial 23 with value: 93.03630065917969.
2025-07-08 08:19:58,105 - INFO - Trial 28 finished with value: 93.04535675048828 and parameters: {'lr': 0.0035141528022968557, 'lamb': 0.0, 'batch_size': 64, 'n_hidden_layers_g_net': 2, 'hidden_dims_g_net': 56, 'af_g_net': 'softplus', 'drop_p_g_net': 0.0009291861731107881, 'n_hidden_layers_h_net': 2, 'hidden_dims_h_net': 16, 'af_h_net': 'relu', 'drop_p_h_net': 0.004629095097423876}. Best is trial 23 with value: 93.03630065917969.
2025-07-08 08:23:53,979 - INFO - Trial 29 finished with value: 93.03829193115234 and parameters: {'lr': 0.026628357254486274, 'lamb': 0.0, 'batch_size': 32, 'n_hidden_layers_g_net': 2, 'hidden_dims_g_net': 64, 'af_g_net': 'tanh', 'drop_p_g_net': 0.03995634190508487, 'n_hidden_layers_h_net': 2, 'hidden_dims_h_net': 8, 'af_h_net': 'softplus', 'drop_p_h_net': 0.01926393972358104}. Best is trial 23 with value: 93.03630065917969.
2025-07-08 08:25:23,006 - INFO - Trial 30 finished with value: 93.04492950439453 and parameters: {'lr': 0.012026092148041094, 'lamb': 0.0, 'batch_size': 32, 'n_hidden_layers_g_net': 2, 'hidden_dims_g_net': 64, 'af_g_net': 'softplus', 'drop_p_g_net': 0.03456118404703873, 'n_hidden_layers_h_net': 2, 'hidden_dims_h_net': 8, 'af_h_net': 'softplus', 'drop_p_h_net': 0.01875011110804492}. Best is trial 23 with value: 93.03630065917969.
2025-07-08 08:28:28,766 - INFO - Trial 31 finished with value: 93.03958892822266 and parameters: {'lr': 0.03445953389909105, 'lamb': 0.0, 'batch_size': 32, 'n_hidden_layers_g_net': 2, 'hidden_dims_g_net': 56, 'af_g_net': 'tanh', 'drop_p_g_net': 0.06741679766365678, 'n_hidden_layers_h_net': 2, 'hidden_dims_h_net': 8, 'af_h_net': 'softplus', 'drop_p_h_net': 0.027915979134888056}. Best is trial 23 with value: 93.03630065917969.
2025-07-08 08:31:24,291 - INFO - Trial 32 finished with value: 93.0400161743164 and parameters: {'lr': 0.03237142442801495, 'lamb': 0.0, 'batch_size': 32, 'n_hidden_layers_g_net': 2, 'hidden_dims_g_net': 56, 'af_g_net': 'tanh', 'drop_p_g_net': 0.08786582535229642, 'n_hidden_layers_h_net': 2, 'hidden_dims_h_net': 8, 'af_h_net': 'softplus', 'drop_p_h_net': 0.03579990890144312}. Best is trial 23 with value: 93.03630065917969.
2025-07-08 08:35:42,888 - INFO - Trial 33 finished with value: 93.04278564453125 and parameters: {'lr': 0.019529106841219834, 'lamb': 0.0, 'batch_size': 32, 'n_hidden_layers_g_net': 2, 'hidden_dims_g_net': 64, 'af_g_net': 'tanh', 'drop_p_g_net': 0.05466308405120231, 'n_hidden_layers_h_net': 2, 'hidden_dims_h_net': 16, 'af_h_net': 'softplus', 'drop_p_h_net': 0.012100540152692147}. Best is trial 23 with value: 93.03630065917969.
2025-07-08 08:37:46,914 - INFO - Trial 34 finished with value: 93.0434799194336 and parameters: {'lr': 0.026369911202643176, 'lamb': 0.0, 'batch_size': 32, 'n_hidden_layers_g_net': 2, 'hidden_dims_g_net': 56, 'af_g_net': 'tanh', 'drop_p_g_net': 0.1615215736412106, 'n_hidden_layers_h_net': 2, 'hidden_dims_h_net': 8, 'af_h_net': 'softplus', 'drop_p_h_net': 0.0068792737757067506}. Best is trial 23 with value: 93.03630065917969.
2025-07-08 08:40:37,145 - INFO - Trial 35 finished with value: 93.04317474365234 and parameters: {'lr': 0.034652326326893995, 'lamb': 0.0, 'batch_size': 32, 'n_hidden_layers_g_net': 2, 'hidden_dims_g_net': 64, 'af_g_net': 'tanh', 'drop_p_g_net': 0.02537689635941958, 'n_hidden_layers_h_net': 2, 'hidden_dims_h_net': 16, 'af_h_net': 'softplus', 'drop_p_h_net': 0.02418768890380133}. Best is trial 23 with value: 93.03630065917969.
2025-07-08 08:42:10,362 - INFO - Trial 36 finished with value: 93.04519653320312 and parameters: {'lr': 0.007926669366535619, 'lamb': 0.0, 'batch_size': 32, 'n_hidden_layers_g_net': 2, 'hidden_dims_g_net': 64, 'af_g_net': 'relu', 'drop_p_g_net': 0.0101225135595298, 'n_hidden_layers_h_net': 2, 'hidden_dims_h_net': 8, 'af_h_net': 'softplus', 'drop_p_h_net': 0.07912012363175192}. Best is trial 23 with value: 93.03630065917969.
2025-07-08 08:43:28,507 - INFO - Trial 37 finished with value: 93.0450439453125 and parameters: {'lr': 0.00420533877771186, 'lamb': 0.0, 'batch_size': 32, 'n_hidden_layers_g_net': 1, 'hidden_dims_g_net': 56, 'af_g_net': 'tanh', 'drop_p_g_net': 0.004065551198901432, 'n_hidden_layers_h_net': 1, 'hidden_dims_h_net': 24, 'af_h_net': 'softplus', 'drop_p_h_net': 0.004734710901310829}. Best is trial 23 with value: 93.03630065917969.
2025-07-08 08:44:57,166 - INFO - Trial 38 finished with value: 93.04492950439453 and parameters: {'lr': 0.0010272525641424797, 'lamb': 0.0, 'batch_size': 32, 'n_hidden_layers_g_net': 2, 'hidden_dims_g_net': 8, 'af_g_net': 'tanh', 'drop_p_g_net': 0.05614453391992025, 'n_hidden_layers_h_net': 2, 'hidden_dims_h_net': 16, 'af_h_net': 'softplus', 'drop_p_h_net': 0.012161064543652863}. Best is trial 23 with value: 93.03630065917969.
2025-07-08 08:46:14,975 - INFO - Trial 39 finished with value: 93.04546356201172 and parameters: {'lr': 0.01522628772198701, 'lamb': 0.0, 'batch_size': 32, 'n_hidden_layers_g_net': 1, 'hidden_dims_g_net': 64, 'af_g_net': 'relu', 'drop_p_g_net': 0.179419239515716, 'n_hidden_layers_h_net': 1, 'hidden_dims_h_net': 8, 'af_h_net': 'relu', 'drop_p_h_net': 0.0013435571657976347}. Best is trial 23 with value: 93.03630065917969.
2025-07-08 08:49:34,839 - INFO - Trial 40 finished with value: 93.04511260986328 and parameters: {'lr': 0.002555563158306398, 'lamb': 0.0, 'batch_size': 32, 'n_hidden_layers_g_net': 2, 'hidden_dims_g_net': 48, 'af_g_net': 'softplus', 'drop_p_g_net': 0.010673513053570866, 'n_hidden_layers_h_net': 2, 'hidden_dims_h_net': 8, 'af_h_net': 'softplus', 'drop_p_h_net': 0.19749937782438642}. Best is trial 23 with value: 93.03630065917969.
2025-07-08 08:53:27,114 - INFO - Trial 41 finished with value: 93.04017639160156 and parameters: {'lr': 0.04002931649633676, 'lamb': 0.0, 'batch_size': 16, 'n_hidden_layers_g_net': 2, 'hidden_dims_g_net': 48, 'af_g_net': 'tanh', 'drop_p_g_net': 0.06126026383632926, 'n_hidden_layers_h_net': 2, 'hidden_dims_h_net': 16, 'af_h_net': 'tanh', 'drop_p_h_net': 0.05541414520643824}. Best is trial 23 with value: 93.03630065917969.
2025-07-08 08:57:00,198 - INFO - Trial 42 finished with value: 93.04138946533203 and parameters: {'lr': 0.024936596987187427, 'lamb': 0.0, 'batch_size': 16, 'n_hidden_layers_g_net': 2, 'hidden_dims_g_net': 56, 'af_g_net': 'tanh', 'drop_p_g_net': 0.1143144394424196, 'n_hidden_layers_h_net': 2, 'hidden_dims_h_net': 40, 'af_h_net': 'tanh', 'drop_p_h_net': 0.09050131182005386}. Best is trial 23 with value: 93.03630065917969.
2025-07-08 08:58:51,592 - INFO - Trial 43 finished with value: 93.0420913696289 and parameters: {'lr': 0.0386045914576621, 'lamb': 0.0, 'batch_size': 64, 'n_hidden_layers_g_net': 2, 'hidden_dims_g_net': 48, 'af_g_net': 'tanh', 'drop_p_g_net': 0.028482872060617486, 'n_hidden_layers_h_net': 2, 'hidden_dims_h_net': 24, 'af_h_net': 'tanh', 'drop_p_h_net': 0.03339847988067477}. Best is trial 23 with value: 93.03630065917969.
2025-07-08 09:03:44,126 - INFO - Trial 44 finished with value: 93.0403060913086 and parameters: {'lr': 0.026146703278008655, 'lamb': 0.0, 'batch_size': 16, 'n_hidden_layers_g_net': 2, 'hidden_dims_g_net': 40, 'af_g_net': 'tanh', 'drop_p_g_net': 0.018662155113400157, 'n_hidden_layers_h_net': 2, 'hidden_dims_h_net': 48, 'af_h_net': 'relu', 'drop_p_h_net': 0.008585834377328898}. Best is trial 23 with value: 93.03630065917969.
2025-07-08 09:09:14,072 - INFO - Trial 45 finished with value: 93.03662109375 and parameters: {'lr': 0.02964488356381182, 'lamb': 0.0, 'batch_size': 16, 'n_hidden_layers_g_net': 2, 'hidden_dims_g_net': 64, 'af_g_net': 'tanh', 'drop_p_g_net': 0.34484503896460583, 'n_hidden_layers_h_net': 2, 'hidden_dims_h_net': 8, 'af_h_net': 'softplus', 'drop_p_h_net': 0.017555024389294682}. Best is trial 23 with value: 93.03630065917969.
2025-07-08 09:10:33,940 - INFO - Trial 46 finished with value: 93.04537200927734 and parameters: {'lr': 0.018210621371179143, 'lamb': 0.0, 'batch_size': 32, 'n_hidden_layers_g_net': 1, 'hidden_dims_g_net': 64, 'af_g_net': 'relu', 'drop_p_g_net': 0.3471053234375297, 'n_hidden_layers_h_net': 1, 'hidden_dims_h_net': 8, 'af_h_net': 'softplus', 'drop_p_h_net': 0.016200803739681423}. Best is trial 23 with value: 93.03630065917969.
2025-07-08 09:13:41,384 - INFO - Trial 47 finished with value: 93.0420150756836 and parameters: {'lr': 0.030084012330169968, 'lamb': 0.0, 'batch_size': 16, 'n_hidden_layers_g_net': 2, 'hidden_dims_g_net': 64, 'af_g_net': 'tanh', 'drop_p_g_net': 0.24153141918909574, 'n_hidden_layers_h_net': 2, 'hidden_dims_h_net': 8, 'af_h_net': 'softplus', 'drop_p_h_net': 0.048656031206319166}. Best is trial 23 with value: 93.03630065917969.
2025-07-08 09:16:31,958 - INFO - Trial 48 finished with value: 93.03935241699219 and parameters: {'lr': 0.03718331922261942, 'lamb': 0.0, 'batch_size': 16, 'n_hidden_layers_g_net': 2, 'hidden_dims_g_net': 56, 'af_g_net': 'tanh', 'drop_p_g_net': 0.12026024504907863, 'n_hidden_layers_h_net': 2, 'hidden_dims_h_net': 16, 'af_h_net': 'softplus', 'drop_p_h_net': 0.02589039684028481}. Best is trial 23 with value: 93.03630065917969.
2025-07-08 09:17:36,893 - INFO - Trial 49 finished with value: 93.04499816894531 and parameters: {'lr': 0.006396992282817329, 'lamb': 0.0, 'batch_size': 64, 'n_hidden_layers_g_net': 2, 'hidden_dims_g_net': 64, 'af_g_net': 'tanh', 'drop_p_g_net': 0.10714449461057018, 'n_hidden_layers_h_net': 2, 'hidden_dims_h_net': 16, 'af_h_net': 'softplus', 'drop_p_h_net': 0.00916551331076841}. Best is trial 23 with value: 93.03630065917969.
2025-07-08 09:20:24,389 - INFO - Trial 50 finished with value: 93.04508972167969 and parameters: {'lr': 0.0012231807830536511, 'lamb': 0.0, 'batch_size': 32, 'n_hidden_layers_g_net': 2, 'hidden_dims_g_net': 56, 'af_g_net': 'tanh', 'drop_p_g_net': 0.47643698096301246, 'n_hidden_layers_h_net': 2, 'hidden_dims_h_net': 24, 'af_h_net': 'softplus', 'drop_p_h_net': 0.004649622589325607}. Best is trial 23 with value: 93.03630065917969.
