2025-07-29 21:34:46,598 - INFO - Trial 39 finished with value: 703.8461303710938 and parameters: {'lr': 0.012716324763670062, 'lamb': 0.0074, 'batch_size': 16, 'n_hidden_layers_g0': 1, 'hidden_dims_g0': 64, 'af_g0': 'relu', 'drop_p_g0': 0.0, 'n_hidden_layers_g1': 1, 'hidden_dims_g1': 8, 'af_g1': 'tanh', 'drop_p_g1': 0.0, 'n_hidden_layers_g2': 1, 'hidden_dims_g2': 8, 'af_g2': 'relu', 'drop_p_g2': 0.0, 'n_hidden_layers_h_net': 2, 'hidden_dims_h_net': 24, 'af_h_net': 'relu', 'drop_p_h_net': 0.0}. Best is trial 27 with value: 703.8174438476562.
2025-07-29 21:37:29,735 - INFO - Trial 40 finished with value: 703.8396606445312 and parameters: {'lr': 0.0010735014249457432, 'lamb': 0.0066, 'batch_size': 32, 'n_hidden_layers_g0': 1, 'hidden_dims_g0': 48, 'af_g0': 'tanh', 'drop_p_g0': 0.0, 'n_hidden_layers_g1': 1, 'hidden_dims_g1': 16, 'af_g1': 'relu', 'drop_p_g1': 0.0, 'n_hidden_layers_g2': 1, 'hidden_dims_g2': 16, 'af_g2': 'relu', 'drop_p_g2': 0.0, 'n_hidden_layers_h_net': 1, 'hidden_dims_h_net': 32, 'af_h_net': 'tanh', 'drop_p_h_net': 0.0}. Best is trial 27 with value: 703.8174438476562.
2025-07-29 21:43:50,649 - INFO - Trial 41 finished with value: 703.8304443359375 and parameters: {'lr': 0.023797978012743665, 'lamb': 0.0091, 'batch_size': 16, 'n_hidden_layers_g0': 2, 'hidden_dims_g0': 8, 'af_g0': 'tanh', 'drop_p_g0': 0.0, 'n_hidden_layers_g1': 1, 'hidden_dims_g1': 48, 'af_g1': 'relu', 'drop_p_g1': 0.0, 'n_hidden_layers_g2': 2, 'hidden_dims_g2': 8, 'af_g2': 'tanh', 'drop_p_g2': 0.0, 'n_hidden_layers_h_net': 2, 'hidden_dims_h_net': 8, 'af_h_net': 'softplus', 'drop_p_h_net': 0.0}. Best is trial 27 with value: 703.8174438476562.
2025-07-29 21:51:31,311 - INFO - Trial 42 finished with value: 703.8273315429688 and parameters: {'lr': 0.020735125125520615, 'lamb': 0.0094, 'batch_size': 16, 'n_hidden_layers_g0': 1, 'hidden_dims_g0': 8, 'af_g0': 'tanh', 'drop_p_g0': 0.0, 'n_hidden_layers_g1': 1, 'hidden_dims_g1': 40, 'af_g1': 'relu', 'drop_p_g1': 0.0, 'n_hidden_layers_g2': 2, 'hidden_dims_g2': 8, 'af_g2': 'tanh', 'drop_p_g2': 0.0, 'n_hidden_layers_h_net': 2, 'hidden_dims_h_net': 8, 'af_h_net': 'softplus', 'drop_p_h_net': 0.0}. Best is trial 27 with value: 703.8174438476562.
2025-07-29 21:57:08,544 - INFO - Trial 43 finished with value: 703.8294067382812 and parameters: {'lr': 0.017656885302177728, 'lamb': 0.0097, 'batch_size': 16, 'n_hidden_layers_g0': 1, 'hidden_dims_g0': 8, 'af_g0': 'tanh', 'drop_p_g0': 0.0, 'n_hidden_layers_g1': 1, 'hidden_dims_g1': 56, 'af_g1': 'relu', 'drop_p_g1': 0.0, 'n_hidden_layers_g2': 1, 'hidden_dims_g2': 8, 'af_g2': 'tanh', 'drop_p_g2': 0.0, 'n_hidden_layers_h_net': 2, 'hidden_dims_h_net': 8, 'af_h_net': 'softplus', 'drop_p_h_net': 0.0}. Best is trial 27 with value: 703.8174438476562.
2025-07-29 22:00:42,401 - INFO - Trial 44 finished with value: 703.8394165039062 and parameters: {'lr': 0.006991967899196336, 'lamb': 0.008400000000000001, 'batch_size': 16, 'n_hidden_layers_g0': 1, 'hidden_dims_g0': 8, 'af_g0': 'tanh', 'drop_p_g0': 0.0, 'n_hidden_layers_g1': 1, 'hidden_dims_g1': 64, 'af_g1': 'relu', 'drop_p_g1': 0.0, 'n_hidden_layers_g2': 1, 'hidden_dims_g2': 24, 'af_g2': 'relu', 'drop_p_g2': 0.0, 'n_hidden_layers_h_net': 2, 'hidden_dims_h_net': 16, 'af_h_net': 'relu', 'drop_p_h_net': 0.0}. Best is trial 27 with value: 703.8174438476562.
2025-07-29 22:03:43,998 - INFO - Trial 45 finished with value: 703.8460083007812 and parameters: {'lr': 0.046110050247278746, 'lamb': 0.004200000000000001, 'batch_size': 16, 'n_hidden_layers_g0': 1, 'hidden_dims_g0': 64, 'af_g0': 'softplus', 'drop_p_g0': 0.0, 'n_hidden_layers_g1': 1, 'hidden_dims_g1': 40, 'af_g1': 'relu', 'drop_p_g1': 0.0, 'n_hidden_layers_g2': 1, 'hidden_dims_g2': 8, 'af_g2': 'tanh', 'drop_p_g2': 0.0, 'n_hidden_layers_h_net': 2, 'hidden_dims_h_net': 16, 'af_h_net': 'tanh', 'drop_p_h_net': 0.0}. Best is trial 27 with value: 703.8174438476562.
2025-07-29 22:07:39,698 - INFO - Trial 46 finished with value: 703.8482666015625 and parameters: {'lr': 0.029075419770283235, 'lamb': 0.005, 'batch_size': 16, 'n_hidden_layers_g0': 1, 'hidden_dims_g0': 8, 'af_g0': 'relu', 'drop_p_g0': 0.0, 'n_hidden_layers_g1': 1, 'hidden_dims_g1': 24, 'af_g1': 'relu', 'drop_p_g1': 0.0, 'n_hidden_layers_g2': 2, 'hidden_dims_g2': 56, 'af_g2': 'softplus', 'drop_p_g2': 0.0, 'n_hidden_layers_h_net': 2, 'hidden_dims_h_net': 8, 'af_h_net': 'tanh', 'drop_p_h_net': 0.0}. Best is trial 27 with value: 703.8174438476562.
2025-07-29 22:11:29,933 - INFO - Trial 47 finished with value: 703.840576171875 and parameters: {'lr': 0.0018779461118952298, 'lamb': 0.0099, 'batch_size': 16, 'n_hidden_layers_g0': 1, 'hidden_dims_g0': 16, 'af_g0': 'softplus', 'drop_p_g0': 0.0, 'n_hidden_layers_g1': 2, 'hidden_dims_g1': 56, 'af_g1': 'relu', 'drop_p_g1': 0.0, 'n_hidden_layers_g2': 1, 'hidden_dims_g2': 16, 'af_g2': 'relu', 'drop_p_g2': 0.0, 'n_hidden_layers_h_net': 1, 'hidden_dims_h_net': 16, 'af_h_net': 'tanh', 'drop_p_h_net': 0.0}. Best is trial 27 with value: 703.8174438476562.
2025-07-29 22:14:02,156 - INFO - Trial 48 finished with value: 703.831787109375 and parameters: {'lr': 0.0034474951896311698, 'lamb': 0.0079, 'batch_size': 64, 'n_hidden_layers_g0': 1, 'hidden_dims_g0': 24, 'af_g0': 'tanh', 'drop_p_g0': 0.0, 'n_hidden_layers_g1': 1, 'hidden_dims_g1': 64, 'af_g1': 'tanh', 'drop_p_g1': 0.0, 'n_hidden_layers_g2': 1, 'hidden_dims_g2': 8, 'af_g2': 'relu', 'drop_p_g2': 0.0, 'n_hidden_layers_h_net': 2, 'hidden_dims_h_net': 56, 'af_h_net': 'softplus', 'drop_p_h_net': 0.0}. Best is trial 27 with value: 703.8174438476562.
2025-07-29 22:16:38,828 - INFO - Trial 49 finished with value: 703.8283081054688 and parameters: {'lr': 0.011262396289267281, 'lamb': 0.0037, 'batch_size': 32, 'n_hidden_layers_g0': 1, 'hidden_dims_g0': 40, 'af_g0': 'softplus', 'drop_p_g0': 0.0, 'n_hidden_layers_g1': 1, 'hidden_dims_g1': 48, 'af_g1': 'relu', 'drop_p_g1': 0.0, 'n_hidden_layers_g2': 1, 'hidden_dims_g2': 16, 'af_g2': 'relu', 'drop_p_g2': 0.0, 'n_hidden_layers_h_net': 2, 'hidden_dims_h_net': 8, 'af_h_net': 'relu', 'drop_p_h_net': 0.0}. Best is trial 27 with value: 703.8174438476562.
2025-07-29 22:21:54,579 - INFO - Trial 50 finished with value: 703.8318481445312 and parameters: {'lr': 0.014836182819998331, 'lamb': 0.0089, 'batch_size': 16, 'n_hidden_layers_g0': 1, 'hidden_dims_g0': 56, 'af_g0': 'relu', 'drop_p_g0': 0.0, 'n_hidden_layers_g1': 1, 'hidden_dims_g1': 8, 'af_g1': 'softplus', 'drop_p_g1': 0.0, 'n_hidden_layers_g2': 2, 'hidden_dims_g2': 24, 'af_g2': 'relu', 'drop_p_g2': 0.0, 'n_hidden_layers_h_net': 1, 'hidden_dims_h_net': 40, 'af_h_net': 'tanh', 'drop_p_h_net': 0.0}. Best is trial 27 with value: 703.8174438476562.
2025-07-29 22:30:17,246 - INFO - Trial 51 finished with value: 703.82177734375 and parameters: {'lr': 0.023645998191185832, 'lamb': 0.009300000000000001, 'batch_size': 16, 'n_hidden_layers_g0': 2, 'hidden_dims_g0': 16, 'af_g0': 'tanh', 'drop_p_g0': 0.0, 'n_hidden_layers_g1': 1, 'hidden_dims_g1': 32, 'af_g1': 'relu', 'drop_p_g1': 0.0, 'n_hidden_layers_g2': 2, 'hidden_dims_g2': 8, 'af_g2': 'tanh', 'drop_p_g2': 0.0, 'n_hidden_layers_h_net': 2, 'hidden_dims_h_net': 8, 'af_h_net': 'softplus', 'drop_p_h_net': 0.0}. Best is trial 27 with value: 703.8174438476562.
2025-07-29 22:36:25,326 - INFO - Trial 52 finished with value: 703.83251953125 and parameters: {'lr': 0.038624272812646805, 'lamb': 0.008400000000000001, 'batch_size': 16, 'n_hidden_layers_g0': 1, 'hidden_dims_g0': 8, 'af_g0': 'tanh', 'drop_p_g0': 0.0, 'n_hidden_layers_g1': 1, 'hidden_dims_g1': 48, 'af_g1': 'relu', 'drop_p_g1': 0.0, 'n_hidden_layers_g2': 2, 'hidden_dims_g2': 8, 'af_g2': 'tanh', 'drop_p_g2': 0.0, 'n_hidden_layers_h_net': 2, 'hidden_dims_h_net': 8, 'af_h_net': 'softplus', 'drop_p_h_net': 0.0}. Best is trial 27 with value: 703.8174438476562.
2025-07-29 22:40:31,880 - INFO - Trial 53 finished with value: 703.8413696289062 and parameters: {'lr': 0.034010297433033645, 'lamb': 0.01, 'batch_size': 16, 'n_hidden_layers_g0': 1, 'hidden_dims_g0': 32, 'af_g0': 'tanh', 'drop_p_g0': 0.0, 'n_hidden_layers_g1': 1, 'hidden_dims_g1': 24, 'af_g1': 'relu', 'drop_p_g1': 0.0, 'n_hidden_layers_g2': 2, 'hidden_dims_g2': 8, 'af_g2': 'tanh', 'drop_p_g2': 0.0, 'n_hidden_layers_h_net': 2, 'hidden_dims_h_net': 16, 'af_h_net': 'softplus', 'drop_p_h_net': 0.0}. Best is trial 27 with value: 703.8174438476562.
2025-07-29 22:48:44,859 - INFO - Trial 54 finished with value: 703.8294067382812 and parameters: {'lr': 0.008076393541282721, 'lamb': 0.0094, 'batch_size': 16, 'n_hidden_layers_g0': 2, 'hidden_dims_g0': 8, 'af_g0': 'tanh', 'drop_p_g0': 0.0, 'n_hidden_layers_g1': 1, 'hidden_dims_g1': 40, 'af_g1': 'relu', 'drop_p_g1': 0.0, 'n_hidden_layers_g2': 2, 'hidden_dims_g2': 16, 'af_g2': 'tanh', 'drop_p_g2': 0.0, 'n_hidden_layers_h_net': 2, 'hidden_dims_h_net': 8, 'af_h_net': 'softplus', 'drop_p_h_net': 0.0}. Best is trial 27 with value: 703.8174438476562.
2025-07-29 22:54:26,595 - INFO - Trial 55 finished with value: 703.82958984375 and parameters: {'lr': 0.01982121177657994, 'lamb': 0.009600000000000001, 'batch_size': 16, 'n_hidden_layers_g0': 1, 'hidden_dims_g0': 16, 'af_g0': 'tanh', 'drop_p_g0': 0.0, 'n_hidden_layers_g1': 1, 'hidden_dims_g1': 64, 'af_g1': 'relu', 'drop_p_g1': 0.0, 'n_hidden_layers_g2': 2, 'hidden_dims_g2': 8, 'af_g2': 'tanh', 'drop_p_g2': 0.0, 'n_hidden_layers_h_net': 2, 'hidden_dims_h_net': 8, 'af_h_net': 'softplus', 'drop_p_h_net': 0.0}. Best is trial 27 with value: 703.8174438476562.
2025-07-29 22:59:50,402 - INFO - Trial 56 finished with value: 703.8384399414062 and parameters: {'lr': 0.0005020438532125371, 'lamb': 0.0086, 'batch_size': 16, 'n_hidden_layers_g0': 1, 'hidden_dims_g0': 16, 'af_g0': 'softplus', 'drop_p_g0': 0.0, 'n_hidden_layers_g1': 1, 'hidden_dims_g1': 56, 'af_g1': 'relu', 'drop_p_g1': 0.0, 'n_hidden_layers_g2': 2, 'hidden_dims_g2': 8, 'af_g2': 'tanh', 'drop_p_g2': 0.0, 'n_hidden_layers_h_net': 2, 'hidden_dims_h_net': 24, 'af_h_net': 'tanh', 'drop_p_h_net': 0.0}. Best is trial 27 with value: 703.8174438476562.
2025-07-29 23:03:57,485 - INFO - Trial 57 finished with value: 703.8377685546875 and parameters: {'lr': 0.0061909341519145, 'lamb': 0.009000000000000001, 'batch_size': 16, 'n_hidden_layers_g0': 2, 'hidden_dims_g0': 8, 'af_g0': 'tanh', 'drop_p_g0': 0.0, 'n_hidden_layers_g1': 1, 'hidden_dims_g1': 16, 'af_g1': 'relu', 'drop_p_g1': 0.0, 'n_hidden_layers_g2': 1, 'hidden_dims_g2': 16, 'af_g2': 'softplus', 'drop_p_g2': 0.0, 'n_hidden_layers_h_net': 2, 'hidden_dims_h_net': 16, 'af_h_net': 'softplus', 'drop_p_h_net': 0.0}. Best is trial 27 with value: 703.8174438476562.
2025-07-29 23:06:59,646 - INFO - Trial 58 finished with value: 703.8329467773438 and parameters: {'lr': 0.027945232071468585, 'lamb': 0.0082, 'batch_size': 16, 'n_hidden_layers_g0': 1, 'hidden_dims_g0': 16, 'af_g0': 'tanh', 'drop_p_g0': 0.0, 'n_hidden_layers_g1': 1, 'hidden_dims_g1': 32, 'af_g1': 'relu', 'drop_p_g1': 0.0, 'n_hidden_layers_g2': 2, 'hidden_dims_g2': 40, 'af_g2': 'relu', 'drop_p_g2': 0.0, 'n_hidden_layers_h_net': 1, 'hidden_dims_h_net': 8, 'af_h_net': 'tanh', 'drop_p_h_net': 0.0}. Best is trial 27 with value: 703.8174438476562.
2025-07-29 23:09:40,227 - INFO - Trial 59 finished with value: 703.83740234375 and parameters: {'lr': 0.0021465682699346165, 'lamb': 0.0056, 'batch_size': 64, 'n_hidden_layers_g0': 1, 'hidden_dims_g0': 48, 'af_g0': 'relu', 'drop_p_g0': 0.0, 'n_hidden_layers_g1': 2, 'hidden_dims_g1': 8, 'af_g1': 'tanh', 'drop_p_g1': 0.0, 'n_hidden_layers_g2': 1, 'hidden_dims_g2': 32, 'af_g2': 'tanh', 'drop_p_g2': 0.0, 'n_hidden_layers_h_net': 2, 'hidden_dims_h_net': 24, 'af_h_net': 'tanh', 'drop_p_h_net': 0.0}. Best is trial 27 with value: 703.8174438476562.
2025-07-29 23:14:00,200 - INFO - Trial 60 finished with value: 703.8461303710938 and parameters: {'lr': 0.0037742200434019895, 'lamb': 0.0048000000000000004, 'batch_size': 16, 'n_hidden_layers_g0': 2, 'hidden_dims_g0': 24, 'af_g0': 'softplus', 'drop_p_g0': 0.0, 'n_hidden_layers_g1': 1, 'hidden_dims_g1': 64, 'af_g1': 'relu', 'drop_p_g1': 0.0, 'n_hidden_layers_g2': 1, 'hidden_dims_g2': 8, 'af_g2': 'relu', 'drop_p_g2': 0.0, 'n_hidden_layers_h_net': 2, 'hidden_dims_h_net': 8, 'af_h_net': 'softplus', 'drop_p_h_net': 0.0}. Best is trial 27 with value: 703.8174438476562.
2025-07-29 23:25:19,564 - INFO - Trial 61 finished with value: 703.8142700195312 and parameters: {'lr': 0.024595038761746048, 'lamb': 0.0094, 'batch_size': 16, 'n_hidden_layers_g0': 2, 'hidden_dims_g0': 16, 'af_g0': 'tanh', 'drop_p_g0': 0.0, 'n_hidden_layers_g1': 1, 'hidden_dims_g1': 32, 'af_g1': 'relu', 'drop_p_g1': 0.0, 'n_hidden_layers_g2': 2, 'hidden_dims_g2': 8, 'af_g2': 'tanh', 'drop_p_g2': 0.0, 'n_hidden_layers_h_net': 2, 'hidden_dims_h_net': 8, 'af_h_net': 'softplus', 'drop_p_h_net': 0.0}. Best is trial 61 with value: 703.8142700195312.
2025-07-29 23:33:08,775 - INFO - Trial 62 finished with value: 703.81982421875 and parameters: {'lr': 0.014967284526923159, 'lamb': 0.009600000000000001, 'batch_size': 16, 'n_hidden_layers_g0': 2, 'hidden_dims_g0': 24, 'af_g0': 'tanh', 'drop_p_g0': 0.0, 'n_hidden_layers_g1': 1, 'hidden_dims_g1': 32, 'af_g1': 'relu', 'drop_p_g1': 0.0, 'n_hidden_layers_g2': 2, 'hidden_dims_g2': 8, 'af_g2': 'tanh', 'drop_p_g2': 0.0, 'n_hidden_layers_h_net': 2, 'hidden_dims_h_net': 8, 'af_h_net': 'softplus', 'drop_p_h_net': 0.0}. Best is trial 61 with value: 703.8142700195312.
2025-07-29 23:40:45,936 - INFO - Trial 63 finished with value: 703.8189086914062 and parameters: {'lr': 0.01509800143524389, 'lamb': 0.009600000000000001, 'batch_size': 16, 'n_hidden_layers_g0': 2, 'hidden_dims_g0': 24, 'af_g0': 'tanh', 'drop_p_g0': 0.0, 'n_hidden_layers_g1': 1, 'hidden_dims_g1': 32, 'af_g1': 'relu', 'drop_p_g1': 0.0, 'n_hidden_layers_g2': 2, 'hidden_dims_g2': 16, 'af_g2': 'tanh', 'drop_p_g2': 0.0, 'n_hidden_layers_h_net': 2, 'hidden_dims_h_net': 16, 'af_h_net': 'softplus', 'drop_p_h_net': 0.0}. Best is trial 61 with value: 703.8142700195312.
2025-07-29 23:46:55,192 - INFO - Trial 64 finished with value: 703.8300170898438 and parameters: {'lr': 0.014230159930200494, 'lamb': 0.0097, 'batch_size': 16, 'n_hidden_layers_g0': 2, 'hidden_dims_g0': 24, 'af_g0': 'tanh', 'drop_p_g0': 0.0, 'n_hidden_layers_g1': 1, 'hidden_dims_g1': 32, 'af_g1': 'relu', 'drop_p_g1': 0.0, 'n_hidden_layers_g2': 2, 'hidden_dims_g2': 16, 'af_g2': 'tanh', 'drop_p_g2': 0.0, 'n_hidden_layers_h_net': 2, 'hidden_dims_h_net': 16, 'af_h_net': 'softplus', 'drop_p_h_net': 0.0}. Best is trial 61 with value: 703.8142700195312.
2025-07-29 23:54:37,274 - INFO - Trial 65 finished with value: 703.8275146484375 and parameters: {'lr': 0.016058694839406938, 'lamb': 0.0089, 'batch_size': 16, 'n_hidden_layers_g0': 2, 'hidden_dims_g0': 24, 'af_g0': 'tanh', 'drop_p_g0': 0.0, 'n_hidden_layers_g1': 1, 'hidden_dims_g1': 32, 'af_g1': 'relu', 'drop_p_g1': 0.0, 'n_hidden_layers_g2': 2, 'hidden_dims_g2': 8, 'af_g2': 'tanh', 'drop_p_g2': 0.0, 'n_hidden_layers_h_net': 2, 'hidden_dims_h_net': 16, 'af_h_net': 'softplus', 'drop_p_h_net': 0.0}. Best is trial 61 with value: 703.8142700195312.
2025-07-30 00:00:00,838 - INFO - Trial 66 finished with value: 703.832275390625 and parameters: {'lr': 0.02368160140655579, 'lamb': 0.01, 'batch_size': 16, 'n_hidden_layers_g0': 2, 'hidden_dims_g0': 32, 'af_g0': 'tanh', 'drop_p_g0': 0.0, 'n_hidden_layers_g1': 1, 'hidden_dims_g1': 32, 'af_g1': 'relu', 'drop_p_g1': 0.0, 'n_hidden_layers_g2': 2, 'hidden_dims_g2': 16, 'af_g2': 'tanh', 'drop_p_g2': 0.0, 'n_hidden_layers_h_net': 2, 'hidden_dims_h_net': 8, 'af_h_net': 'softplus', 'drop_p_h_net': 0.0}. Best is trial 61 with value: 703.8142700195312.
2025-07-30 00:07:30,745 - INFO - Trial 67 finished with value: 703.8278198242188 and parameters: {'lr': 0.010480262310488367, 'lamb': 0.0092, 'batch_size': 16, 'n_hidden_layers_g0': 2, 'hidden_dims_g0': 24, 'af_g0': 'tanh', 'drop_p_g0': 0.0, 'n_hidden_layers_g1': 1, 'hidden_dims_g1': 24, 'af_g1': 'relu', 'drop_p_g1': 0.0, 'n_hidden_layers_g2': 2, 'hidden_dims_g2': 8, 'af_g2': 'tanh', 'drop_p_g2': 0.0, 'n_hidden_layers_h_net': 2, 'hidden_dims_h_net': 16, 'af_h_net': 'softplus', 'drop_p_h_net': 0.0}. Best is trial 61 with value: 703.8142700195312.
2025-07-30 00:11:54,138 - INFO - Trial 68 finished with value: 703.8289184570312 and parameters: {'lr': 0.026811312615348897, 'lamb': 0.008700000000000001, 'batch_size': 32, 'n_hidden_layers_g0': 2, 'hidden_dims_g0': 24, 'af_g0': 'tanh', 'drop_p_g0': 0.0, 'n_hidden_layers_g1': 1, 'hidden_dims_g1': 32, 'af_g1': 'relu', 'drop_p_g1': 0.0, 'n_hidden_layers_g2': 2, 'hidden_dims_g2': 16, 'af_g2': 'tanh', 'drop_p_g2': 0.0, 'n_hidden_layers_h_net': 2, 'hidden_dims_h_net': 8, 'af_h_net': 'softplus', 'drop_p_h_net': 0.0}. Best is trial 61 with value: 703.8142700195312.
2025-07-30 00:17:14,934 - INFO - Trial 69 finished with value: 703.8382568359375 and parameters: {'lr': 0.0027339275478517576, 'lamb': 0.0095, 'batch_size': 16, 'n_hidden_layers_g0': 2, 'hidden_dims_g0': 16, 'af_g0': 'tanh', 'drop_p_g0': 0.0, 'n_hidden_layers_g1': 1, 'hidden_dims_g1': 40, 'af_g1': 'relu', 'drop_p_g1': 0.0, 'n_hidden_layers_g2': 2, 'hidden_dims_g2': 8, 'af_g2': 'tanh', 'drop_p_g2': 0.0, 'n_hidden_layers_h_net': 2, 'hidden_dims_h_net': 16, 'af_h_net': 'softplus', 'drop_p_h_net': 0.0}. Best is trial 61 with value: 703.8142700195312.
