2025-05-24 10:37:02,549 - INFO - A new study created in Journal with name: model-kuramoto-mpnn-kuramoto_mpnn_ic1_s5_pd_seed
2025-05-24 10:37:23,474 - INFO - Trial 0 finished with value: 0.2306233048439026 and parameters: {'lr': 0.0028057582076672534, 'lamb': 0.0, 'batch_size': 16, 'n_hidden_layers_g_net': 2, 'hidden_dims_g_net': 16, 'af_g_net': 'tanh', 'drop_p_g_net': 0.016730402817820244, 'n_hidden_layers_h_net': 2, 'hidden_dims_h_net': 8, 'af_h_net': 'relu', 'drop_p_h_net': 0.0004705059281907648}. Best is trial 0 with value: 0.2306233048439026.
2025-05-24 10:37:54,796 - INFO - Trial 1 finished with value: 0.2573945224285126 and parameters: {'lr': 0.0011635338541918904, 'lamb': 0.0, 'batch_size': 32, 'n_hidden_layers_g_net': 1, 'hidden_dims_g_net': 24, 'af_g_net': 'relu', 'drop_p_g_net': 0.002265486450485179, 'n_hidden_layers_h_net': 1, 'hidden_dims_h_net': 56, 'af_h_net': 'tanh', 'drop_p_h_net': 0.00014853153980421636}. Best is trial 0 with value: 0.2306233048439026.
2025-05-24 10:38:32,331 - INFO - Trial 2 finished with value: 0.047142475843429565 and parameters: {'lr': 0.008204643365323961, 'lamb': 0.0, 'batch_size': 16, 'n_hidden_layers_g_net': 2, 'hidden_dims_g_net': 64, 'af_g_net': 'relu', 'drop_p_g_net': 0.033959199243313656, 'n_hidden_layers_h_net': 1, 'hidden_dims_h_net': 8, 'af_h_net': 'tanh', 'drop_p_h_net': 0.0009061902594114382}. Best is trial 2 with value: 0.047142475843429565.
2025-05-24 10:38:49,545 - INFO - Trial 3 finished with value: 0.3086385130882263 and parameters: {'lr': 0.010568529720322864, 'lamb': 0.0, 'batch_size': 32, 'n_hidden_layers_g_net': 2, 'hidden_dims_g_net': 16, 'af_g_net': 'relu', 'drop_p_g_net': 0.2041453670307777, 'n_hidden_layers_h_net': 2, 'hidden_dims_h_net': 64, 'af_h_net': 'softplus', 'drop_p_h_net': 0.0015973023661305591}. Best is trial 2 with value: 0.047142475843429565.
2025-05-24 10:39:17,394 - INFO - Trial 4 finished with value: 0.17529632151126862 and parameters: {'lr': 0.0029945018361271503, 'lamb': 0.0, 'batch_size': 32, 'n_hidden_layers_g_net': 1, 'hidden_dims_g_net': 24, 'af_g_net': 'tanh', 'drop_p_g_net': 0.00018869508789698286, 'n_hidden_layers_h_net': 2, 'hidden_dims_h_net': 56, 'af_h_net': 'tanh', 'drop_p_h_net': 0.04117599592262882}. Best is trial 2 with value: 0.047142475843429565.
2025-05-24 10:39:49,843 - INFO - Trial 5 finished with value: 0.27805295586586 and parameters: {'lr': 0.014354376740977342, 'lamb': 0.0, 'batch_size': 16, 'n_hidden_layers_g_net': 1, 'hidden_dims_g_net': 8, 'af_g_net': 'relu', 'drop_p_g_net': 0.0001718305701918592, 'n_hidden_layers_h_net': 1, 'hidden_dims_h_net': 24, 'af_h_net': 'tanh', 'drop_p_h_net': 0.005580959150991872}. Best is trial 2 with value: 0.047142475843429565.
2025-05-24 10:40:27,491 - INFO - Trial 6 finished with value: 0.5138404369354248 and parameters: {'lr': 0.000867278332118047, 'lamb': 0.0, 'batch_size': 32, 'n_hidden_layers_g_net': 2, 'hidden_dims_g_net': 56, 'af_g_net': 'softplus', 'drop_p_g_net': 0.0001241722605100823, 'n_hidden_layers_h_net': 1, 'hidden_dims_h_net': 8, 'af_h_net': 'relu', 'drop_p_h_net': 0.22754178673650124}. Best is trial 2 with value: 0.047142475843429565.
2025-05-24 10:41:05,042 - INFO - Trial 7 finished with value: 0.46675750613212585 and parameters: {'lr': 0.0015759936475969447, 'lamb': 0.0, 'batch_size': 32, 'n_hidden_layers_g_net': 1, 'hidden_dims_g_net': 8, 'af_g_net': 'tanh', 'drop_p_g_net': 0.0975468037883334, 'n_hidden_layers_h_net': 2, 'hidden_dims_h_net': 56, 'af_h_net': 'tanh', 'drop_p_h_net': 0.009885776211256199}. Best is trial 2 with value: 0.047142475843429565.
2025-05-24 10:41:20,758 - INFO - Trial 8 finished with value: 0.1896338015794754 and parameters: {'lr': 0.020599198123025936, 'lamb': 0.0, 'batch_size': 16, 'n_hidden_layers_g_net': 1, 'hidden_dims_g_net': 16, 'af_g_net': 'tanh', 'drop_p_g_net': 0.00010610008267254209, 'n_hidden_layers_h_net': 2, 'hidden_dims_h_net': 32, 'af_h_net': 'tanh', 'drop_p_h_net': 0.3074643105596185}. Best is trial 2 with value: 0.047142475843429565.
2025-05-24 10:41:52,843 - INFO - Trial 9 finished with value: 0.16931553184986115 and parameters: {'lr': 0.002215010903383992, 'lamb': 0.0, 'batch_size': 32, 'n_hidden_layers_g_net': 1, 'hidden_dims_g_net': 64, 'af_g_net': 'relu', 'drop_p_g_net': 0.0012969996024538206, 'n_hidden_layers_h_net': 1, 'hidden_dims_h_net': 8, 'af_h_net': 'relu', 'drop_p_h_net': 0.0010732599242723982}. Best is trial 2 with value: 0.047142475843429565.
2025-05-24 10:42:30,687 - INFO - Trial 10 finished with value: 0.1477670520544052 and parameters: {'lr': 0.040644443622328164, 'lamb': 0.0, 'batch_size': 16, 'n_hidden_layers_g_net': 2, 'hidden_dims_g_net': 48, 'af_g_net': 'softplus', 'drop_p_g_net': 0.035744005701785715, 'n_hidden_layers_h_net': 1, 'hidden_dims_h_net': 24, 'af_h_net': 'softplus', 'drop_p_h_net': 0.00011105513565315193}. Best is trial 2 with value: 0.047142475843429565.
2025-05-24 10:43:08,188 - INFO - Trial 11 finished with value: 0.20286132395267487 and parameters: {'lr': 0.04860977298266141, 'lamb': 0.0, 'batch_size': 16, 'n_hidden_layers_g_net': 2, 'hidden_dims_g_net': 48, 'af_g_net': 'softplus', 'drop_p_g_net': 0.03167471604628328, 'n_hidden_layers_h_net': 1, 'hidden_dims_h_net': 24, 'af_h_net': 'softplus', 'drop_p_h_net': 0.00010309924129969989}. Best is trial 2 with value: 0.047142475843429565.
2025-05-24 10:43:33,693 - INFO - Trial 12 finished with value: 0.32557833194732666 and parameters: {'lr': 0.03778419725239335, 'lamb': 0.0, 'batch_size': 16, 'n_hidden_layers_g_net': 2, 'hidden_dims_g_net': 40, 'af_g_net': 'softplus', 'drop_p_g_net': 0.42749377600856503, 'n_hidden_layers_h_net': 1, 'hidden_dims_h_net': 24, 'af_h_net': 'softplus', 'drop_p_h_net': 0.000376911664644897}. Best is trial 2 with value: 0.047142475843429565.
2025-05-24 10:44:10,975 - INFO - Trial 13 finished with value: 0.09431125223636627 and parameters: {'lr': 0.0067252747233805055, 'lamb': 0.0, 'batch_size': 16, 'n_hidden_layers_g_net': 2, 'hidden_dims_g_net': 64, 'af_g_net': 'softplus', 'drop_p_g_net': 0.0460265555570358, 'n_hidden_layers_h_net': 1, 'hidden_dims_h_net': 16, 'af_h_net': 'softplus', 'drop_p_h_net': 0.0024025443618626943}. Best is trial 2 with value: 0.047142475843429565.
2025-05-24 10:44:49,392 - INFO - Trial 14 finished with value: 0.03627271205186844 and parameters: {'lr': 0.006370379272935864, 'lamb': 0.0, 'batch_size': 16, 'n_hidden_layers_g_net': 2, 'hidden_dims_g_net': 64, 'af_g_net': 'relu', 'drop_p_g_net': 0.008259110286059277, 'n_hidden_layers_h_net': 1, 'hidden_dims_h_net': 16, 'af_h_net': 'softplus', 'drop_p_h_net': 0.004562110581076508}. Best is trial 14 with value: 0.03627271205186844.
2025-05-24 10:45:27,243 - INFO - Trial 15 finished with value: 0.040264394134283066 and parameters: {'lr': 0.005623397169900982, 'lamb': 0.0, 'batch_size': 16, 'n_hidden_layers_g_net': 2, 'hidden_dims_g_net': 56, 'af_g_net': 'relu', 'drop_p_g_net': 0.00471085482197265, 'n_hidden_layers_h_net': 1, 'hidden_dims_h_net': 40, 'af_h_net': 'tanh', 'drop_p_h_net': 0.02322658234670357}. Best is trial 14 with value: 0.03627271205186844.
2025-05-24 10:46:05,116 - INFO - Trial 16 finished with value: 0.15766644477844238 and parameters: {'lr': 0.0005181993754547109, 'lamb': 0.0, 'batch_size': 16, 'n_hidden_layers_g_net': 2, 'hidden_dims_g_net': 56, 'af_g_net': 'relu', 'drop_p_g_net': 0.004469687169615403, 'n_hidden_layers_h_net': 1, 'hidden_dims_h_net': 40, 'af_h_net': 'softplus', 'drop_p_h_net': 0.02618498084582526}. Best is trial 14 with value: 0.03627271205186844.
2025-05-24 10:46:42,967 - INFO - Trial 17 finished with value: 0.09312430024147034 and parameters: {'lr': 0.0037218746017920576, 'lamb': 0.0, 'batch_size': 16, 'n_hidden_layers_g_net': 2, 'hidden_dims_g_net': 40, 'af_g_net': 'relu', 'drop_p_g_net': 0.001030124316100885, 'n_hidden_layers_h_net': 1, 'hidden_dims_h_net': 40, 'af_h_net': 'tanh', 'drop_p_h_net': 0.04827510514152626}. Best is trial 14 with value: 0.03627271205186844.
2025-05-24 10:47:20,991 - INFO - Trial 18 finished with value: 0.11563628166913986 and parameters: {'lr': 0.004926048691496299, 'lamb': 0.0, 'batch_size': 16, 'n_hidden_layers_g_net': 2, 'hidden_dims_g_net': 56, 'af_g_net': 'relu', 'drop_p_g_net': 0.009207058178218035, 'n_hidden_layers_h_net': 1, 'hidden_dims_h_net': 48, 'af_h_net': 'softplus', 'drop_p_h_net': 0.012001779353245532}. Best is trial 14 with value: 0.03627271205186844.
2025-05-24 10:47:54,352 - INFO - Trial 19 finished with value: 0.09203486144542694 and parameters: {'lr': 0.01917100065906778, 'lamb': 0.0, 'batch_size': 16, 'n_hidden_layers_g_net': 2, 'hidden_dims_g_net': 48, 'af_g_net': 'relu', 'drop_p_g_net': 0.0005073898745243696, 'n_hidden_layers_h_net': 1, 'hidden_dims_h_net': 32, 'af_h_net': 'relu', 'drop_p_h_net': 0.12970851058954105}. Best is trial 14 with value: 0.03627271205186844.
2025-05-24 10:48:37,674 - INFO - Trial 20 finished with value: 0.12021167576313019 and parameters: {'lr': 0.005585394282230286, 'lamb': 0.0, 'batch_size': 16, 'n_hidden_layers_g_net': 2, 'hidden_dims_g_net': 32, 'af_g_net': 'relu', 'drop_p_g_net': 0.004617347374581781, 'n_hidden_layers_h_net': 2, 'hidden_dims_h_net': 48, 'af_h_net': 'tanh', 'drop_p_h_net': 0.005506170624642297}. Best is trial 14 with value: 0.03627271205186844.
2025-05-24 10:49:14,699 - INFO - Trial 21 finished with value: 0.036401454359292984 and parameters: {'lr': 0.009531827822705187, 'lamb': 0.0, 'batch_size': 16, 'n_hidden_layers_g_net': 2, 'hidden_dims_g_net': 64, 'af_g_net': 'relu', 'drop_p_g_net': 0.011326227996006622, 'n_hidden_layers_h_net': 1, 'hidden_dims_h_net': 16, 'af_h_net': 'tanh', 'drop_p_h_net': 0.0028273584362146615}. Best is trial 14 with value: 0.03627271205186844.
2025-05-24 10:49:51,570 - INFO - Trial 22 finished with value: 0.0444897897541523 and parameters: {'lr': 0.00921002591389218, 'lamb': 0.0, 'batch_size': 16, 'n_hidden_layers_g_net': 2, 'hidden_dims_g_net': 64, 'af_g_net': 'relu', 'drop_p_g_net': 0.011607971836171724, 'n_hidden_layers_h_net': 1, 'hidden_dims_h_net': 16, 'af_h_net': 'tanh', 'drop_p_h_net': 0.0028777816972232703}. Best is trial 14 with value: 0.03627271205186844.
2025-05-24 10:50:28,600 - INFO - Trial 23 finished with value: 0.036275994032621384 and parameters: {'lr': 0.004438868639134995, 'lamb': 0.0, 'batch_size': 16, 'n_hidden_layers_g_net': 2, 'hidden_dims_g_net': 56, 'af_g_net': 'relu', 'drop_p_g_net': 0.002139124320652888, 'n_hidden_layers_h_net': 1, 'hidden_dims_h_net': 16, 'af_h_net': 'tanh', 'drop_p_h_net': 0.020210934400187033}. Best is trial 14 with value: 0.03627271205186844.
2025-05-24 10:51:05,701 - INFO - Trial 24 finished with value: 0.05968104675412178 and parameters: {'lr': 0.013112013262951977, 'lamb': 0.0, 'batch_size': 16, 'n_hidden_layers_g_net': 2, 'hidden_dims_g_net': 64, 'af_g_net': 'relu', 'drop_p_g_net': 0.002047088884199033, 'n_hidden_layers_h_net': 1, 'hidden_dims_h_net': 16, 'af_h_net': 'tanh', 'drop_p_h_net': 0.0030357897873861694}. Best is trial 14 with value: 0.03627271205186844.
2025-05-24 10:51:42,477 - INFO - Trial 25 finished with value: 0.14193138480186462 and parameters: {'lr': 0.0038375910111934854, 'lamb': 0.0, 'batch_size': 16, 'n_hidden_layers_g_net': 2, 'hidden_dims_g_net': 56, 'af_g_net': 'relu', 'drop_p_g_net': 0.0005797419389681773, 'n_hidden_layers_h_net': 1, 'hidden_dims_h_net': 16, 'af_h_net': 'softplus', 'drop_p_h_net': 0.0144125688694607}. Best is trial 14 with value: 0.03627271205186844.
2025-05-24 10:52:19,303 - INFO - Trial 26 finished with value: 0.0689179003238678 and parameters: {'lr': 0.023189950471016515, 'lamb': 0.0, 'batch_size': 16, 'n_hidden_layers_g_net': 2, 'hidden_dims_g_net': 48, 'af_g_net': 'relu', 'drop_p_g_net': 0.016804350658416966, 'n_hidden_layers_h_net': 1, 'hidden_dims_h_net': 16, 'af_h_net': 'tanh', 'drop_p_h_net': 0.08157230505460664}. Best is trial 14 with value: 0.03627271205186844.
2025-05-24 10:52:56,811 - INFO - Trial 27 finished with value: 0.07239773124456406 and parameters: {'lr': 0.0019531297081194364, 'lamb': 0.0, 'batch_size': 16, 'n_hidden_layers_g_net': 2, 'hidden_dims_g_net': 64, 'af_g_net': 'relu', 'drop_p_g_net': 0.005746263105567893, 'n_hidden_layers_h_net': 1, 'hidden_dims_h_net': 32, 'af_h_net': 'tanh', 'drop_p_h_net': 0.006699770918757575}. Best is trial 14 with value: 0.03627271205186844.
2025-05-24 10:53:34,270 - INFO - Trial 28 finished with value: 0.038884036242961884 and parameters: {'lr': 0.0073791641795111105, 'lamb': 0.0, 'batch_size': 16, 'n_hidden_layers_g_net': 2, 'hidden_dims_g_net': 56, 'af_g_net': 'relu', 'drop_p_g_net': 0.002186847512399919, 'n_hidden_layers_h_net': 1, 'hidden_dims_h_net': 24, 'af_h_net': 'softplus', 'drop_p_h_net': 0.0042028955345324885}. Best is trial 14 with value: 0.03627271205186844.
2025-05-24 10:54:17,702 - INFO - Trial 29 finished with value: 0.15242506563663483 and parameters: {'lr': 0.0035603955609134004, 'lamb': 0.0, 'batch_size': 16, 'n_hidden_layers_g_net': 2, 'hidden_dims_g_net': 40, 'af_g_net': 'tanh', 'drop_p_g_net': 0.012824851427118837, 'n_hidden_layers_h_net': 2, 'hidden_dims_h_net': 8, 'af_h_net': 'relu', 'drop_p_h_net': 0.00031532127638710545}. Best is trial 14 with value: 0.03627271205186844.
