A new study created in Journal with name: model-population-mpnn-population_mpnn_ic3_s5
Trial 0 finished with value: 0.00021123707119841129 and parameters: {'lr': 0.0014692536760780857, 'lamb': 0.0, 'batch_size': 16, 'n_hidden_layers_g_net': 1, 'hidden_dims_g_net': 64, 'af_g_net': 'relu', 'drop_p_g_net': 0.015088530575318098, 'n_hidden_layers_h_net': 2, 'hidden_dims_h_net': 40, 'af_h_net': 'tanh', 'drop_p_h_net': 0.00025282532113786595}. Best is trial 0 with value: 0.00021123707119841129.
Trial 4 finished with value: 0.0014180380385369062 and parameters: {'lr': 0.0007562255444220637, 'lamb': 0.0, 'batch_size': 16, 'n_hidden_layers_g_net': 1, 'hidden_dims_g_net': 24, 'af_g_net': 'softplus', 'drop_p_g_net': 0.03131714809359609, 'n_hidden_layers_h_net': 1, 'hidden_dims_h_net': 8, 'af_h_net': 'relu', 'drop_p_h_net': 0.14646229094329652}. Best is trial 0 with value: 0.00021123707119841129.
Trial 9 finished with value: 0.0001872399589046836 and parameters: {'lr': 0.002059081741606702, 'lamb': 0.0, 'batch_size': 16, 'n_hidden_layers_g_net': 1, 'hidden_dims_g_net': 56, 'af_g_net': 'relu', 'drop_p_g_net': 0.004208089362075401, 'n_hidden_layers_h_net': 2, 'hidden_dims_h_net': 40, 'af_h_net': 'tanh', 'drop_p_h_net': 0.000664886362847012}. Best is trial 9 with value: 0.0001872399589046836.
Trial 11 finished with value: 0.0007700931746512651 and parameters: {'lr': 0.011177082025559122, 'lamb': 0.0, 'batch_size': 32, 'n_hidden_layers_g_net': 1, 'hidden_dims_g_net': 8, 'af_g_net': 'tanh', 'drop_p_g_net': 0.0438722643046202, 'n_hidden_layers_h_net': 2, 'hidden_dims_h_net': 32, 'af_h_net': 'softplus', 'drop_p_h_net': 0.0035561088351378596}. Best is trial 15 with value: 0.00018026219913735986.
Trial 19 finished with value: 0.0002449069870635867 and parameters: {'lr': 0.0036028890041564336, 'lamb': 0.0, 'batch_size': 16, 'n_hidden_layers_g_net': 2, 'hidden_dims_g_net': 32, 'af_g_net': 'softplus', 'drop_p_g_net': 0.0012996514585674455, 'n_hidden_layers_h_net': 1, 'hidden_dims_h_net': 24, 'af_h_net': 'relu', 'drop_p_h_net': 0.019592201618306295}. Best is trial 15 with value: 0.00018026219913735986.
Trial 22 finished with value: 0.00023747076920699328 and parameters: {'lr': 0.005440273511522276, 'lamb': 0.0, 'batch_size': 16, 'n_hidden_layers_g_net': 2, 'hidden_dims_g_net': 48, 'af_g_net': 'relu', 'drop_p_g_net': 0.00021364123041579081, 'n_hidden_layers_h_net': 1, 'hidden_dims_h_net': 56, 'af_h_net': 'tanh', 'drop_p_h_net': 0.03260912797770693}. Best is trial 15 with value: 0.00018026219913735986.
Trial 24 finished with value: 0.00018329500744584948 and parameters: {'lr': 0.0027808407558722326, 'lamb': 0.0, 'batch_size': 16, 'n_hidden_layers_g_net': 1, 'hidden_dims_g_net': 56, 'af_g_net': 'relu', 'drop_p_g_net': 0.007269211199374429, 'n_hidden_layers_h_net': 1, 'hidden_dims_h_net': 40, 'af_h_net': 'tanh', 'drop_p_h_net': 0.0014451460818911775}. Best is trial 21 with value: 0.00016929360572248697.
Trial 26 finished with value: 0.000162272117449902 and parameters: {'lr': 0.0022499388918259654, 'lamb': 0.0, 'batch_size': 16, 'n_hidden_layers_g_net': 2, 'hidden_dims_g_net': 48, 'af_g_net': 'relu', 'drop_p_g_net': 0.0005846982785471958, 'n_hidden_layers_h_net': 1, 'hidden_dims_h_net': 48, 'af_h_net': 'tanh', 'drop_p_h_net': 0.0014448999767066816}. Best is trial 26 with value: 0.000162272117449902.
Trial 28 finished with value: 0.000275462050922215 and parameters: {'lr': 0.0005232920305017806, 'lamb': 0.0, 'batch_size': 16, 'n_hidden_layers_g_net': 2, 'hidden_dims_g_net': 24, 'af_g_net': 'relu', 'drop_p_g_net': 0.00010470647851214524, 'n_hidden_layers_h_net': 1, 'hidden_dims_h_net': 56, 'af_h_net': 'tanh', 'drop_p_h_net': 0.0773062641774423}. Best is trial 26 with value: 0.000162272117449902.
Trial 29 finished with value: 0.00032967745210044086 and parameters: {'lr': 0.01959269968804464, 'lamb': 0.0, 'batch_size': 16, 'n_hidden_layers_g_net': 2, 'hidden_dims_g_net': 48, 'af_g_net': 'relu', 'drop_p_g_net': 0.0005406430865840081, 'n_hidden_layers_h_net': 1, 'hidden_dims_h_net': 64, 'af_h_net': 'tanh', 'drop_p_h_net': 0.00917251847952409}. Best is trial 26 with value: 0.000162272117449902.
